,id,meta1,meta2,titre_poste,entreprise,localisation,contrat,salaire,date_publication,keyword_metier,keyword_localisation,description
28,https://www.indeed.fr/emplois?q=Data%20manager&l=Bordeaux&radius=100&limit=100&sort=date&vjk=def587533e831ef7,"EXPERT TECHNIQUE UNIX VSPHERE (H/F)
Atos2,178 avis - Bordeaux (33)",['Bordeaux (33)'],EXPERT TECHNIQUE UNIX VSPHERE (H/F),Atos,- Bordeaux (33),null,null,"il y a 28 jours
- Continuer pour postuler
Signaler cette offre d'emploi",Data manager,Bordeaux,"Atos est un leader international de la transformation digitale avec plus de 110 000 collaborateurs dans 73 pays et un chiffre d’affaires annuel de plus de 11 milliards d’euros. Numéro un européen du Cloud, de la cybersécurité et des supercalculateurs, le groupe fournit des solutions intégrées de Cloud Hybride Orchestré, Big Data, Applications Métiers et Environnement de Travail Connecté. Partenaire informatique mondial des Jeux Olympiques et Paralympiques, le Groupe exerce ses activités sous les marques Atos, Atos Syntel, et Unify. Atos est une SE (Société Européenne) cotée sur Euronext Paris et fait partie de l’indice CAC 40.

La raison d’être d’Atos est de contribuer à façonner l’espace informationnel. Avec ses compétences et ses services, le groupe supporte le développement de la connaissance, de l’éducation et de la recherche dans une approche pluriculturelle et contribue au développement de l’excellence scientifique et technologique. Partout dans le monde, Atos permet à ses clients et à ses collaborateurs, et plus généralement au plus grand nombre, de vivre, travailler et progresser durablement et en toute confiance dans l’espace informationnel.

Au sein du centre de service dédié aux moyens de développement en Informatique Distribuée votre mission est d’assurer l’administration des socles (systèmes, serveurs d’applications et SGBD)
Valider, normaliser et améliorer les procédés d’installation des socles
Installer, mettre à jour et fiabiliser les plateformes
Valider les livraisons des fournisseurs et vers les clients
Résoudre les incidents et problèmes N1, N2 et N3
Former et assister les nouveaux administrateurs du centre de service
Assister les équipes projets de développements, tests et recettes
Capitaliser et vulgariser les connaissances

Unix (AIX) /etc/inittab /etc/rc.d => principes de démarrage / arrêt des composants LVM (gestion des disques : augmentation/réduction de LV/FS) iptables
Linux (RedHat) rpm firewallcmd / iptables
Windows IIS, gestion des certifs
Shell Unix (ksh)

- Vous avez des Notions de réseau :
Telnet / nc (netcat)
Tcpdump & si possible Wireshark : capture et analyse trames réseau
des notions de VLAN, gateway, routes

- Notions sécurité :
Comprendre la notion de PKI (autorité de certification/cn de certificat, fingerprint)
Gestion des trousseaux (.p12/.jks/.kdb), des clés (privées/publiques) et des formats (ASCII base 64/binaire)
Outils de conversion/extraction certificat : gsk7cmd (AIX/IHS) / keytool / openssl

Composants :
Apache / IHS (IBM Http Server) : lire et comprendre une configuration standard et SSL

Vous connaissez les Bases de données :
Oracle : comprendre les principes de connexion à une base
Langage SQL
LDAP

Et si vous êtes à l'aise aussi avec ces compétences ANSIBLE TAM - IBM Tivoli Access Manager (Webseal/Policy Director) IBM Websphere Jboss openshift DB2 LUW / Couchbase / SqlServer / Sybase /mySQL / postGre Mainframe z/OS (CTG/WOR/AOR) CFT / MQ Series

Vous êtes un bon communiquant, autonome et dynamique
#JoinAtosTeam

De formation Bac + 4/5 (en école d’ingénieur ou université) vous possédez une expérience d’au moins 4-5 ans sur une mission d’administrateur Système.

Vous êtes créatif (ve), avez le sens du travail en équipe et maîtrisez l’anglais
Votre pro-activité, rigueur et passion pour les nouvelles technologies et les métiers du développement logiciel, seront les facteurs clés de votre réussite au sein du groupe.

Vous possédez une culture large des métiers de l’informatique et des technologies actuelles.
Vous êtes reconnu pour vos qualités relationnelles, votre esprit d’équipe, vos capacités d’analyse et de synthèse, votre sens du service et votre engagement.

Ce poste est rattaché à notre agence de Bordeaux. Rejoignez-nous et révélez-vous chez ATOS

Chez Atos la diversité est au cœur de notre politique RH. C'est pourquoi Atos a mis en place un accord relatif à l’égalité professionnelle entre les hommes et les femmes. Par ailleurs, nos métiers sont tous accessibles aux personnes en situation de handicap, et ce quelle que soit la nature de leur handicap."
29,https://www.indeed.fr/emplois?q=Data%20manager&l=Bordeaux&radius=100&limit=100&sort=date&vjk=1ebc33cbcf2019b0,"SCRUM Master (H/F)
ACTIVUS Group - Bordeaux (33)","['Bordeaux (33)', 'Temps plein, CDI']",SCRUM Master (H/F),ACTIVUS Group,- Bordeaux (33),"Temps plein, CDI",null,"il y a 30+ jours
Signaler cette offre d'emploi",Data manager,Bordeaux,"Pour renforcer notre pôleApplications Digitales, nous recrutons un SCRUM Master - développeur Java 7, Angular 5-6.
Vos principales missions, si vous les acceptez!
Accompagner nos clients dans leur transformation vers l’AGILE
Relation avec les managers et les product Owner
Animer et contribuer à la réussite des cérémonies
Accompagner les entités Business afin de les intégrer dans le process AGILE
Participation à des phases dedéveloppement sur Angular 5-6 et Java 7au sein de l'équipe de développement
Notre Agilité associée à la diversité de nos clients grands-comptes dans les secteurs de la santé, du transport, de la grande distribution, des Télécoms, de la banque et de l'assurance, offrent aujourd’hui à nos équipes de nombreuses perspectives d’évolution.
PROFIL
Titulaire d'un Bac+5, vous justifiez d'au moins 3 années d'expérience sur un poste similaire. Ce poste est proposé pour des missions longues dans l’équipe de notre client, il nécessite de posséder un esprit geek allié à une expérience de SCRUM Master.
Vous maitrisez les outils et les méthodologies de gestion de projets et savez utiliser les outils collaboratifs (Dropbox, Google Drive…). Une expérience en tant que développeur Java 7 ou Angular 5/6 sera fortement appréciée.
Passionné(e) par la technologie et par les relations humaines, vous souhaitez retrouver une ambiance de société de service de proximité qui saura accompagner votre évolution.
Vous avez un esprit de synthèse et d’analyse et une aisance relationnelle. Notre dynamisme et les projets innovants sur lesquels nous évoluons constituent pour ceux qui nous rejoignent une motivation remplie de perspectives.
Alors! Serez-vous des nôtres ?
ACTIVUS
ACTIVUS-Group est une société de conseil de croissance qui, en 4 ans, est devenue experte dans ses domaines d’intervention :
IA, Big Data, Analytics, DataScience
Conseil et Audit
User Experience et Mobile Apps, DataVizualisation
Sécurité des Systèmes
Infrastructures Cloud et SaaS
Process Industriels
Nous entretenons avec nos partenaires une relation de confiance solide et durable qui s’appuie sur la proximité de nos équipes et l’expertise de nos consultants.
Notre, équipe composée de technophiles passionnés, renforce tous les jours notre ADN par son excellence technologique.
En 2019 notre groupe double ses effectifs en recrutant 100 nouveaux consultants sur tous nos domaines d’expertise.
En complément de nos implantations de proximité à Toulouse et Paris, nous poursuivons notre maillage local en ouvrant quatre agences à : Bordeaux, Lyon, Nantes, Aix/Marseille.
Nous recrutons aussi sur Hambourg, en République Tchèque et en Suisse.
Type d'emploi : Temps plein, CDI"
30,https://www.indeed.fr/emplois?q=Data%20manager&l=Bordeaux&radius=100&limit=100&sort=date&vjk=9edab6af2ca10e71,"Ingénieur système (H/F)
Atos2,178 avis - Bordeaux (33)",['Bordeaux (33)'],Ingénieur système (H/F),Atos,- Bordeaux (33),null,null,"il y a 30+ jours
- Continuer pour postuler
Signaler cette offre d'emploi",Data manager,Bordeaux,"À propos d’Atos
Atos est un leader international de la transformation digitale avec plus de 110 000 collaborateurs dans 73 pays et un chiffre d’affaires annuel de plus de 11 milliards d’euros. Numéro un européen du Cloud, de la cybersécurité et des supercalculateurs, le groupe fournit des solutions intégrées de Cloud Hybride Orchestré, Big Data, Applications Métiers et Environnement de Travail Connecté. Partenaire informatique mondial des Jeux Olympiques et Paralympiques, le Groupe exerce ses activités sous les marques Atos, Atos Syntel, et Unify. Atos est une SE (Société Européenne) cotée sur Euronext Paris et fait partie de l’indice CAC 40.
La raison d’être d’Atos est de contribuer à façonner l’espace informationnel. Avec ses compétences et ses services, le groupe supporte le développement de la connaissance, de l’éducation et de la recherche dans une approche pluriculturelle et contribue au développement de l’excellence scientifique et technologique. Partout dans le monde, Atos permet à ses clients et à ses collaborateurs, et plus généralement au plus grand nombre, de vivre, travailler et progresser durablement et en toute confiance dans l’espace informationnel.

Si vous êtes titulaire d'un BAC + 2/4 et si vous être très à l'aise en anglais
Vous êtes curieux d’esprit et avez envie d’aller plus loin,
Vous faites preuve d’adaptabilité et êtes résistant au stress,
Vous êtes rigoureux et tenace,
Vous aimez travailler en équipe et savez être à l’écoute.

Alors Atos peut vous accompagner et vous offrir de réelles perspectives au travers des postes de PTC (Project Technical Coordinator).

Cette fonction peut vous emmener :
vers des horizons lointains, parfois exotiques en suivant les traces de Magellan,
vers des aventures hors du commun comme a fait Roald Amundsen,
vers des découvertes déroutantes sans céder au chant des sirènes,
vers des envolées symphoniques comme aurait dirigé Sir Colin Davis.

Etes-vous prêts à vous embarquer vers ce nouveau monde ?

Dans le de cadre d’un projet pour l’un de nos clients grand compte, nous recherchons de nouveaux collaborateurs pour piloter des projets de déploiements infrastructure dans un contexte international.

Intégré(e) à la cellule Chefs de projets infrastructure, vous devrez assurer les différentes missions suivantes:
Suivre de bout en bout le déploiement d’une infrastructure en faisant appel aux équipes techniques à disposition.
Appliquer la méthodologie projet propre au client.
Adapter les pratiques et le processus de suivi de projet.
Suivre l’état d’avancement et remonter les informations aux différentes instances.
Capitaliser l’expérience afin d’améliorer l’efficacité des déploiements.

Le poste en quelques mots :
Au quotidien vous pilotez le déploiement d’infrastructures métiers à destination des différents sites du client, situés aux quatre coins du globe.
Vous dirigez les réunions d’avancement avec les différents intervenants.
Vous rapportez à votre Program Manager les avancées des projets et proposez des améliorations dans le process global.

Vous reconnaissez vous ?
Rigoureux, autonome et organisé
Relationnel de haut niveau et capacité à organiser des réunions de suivi avec les différents acteurs
Sens du service et travail en équipe
Capacité d’analyse et d’adaptation à l’imprévu

Vous avez une bonne connaissance
De l'administration des bases de données
de Monitoring Tool administration
de l'Exploitation (Middlewares)
Systems, including:
UNIX and Linux
Windows and virtualization
Backup and storage
Network operations (LAN, WiFi, Firewall, ReverseProxy and IPS).

Vous possédez une culture large des métiers de l’informatique et des technologies actuelles.
Ce poste est rattaché à notre agence de Bordeaux. Rejoignez-nous et révélez-vous chez ATOS !
Chez Atos la diversité est au cœur de notre politique RH. C'est pourquoi nos métiers sont tous accessibles aux personnes en situation de handicap, et ce quelle que soit la nature de leur handicap.

Welcome on board !

INFORMATIONS ADDITIONNELLES :
Chez Atos la diversité est au cœur de notre politique RH. C'est pourquoi Atos a mis en place un accord relatif à l’égalité professionnelle entre les hommes et les femmes. Par ailleurs, nos métiers sont tous accessibles aux personnes en situation de handicap, et ce quelle que soit la nature de leur handicap."
31,https://www.indeed.fr/emplois?q=Data%20manager&l=Bordeaux&radius=100&limit=100&sort=date&vjk=1306a8e8181c24dd,"Stage chargé de mission développement RH H/F
Safran2,749 avis - La Teste-de-Buch (33)","['La Teste-de-Buch (33)', 'Temps plein, Stage']",Stage chargé de mission développement RH H/F,Safran,- La Teste-de-Buch (33),"Temps plein, Stage",null,"il y a 30+ jours
- Continuer pour postuler
Signaler cette offre d'emploi",Data manager,Bordeaux,"Safran est un groupe international de haute technologie opérant dans les domaines de la propulsion et des équipements aéronautiques, de l'espace et de la défense. Implanté sur tous les continents, le Groupe emploie plus de 92 000 collaborateurs pour un chiffre d'affaires de 21 milliards d'euros en 2018. Safran occupe, seul ou en partenariat, des positions de premier plan mondial ou européen sur ses marchés. Pour répondre à l'évolution des marchés, le Groupe s'engage dans des programmes de recherche et développement qui ont représenté en 2018 des dépenses d'environ 1,5 milliard d'euros.
Safran est classé dans le Top 100 Global Innovators de Thomson Reuters ainsi que dans le palmarès « Happy at work » des sociétés où il fait bon vivre. Le Groupe est en 4ème position du classement Universum des entreprises préférées des jeunes ingénieurs en France.

Zodiac Data Systems, entité du groupe Safran, emploi plus de 600 salariés en Europe et aux Etats-Unis afin de concevoir et fabriquer une large gamme de produits et solutions dans les domaines de la télémesure bord & sol, du traitement embarqué de l'information, de l'acquisition et enregistrement de données, du contrôle satellite et de la télédéction.

Notre établissement d'Arcachon, propose à nos clients des stations pour la télémesure sol et pour les communications par satellite au travers de systèmes d'antennes paraboliques. Ces dernières ont un diamètre variant de 1m à 11m, dans les bandes de fréquences de 1 à 30 GHz.

Vous êtes communicant et dynamique, motivé pour contribuer à la définition d'une politique Formation et Développement des compétences adaptée aux enjeux de l'entreprise et de ses salariés. Nous recherchons pour un stage de 6 mois un Chargé de Mission Développement RH orienté Formation/Développement des compétences.

Description:
Au sein du pôle formation et développement des Compétences, vous participez au bon déploiement de la politique et du plan de développement des compétences de la société (3 sites) :

1/ Plan annuel de développement des compétences :
Vous participez à la finalisation de la formalisation du process, des outils et KPI's,
Vous participez à sa communication et son déploiement sur l'ensemble des sites avec les RH locaux,
Vous participez au recensement des besoins et à l'élaboration du plan de formation 2020,
Vous assurez la mise en œuvre administrative d'une partie des formations conformément aux engagements du plan 2019,
Vous gérez les relations avec les organismes de formation pour l'établissement des conventions.
2/ Knowledge transfert:
Vous participez à la mise en œuvre d'un plan de transmission des compétences au sein de l'entreprise. A l'aide des outils Groupe existants, vous proposez un plan d'accompagnement des managers pour leur permettre de construire une démarche de transmission, d'anticiper la mobilité des collaborateurs, d'identifier les compétences à préserver et de s'assurer de cette transmission.
3/ Projets RH transverses :
Vous participez aux différents groupes de travail sur les sujets tels que l'intégration, la gestion des carrières, plan de recrutement, rémunérations & avantages.
Les missions ci-dessus ne sont pas exhaustives. En fonction du profil (précédentes expériences, diplôme préparé…), les missions pourront être adaptées.
Votre profil

Formation :
De formation Ecoles de Commerce/ Universités M2 en Ressources Humaines
Bac+5

Aptitudes et expériences souhaitées :
Expérience préalable en Ressources Humaines
Maîtrise du Pack Office (Excel / PowerPoint)
Autonomie, proactivité
Bonne capacité relationnelle et aisance dans la communication, esprit de service et d'équipe
Capacités rédactionnelles / Esprit de synthèse"
32,https://www.indeed.fr/emplois?q=Data%20manager&l=Bordeaux&radius=100&limit=100&sort=date&vjk=880ba2d697eb991e,"Technicien d'affaires F/H
Vinci Energies103 avis - La Réunion (47)","['La Réunion (47)', 'CDI']",Technicien d'affaires F/H,Vinci Energies,- La Réunion (47),CDI,null,"VINCI - il y a 30+ jours
- Continuer pour postuler
Signaler cette offre d'emploi",Data manager,Bordeaux,"ATEXIA Projets réalise des travaux électricité tertiaire dans le domaine des courants forts et faibles. Notre vocation est la construction, réhabilitation & optimisation énergétique en proposant des solutions adaptées et pérennes grâce aux compétences de nos équipes.
Nous intervenons dans les domaines suivants : Grandes et Moyennes Surfaces, Bureaux / Entrepôts, Education, culture, Sports et Loisirs, Santé, Hôtellerie, Défense, banques et assurances.
Avec un chiffre d’affaires de 6 M€ par an et la participation de 31 collaborateurs, nous travaillons sur des projets d’envergure, que ce soit d’un point de vue technique ou financier.
ATEXIA a son siège situé à la Possession, notre situation géographique nous permet d’être réactif et proche de nos clients sur l’ensemble de l’ile de La Réunion.
Dans le cadre de notre développement nous recherchons : UN(E) TECHNICIEN
D’AFFAIRES F/H
Vos missions :
Rattaché à un Responsable d’affaire, vous l’accompagnerez dans la proposition de prestations globales apportées à nos clients. Vous contribuerez à ses côtés à l’animation et au développement du projet. Vous :
Participer au suivi du projet (de sa phase de lancement à la phase de réception)
Assurer la création, le suivi et l’envoi des devis
Assurer la conception et les études chantiers en lien avec le responsable d’affaires et le bureau d’étude
Suivre la gestion du projet en collaborant avec les responsables d’affaires
Soutenir nos offres marketing
Contribuer à la planification et l’organisation humaine et matériel du projet
Manager et superviser les équipes de techniciens et de chantiers

Profil :
Votre profil :
De formation BAC+3 à Bac+5 vous avez une première expérience de 5 ans minimum au sein d’une équipe projet et dans l’activité Tertiaire.
Organisé(e) et réactif(ve), vous avez un bon relationnel. Votre esprit d’entrepreneur et votre capacité à travailler en équipe faciliteront votre intégration et votre réussite dans ce poste. Rigoureux(se), vous avez une vision globale sur tous les aspects d’un projet : contractuel, commercial, financier…
En rejoignant notre structure, vous découvrirez une organisation décentralisée
proche des enjeux locaux et collaborant en réseaux avec l’ensemble des entités du Groupe. Vous découvrirez également une culture d’entrepreneur, d’autonomie, de confiance et de solidarité.

Entité de rattachement :
Connexion, performance, efficience énergétique, datas : dans un monde en évolution permanente, VINCI Energies accélère le déploiement des nouvelles technologies pour concrétiser deux mutations majeures : la transformation digitale et la transition énergétique. Ancrées dans les territoires et organisées en mode agile, les entreprises de VINCI Energies rendent les infrastructures d'énergie, de transport et de communication, les usines ainsi que les bâtiments chaque jour plus fiables, plus sûrs, plus efficients. 2018 : 12,6 milliards d'euros (chiffre d'affaires) // 77 500 collaborateurs // 1800 entreprises // 53 pays"
33,https://www.indeed.fr/emplois?q=Data%20manager&l=Bordeaux&radius=100&limit=100&sort=date&vjk=917decabe2e4d01e,"Expert Python Bordeaux F/H
KEYRUS13 avis - Bordeaux (33)","['Bordeaux (33)', 'CDI']",Expert Python Bordeaux F/H,KEYRUS,- Bordeaux (33),CDI,null,"Apec.fr - il y a 30+ jours
- Continuer pour postuler
Signaler cette offre d'emploi",Data manager,Bordeaux,"Vous êtes ambitieux(se) et souhaitez intégrer un groupe agile et international où vos qualités professionnelles et personnelles seront reconnues et cultivées ?

Pour cela

,

Nous vous proposons de nous rejoindre et d’intégrer notre agence de Bordeaux !

Nos maîtres mots sont

AGILITE, EXPERTISE, DIVERSITE

.

Notre ADN ?

Innover et entreprendre.

Bordeaux recherche son Expert Python

Vos missions :
Au sein de la Direction de l'ingénierie logicielle et de l'équipe des référents python, vous mettrez vos compétences au service de la Data Science du client.

En tant qu'expert python vous réalisez :
la conception, l'architecture et le développement logiciel Python (librairies, modules)
le débogage et l'assistance auprès de nos équipes Data Science
l'industrialisation de nos processus de déploiement
l’automatisation des tests fonctionnels
Profil recherché Votre profil :
Vous maîtrisez parfaitement Python, pour avoir travaillé dessus un minimum de 5 ans.

Votre boîte à outils compte également de belles compétences en Docker, Kubernetes et en BDD Mongo DB/SQL pour les avoir manipulées à minima 2 ans.

Vous êtes doté(e) d’une très bonne aisance relationnelle, vous n’avez pas peur d’aller chercher des informations.

En outre, vous avez envie d’animer une communauté technique, de participer à des meet up…. Et de partager vos connaissances.

Pourquoi nous rejoindre ?

Parce que notre équipe saura vous accueillir et votre manager vous accompagner dans votre épanouissement professionnel.

Keyrus est une entreprise où il fait bon vivre et travailler !
Entreprise Qui sommes-nous ?

Une success story dans la Data et le Digital !

Notre mission ? Des projets à forte valeur ajoutée pour accroître la performance et la compétitivité des entreprises, faciliter et accélérer leur transformation.

Notre expertise depuis plus de 20 ans ? Le conseil et l'intégration de solutions innovantes autour de trois domaines :

Data Intelligence Business Intelligence et Big Data & Analytics

Digital Experience Conseil, Stratégie & Performance Digitales

Conseil en Management & Transformation Pilotage de la Performance & Accompagnement des Projets

Nous sommes plus de 3200 talents sur plus de 18 pays et 4 continents. Notre ADN ? Innover et entreprendre."
