,id,meta1,meta2,titre_poste,entreprise,localisation,contrat,salaire,date_publication,keyword_metier,keyword_localisation,description
58,https://www.indeed.fr/jobs?q=Data%20manager&l=Bordeaux&radius=100&sort=date&limit=50&start=50&vjk=f9e0544b05bfc0f6,"Ingénieur AMOA – Analyste Fonctionnel
Groupe SII4 avis - Bordeaux (33)",['Bordeaux (33)'],Ingénieur AMOA – Analyste Fonctionnel,Groupe SII,- Bordeaux (33),null,null,"il y a 30+ jours
- Continuer pour postuler
Signaler cette offre d'emploi",Data manager,Bordeaux,"Description du poste :
SII Bordeaux recherche son ou sa futur(e) AMOA – Analyste Fonctionnel (elle)
Concrètement, quel serait ton rôle ?

Appréhender les besoins et nouveaux usages via des ateliers Métiers
Coordonner de façon transverse et animer les Workshop
Etudier, analyser les expressions de besoins
Réaliser la conception fonctionnelle et formaliser les spécifications fonctionnelles (incluant la modélisation des objets métier)
Avoir une sensibilité pour le domaine technique
Piloter et gérer des activités en mode projet (projet AGILE)
Prise de recul sur l’activité quotidienne : constater, analyser, proposer et engager des actions d’amélioration continue
Contribuer à la définition des stratégies de recette et d’expérimentation auprès des utilisateurs
Accompagner les utilisateurs et remonter leurs attentes de manière itérative dans une optique d’amélioration continue

Et si tu veux évoluer ? La formation est l’un des piliers chez SII, nous t’accompagnons dans ton projet d’évolution et te trouverons une mission cohérente vis-à-vis de ce projet.
Au-delà de ta mission, nous te proposons de participer à la vie de l’agence : retrouver tes collègues autour de déjeuners techniques ou métiers, intégrer les communautés pour partager, échanger lors des soirées d’agence et participer au projet de développement de l’entreprise.
Profil:
Afin que cette mission soit couronnée de succès une expérience similaire d’au moins 3 ans sur ce type de poste est nécessaire. Maitrise de l’agilité est un plus mais pas obligatoire

Tu veux en savoir plus ? Nous serons ravis de te rencontrer et de t’en dire plus !
Suis nous sur les réseaux sociaux : Linkedin ou Twitter :@SIISudOuest!
Au palmarès Great place To Work 2019 SII a également été labélisé Happy Candidate et Meilleur Employeur 2018 par la revue Capital.
Le Groupe SII est signataire de la Charte de la diversité en entreprise et est une entreprise handi-accueillante.

Entreprise
SII Bordeaux c’est :
130 Fungénieurs qui partagent un même esprit #collectif #partage
Des clients Grands Comptes qui t’apporteront de la richesse technique, fonctionnelle et méthodologique
Un suivi régulier et personnalisé : ton manager, ta référente RH et ta référente administrative seront là pour t’accompagner dans l’aventure SII
Des moments de fun et de partage : AfterWorks, Soirées d’agence, événements sportifs, petits déjeuners …
Des speak up (conférences technique/métiers animées par des consultants SII => peut être toi J)
Des formations régulières adaptées à tes envies et à ton évolution
Dynamisme, Confiance, Innovation et Autonomie sont nos leitmotivs !
Intégrer SII Sud-Ouest (800 collaborateurs), c’est travailler sur des sujets innovants avec des #Fungénieurs créatifs. Pour nous, la proximité avec nos collaborateurs est une de nos priorités.
Pour accompagner votre carrière, nous vous proposons d’être membre d’une communauté technique correspondant à vos centres d’intérêts : «Big Data», «Front-end IHM», «Back end – Architecture logicielle», «Sécurité, architecture technique, devops », «Aéronautique» ou «Simulation, Modélisation».
N’attendez plus, rejoignez le mouvement #Fungénieur : Bien plus qu’un métier, une philosophie !
Compétences :
Référence de l’annonce :
D/BDX/AMOA
Expérience:
2-5 ans
Qualification:
Consultant
Rémunération:
Selon profil

POSTULER"
59,https://www.indeed.fr/jobs?q=Data%20manager&l=Bordeaux&radius=100&sort=date&limit=50&start=50&vjk=a687a0cc9afb5989,"Chef de mission / Manager audit H/F
PwC6,978 avis - Bordeaux (33)",['Bordeaux (33)'],Chef de mission / Manager audit H/F,PwC,- Bordeaux (33),null,null,"il y a 30+ jours
- Continuer pour postuler
Signaler cette offre d'emploi",Data manager,Bordeaux,"Cabinet d'audit et de conseil, PwC est un réseau international de 236 000 collaborateurs dans le monde dont 6400 en France & Afrique francophone. Acteur engagé, PwC continue sa transformation pour renforcer la confiance sur le marché et accompagner les acteurs de l'économie dans leur réussite, à travers des missions d'audit, d'expertise comptable et de conseil (stratégie, management, transactions, cybersécurité, data & analytics, juridique & fiscal).

Ligne de métier

Advisory
Secteur / Industrie

Not Applicable
Spécialisation

Entrepreneurial & Private Business (EPB) - Private Clients
Grade

Manager
Description de l’offre

PwC pour les Entrepreneurs accompagne les PME et leurs dirigeants dans toutes les étapes
de la vie de leur entreprise de la création à la transmission. PwC pour les Entrepreneurs est une structure à taille humaine au sein d’un groupe d’envergure internationale. Nous rejoindre, c’est intégrer une équipe de 700 personnes basées dans 21 bureaux afin de conseiller les Entrepreneurs et Dirigeants d’entreprises en région.
Au-delà de nos missions traditionnelles de comptabilité, juridique et fiscal, paie et social, commissariat aux comptes, nous proposons des missions de conseil qui requièrent des compétences diverses. Nous recrutons donc des profils variés pour accompagner nos clients
Entrepreneurs dans la durée.

Rejoignez nos équipes Bordelaises

PwC pour les Entrepreneurs à Bordeaux c’est une équipe jeune et dynamique d’une quarantaine de collaborateurs qui accompagne au quotidien les belles PME de la région. Vous intégrerez notre équipe d’auditeurs. Notre bureau est en croissance, nous recherchons donc une personne motivée pour prendre part à nos projets de développement.

Pourquoi choisir de nous rejoindre ?

PwC pour les Entrepreneurs Bordeaux accompagne de très belles PME du Sud-Ouest, en choisissant de nous rejoindre vous aurez l’opportunité de travailler sur un portefeuille attractif, avec de belles références dans le secteur viticole notamment. Vous accompagnerez nos clients dans la durée sur des missions classiques de commissariat aux comptes mais également sur des missions complémentaires.

Au sein d’une équipe dédiée à l’audit PME vous pourrez intervenir sur certains dossiers complexes accompagné(e) d’un Directeur de mission mais également sur des dossiers plus simples en lien direct avec l’Associé(e).

Enfin dans un contexte de croissance, ce poste présente de réelles possibilités d’évolution professionnelle pour un candidat capable de se développer rapidement au sein de notre structure.

Qu’attendons nous de vous ?

Vous êtes dynamique, vous faites preuve de rigueur, vous avez le sens du service client et le goût du travail en équipe. Alors vous remplissez déjà la majorité des critères essentiels pour nous rejoindre…

Si en plus vous possédez :
une expérience de 5 ans en Audit,
une formation Bac +4/5 de type DSCG, Master CCA ou Ecole de commerce avec une spécialisation dans le domaine de l’Audit, de l’Expertise Comptable ou de la Finance d’entreprise
un anglais opérationnel
…alors nous souhaitons vraiment vous rencontrer. N’hésitez plus postulez et rejoignez-nous pour accompagner les Entrepreneurs de Nouvelle-Aquitaine !

Formation

Degrees/Field of Study required:Degrees/Field of Study preferred:
Diplômes

Langues

Déplacements à prévoir

Not Specified
Poste éligible avec un permis de travail

Yes
Autorisation gouvernementale requise

Yes
Fin de validité du poste

N'attendez plus, rejoignez-nous!

Référence de l'offre: 77439WD

Ville: Bordeaux

Ligne de métier: Advisory

Spécialisation: Entrepreneurial & Private Business (EPB) - Private Clients

Grade: Manager"
60,https://www.indeed.fr/jobs?q=Data%20manager&l=Bordeaux&radius=100&sort=date&limit=50&start=50&vjk=34350544abd72650,"Data Manager / Développeur SQL
S&D Développement - Mérignac (33)","['Mérignac (33)', 'Temps plein, CDI', '30 000 € - 40 000 € par an']",Data Manager / Développeur SQL,S&D Développement,- Mérignac (33),"Temps plein, CDI",30 000 € - 40 000 € par an,"il y a 30+ jours
Signaler cette offre d'emploi",Data manager,Bordeaux,"Sous la responsabilité du DSI, le Data Manager / Développeur SQL aura pour mission d'organiser et de gérer les données du groupe au sein de nos bases de données SQL Server.
Il est le garant de l'intégrité des bases et les connait suffisamment pour extraire un jeu de données à des fins d'analyse à la demande des différents métiers du groupe.
Organisation et gestion des données :
Créer et/ou modifier des tables, vues, et procédures stockées pour répondre aux besoins des équipes informatiques et de business intelligence.
Surveiller les problèmes de performance dus à des requêtes mal écrites et les corriger ou remonter le problème au reste de l'équipe.
Surveiller la cohérence des données et détecter les anomalies.
Maintenir une documentation à jour.
Gestion des imports, exports et traitements internes de données
Mettre en place et gérer les travaux automatisés ou non de traitements de données entrants et sortants.
Gérer et surveiller les travaux internes des agents SQL Server.
Idéalement développer et / ou maintenir des outils externes afin d'automatiser certaines tâches d'import-export.
Traitement de bugs et analyse de cohérence des données.
En collaboration avec le reste de l'équipe, participer à la correction de bugs et à la recherche d'erreurs dans les données applicatives.
Proposer et participer à la mise en place de système de détection de données incohérentes dans les bases de données.
Extraction de données sur demande
A la demande des autres services du groupe, être capable d'extraire un jeu de données à des fins d'analyse.
Participer à la mise en place de rapports automatisés basés sur ces données.
Veille technologique.
Rester informé des nouveautés en termes de gestion des données et proposer des évolutions vers des nouvelles technologies à l'équipe quand des situations s'y prêtent.
Profil recherché
Vous justifiez d'une expérience de 3 années minimum à un poste similaire.
Vous connaissez parfaitement SQL Server, et maitrisez les langages de requête et la programmation T-SQL.
Une connaissance des modelés de données liés à la business intelligence (modèles en étoile) serait un plus.
Idéalement vous connaissez également des outils tels que Talend, Power BI, BO, SSIS, SSRS, et avec de bonnes notions en développement C#.
Votre bonne communication écrite et orale, votre aisance relationnelle et votre capacité à travailler en équipe sont des qualités essentielles pour ce poste.
Vous êtes autonome, rigoureux(se), organisé(e) et disponible rapidement.
Type d'emploi : Temps plein, CDI
Salaire : 30 000,00€ à 40 000,00€ /an"
61,https://www.indeed.fr/jobs?q=Data%20manager&l=Bordeaux&radius=100&sort=date&limit=50&start=50&vjk=2e4bebbab1a17ae8,"DATA SCIENTIST H/F
Ceva Santé Animale10 avis - Libourne (33)",['Libourne (33)'],DATA SCIENTIST H/F,Ceva Santé Animale,- Libourne (33),null,null,"CEVA Animal Health, LLC - il y a 30+ jours
- Continuer pour postuler
Signaler cette offre d'emploi",Data manager,Bordeaux,"Animé par le besoin d'innover, et bénéficiant d'une croissance soutenue, Ceva Santé Animale est l'un des acteurs les plus dynamiques parmi les 10 principaux groupes pharmaceutiques vétérinaires dans le monde. Implantés dans 50 pays, nos 5 000 salariés portent les valeurs du Groupe Ceva :
Passion du client, Innovation, Esprit entrepreneurial, Solidarité
Ceva propose depuis plusieurs années des services à ses clients autour de la donnée, et les renforce aujourd'hui grâce à la data science.
En tant que Data Scientist, vous développez des modèles pour aider nos clients - vétérinaires, éleveurs et intégrations agricoles - à valoriser leur activité, autour et au-delà de nos produits. L'objectif est de développer puis améliorer en continu ces modèles afin de garantir une expérience client optimale.
Vous travaillez en collaboration étroite avec nos clients en France et à l'international, avec les équipes métier (key account managers, services vétérinaires, franchise de chaque espèce) et les équipes IT. Des déplacements sont à prévoir.
Plus particulièrement :
Vous êtes responsables de développer, dans un cadre agile, des modules adaptés aux besoins de nos clients, pouvant aller du descriptif, au prédictif et prescriptif.
Vous aiderez nos équipes terrain dans la compréhension et l'analyse des données de nos clients, en développant avec eux des services adaptés autour de ces données.
Vous pilotez la construction de minimal viable products pour montrer la valeur de ces services, et coopérez avec les équipes IT pour l'industrialisation de ces services.
Vous contribuez à la gestion et gouvernance des données, en particulier celles provenant de nos clients et de leurs objets connectés IoT, en l'orientant vers le développement de ces services.
Vous gérez les éventuels problèmes autour de ces outils dans un but d'amélioration continue
Vous assurez la capitalisation, la diffusion des techniques en data science tout en continuant de compléter vos connaissances.
Vous travaillez en collaboration étroite avec les équipes terrain, IT et les clients dans la compréhension et l'analyse des données, pour développer ensemble des services adaptés
Profil & Compétences:
De formation supérieure, de type bac+ 5, idéalement dans le domaine des mathématiques, de la statistique, de l'informatique ou tout autre domaine lié à la donnée.
Vous justifiez d'une expérience professionnelle significative avec une exposition directe avec des métiers.
Vous avez une compréhension approfondie des concepts de modélisation statistique et prédictive, des approches de machine learning voire de deep learning, ainsi que des algorithmes de recommandation, d'optimisation et d'aide à la décision.
Vous êtes expert dans l'analyse d'ensembles de données, complexes et multidimensionnels.
Vous maitrisez de la manipulation de données en Python de préférence, et avec les outils de visualisations de données (type web app / javascript).
De tempérament collaboratif, autonome et proactif, facilitateur, orienté client, vous excellez à rendre les concepts complexes en concepts simples et faciles à comprendre par ceux qui vous entourent.
Une connaissance du monde de l'élevage serait un plus
Langue : Français et Anglais courant.
Ce poste en CDI est rattaché directement au Chief Data Officer, et sera basé à votre convenance en région parisienne ou en Gironde ( Libourne - 35km de Bordeaux)."
62,https://www.indeed.fr/jobs?q=Data%20manager&l=Bordeaux&radius=100&sort=date&limit=50&start=50&vjk=256ce97f07070808,"DATA SCIENTIST H/F
Ceva - Libourne (33)",['Libourne (33)'],DATA SCIENTIST H/F,Ceva,- Libourne (33),null,null,"il y a 30+ jours
- Continuer pour postuler
Signaler cette offre d'emploi",Data manager,Bordeaux,"Animé par le besoin d'innover, et bénéficiant d'une croissance soutenue, Ceva Santé Animale est l'un des acteurs les plus dynamiques parmi les 10 principaux groupes pharmaceutiques vétérinaires dans le monde. Implantés dans 50 pays, nos 5 000 salariés portent les valeurs du Groupe Ceva :
Passion du client, Innovation, Esprit entrepreneurial, Solidarité
Ceva propose depuis plusieurs années des services à ses clients autour de la donnée, et les renforce aujourd'hui grâce à la data science.
En tant que Data Scientist, vous développez des modèles pour aider nos clients - vétérinaires, éleveurs et intégrations agricoles - à valoriser leur activité, autour et au-delà de nos produits. L'objectif est de développer puis améliorer en continu ces modèles afin de garantir une expérience client optimale.
Vous travaillez en collaboration étroite avec nos clients en France et à l'international, avec les équipes métier (key account managers, services vétérinaires, franchise de chaque espèce) et les équipes IT. Des déplacements sont à prévoir.
Plus particulièrement :
Vous êtes responsables de développer, dans un cadre agile, des modules adaptés aux besoins de nos clients, pouvant aller du descriptif, au prédictif et prescriptif.
Vous aiderez nos équipes terrain dans la compréhension et l'analyse des données de nos clients, en développant avec eux des services adaptés autour de ces données.
Vous pilotez la construction de minimal viable products pour montrer la valeur de ces services, et coopérez avec les équipes IT pour l'industrialisation de ces services.
Vous contribuez à la gestion et gouvernance des données, en particulier celles provenant de nos clients et de leurs objets connectés IoT, en l'orientant vers le développement de ces services.
Vous gérez les éventuels problèmes autour de ces outils dans un but d'amélioration continue
Vous assurez la capitalisation, la diffusion des techniques en data science tout en continuant de compléter vos connaissances.
Vous travaillez en collaboration étroite avec les équipes terrain, IT et les clients dans la compréhension et l'analyse des données, pour développer ensemble des services adaptés
Profil & Compétences:
De formation supérieure, de type bac+ 5, idéalement dans le domaine des mathématiques, de la statistique, de l'informatique ou tout autre domaine lié à la donnée.
Vous justifiez d'une expérience professionnelle significative avec une exposition directe avec des métiers.
Vous avez une compréhension approfondie des concepts de modélisation statistique et prédictive, des approches de machine learning voire de deep learning, ainsi que des algorithmes de recommandation, d'optimisation et d'aide à la décision.
Vous êtes expert dans l'analyse d'ensembles de données, complexes et multidimensionnels.
Vous maitrisez de la manipulation de données en Python de préférence, et avec les outils de visualisations de données (type web app / javascript).
De tempérament collaboratif, autonome et proactif, facilitateur, orienté client, vous excellez à rendre les concepts complexes en concepts simples et faciles à comprendre par ceux qui vous entourent.
Une connaissance du monde de l'élevage serait un plus
Langue : Français et Anglais courant.
Ce poste en CDI est rattaché directement au Chief Data Officer, et sera basé à votre convenance en région parisienne ou en Gironde ( Libourne - 35km de Bordeaux)."
63,https://www.indeed.fr/jobs?q=Data%20manager&l=Bordeaux&radius=100&sort=date&limit=50&start=50&vjk=b74f9b32e08f13e7,"Ingénieur Modélisation Système H/F
Groupe SII4 avis - Bordeaux (33)",['Bordeaux (33)'],Ingénieur Modélisation Système H/F,Groupe SII,- Bordeaux (33),null,null,"il y a 4 mois
- Continuer pour postuler
Signaler cette offre d'emploi",Data manager,Bordeaux,"Description du poste :
SII Bordeaux recherche pour l’un de ses clients, acteur reconnu dans le secteur Aéronautique Spatial Défense, un Ingénieur Modélisation Architecture Système.


Dans le cadre de ce poste, tes missions seront les suivantes :
– Concevoir l’architecture du système global sous CAPELLA pour répondre aux besoins du client,
– Déployer l’architecture de base sous CAPELLA,
– Elaborer les documents de justification de l’architecture système retenue,
– Définir la stratégie du plan d’intégration et de validation afin de vérifier l’atteinte des performances attendues,
Profil:
De formation supérieure en ingénierie, tu as idéalement une expérience sur des missions de modélisation sous CAPELLA.
Tu as de l’intérêt dans le domaine de l’ingénierie système et architecture fonctionnelle. Tu as également des capacités en modélisation ainsi qu’en conceptualisation et une bonne maîtrise de l’outil CAPELLA.


Tu possèdes de réelles qualités relationnelles, d’écoute, d’expression, et es force de proposition.
Entreprise
SII Bordeaux c’est :
130 Fungénieurs qui partagent un même esprit #collectif #partage
Des clients Grands Comptes qui t’apporteront de la richesse technique, fonctionnelle et méthodologique
Un suivi régulier et personnalisé : ton manager, ta référente RH et ta référente administrative seront là pour t’accompagner dans l’aventure SII
Des moments de fun et de partage : AfterWorks, Soirées d’agence, événements sportifs, petits déjeuners …
Des speak up (conférences technique/métiers animées par des consultants SII => peut être toi J)
Des formations régulières adaptées à tes envies et à ton évolution
Dynamisme, Confiance, Innovation et Autonomie sont nos leitmotivs !
Intégrer SII Sud-Ouest (800 collaborateurs), c’est travailler sur des sujets innovants avec des #Fungénieurs créatifs. Pour nous, la proximité avec nos collaborateurs est une de nos priorités.
Pour accompagner votre carrière, nous vous proposons d’être membre d’une communauté technique correspondant à vos centres d’intérêts : «Big Data», «Front-end IHM», «Back end – Architecture logicielle», «Sécurité, architecture technique, devops », «Aéronautique» ou «Simulation, Modélisation».
N’attendez plus, rejoignez le mouvement #Fungénieur : Bien plus qu’un métier, une philosophie !
Compétences :
Référence de l’annonce :
D/BDX/CAP
Expérience:
Indifférent
Qualification:
Consultant
Rémunération:
Selon profil

POSTULER"
64,https://www.indeed.fr/jobs?q=Data%20manager&l=Bordeaux&radius=100&sort=date&limit=50&start=50&vjk=2e4655ef930b053b,"Product Manager Adjoint
Groupe SII4 avis - Bordeaux (33)",['Bordeaux (33)'],Product Manager Adjoint,Groupe SII,- Bordeaux (33),null,null,"il y a 4 mois
- Continuer pour postuler
Signaler cette offre d'emploi",Data manager,Bordeaux,"Description du poste :
SII Bordeaux recrute un Product Manager Adjoint pour l’un de ses clients majeur du secteur aéronautique, spatial et defence.
La mission consiste principalement à accompagner le PM à coordonner les activités de productions, en travaillant en collaboration avec les différents Responsables de Lots (RLT) de chaque secteur (8).
Quels sont les travaux à effectuer ?
– Réunions hebdomadaires d’avancement de l’assemblage avec les PM, Qualité et RLT des divers secteurs.
– Avancement hebdomadaire de l’approvisionnement des équipements avec le responsable des achats.
– Relation ponctuelle avec les Supplied Manager et TL (Technical Leader) des équipements pour suivi des dates de calibration, dates de limite de vie, position géographique, calibration etc… .
– Relation avec le responsable du Contrôle Qualité Réception (CQR) pour débloquer, stocker et approvisionner le matériel aux différents secteurs.Passation des différents sous ensemble en collaboration avec la PM, qualité et RLT des divers secteurs.
– Réalisation des documents contractuels.
Responsable de Lot Directive de production (DP) :
– Écriture des Directives de Production d’assemblage, câblage, Méca et équipements pour les différents étages.
– Relation avec les différents BE pour récupérer les données d’entrée.
– Diffusion à l’ensemble des équipes concernées pour prise en compte.
Profil:
De formation supérieure (Bac+5),
Vous possédez des compétences en gestion de projet avec des qualités organisationnelles et relationnelles reconnues.
Des connaissances en instrumentation et en hyper fréquences seraient un plus.
Vous êtes autonome, polyvalent et curieux.
SII Bordeaux c’est :
130 Fungénieurs qui partagent un même esprit #collectif #partage
Des clients Grands Comptes qui t’apporteront de la richesse technique, fonctionnelle et méthodologique
Un suivi régulier et personnalisé : ton manager, ta référente RH et ta référente administrative seront là pour t’accompagner dans l’aventure SII
Des moments de fun et de partage : AfterWorks, Soirées d’agence, événements sportifs, petits déjeuners …
Des speak up (conférences technique/métiers animées par des consultants SII => peut être toi )
Des formations régulières adaptées à tes envies et à ton évolution
Notre culture : l’engagement, la responsabilisation, la transparence, la confiance et le professionnalisme et surtout Fungénieur !
Dynamisme, Confiance, Innovation et Autonomie sont nos leitmotivs !
Intégrer SII Sud-Ouest (800 collaborateurs), c’est travailler sur des sujets innovants avec des #Fungénieurs créatifs. Pour nous, la proximité avec nos collaborateurs est une de nos priorités.
Pour accompagner votre carrière, nous vous proposons d’être membre d’une communauté technique correspondant à vos centres d’intérêts : «Big Data», «Front-end IHM», «Back end – Architecture logicielle», «Sécurité, architecture technique, devops », «Aéronautique» ou «Simulation, Modélisation».
N’attendez plus, rejoignez le mouvement #Fungénieur : Bien plus qu’un métier, une philosophie !
Compétences :
Référence de l’annonce :
D/BDX/PM
Expérience:
0-2 ans
Qualification:
Consultant
Rémunération:
Selon profil

POSTULER"
