,id,meta1,meta2,titre_poste,entreprise,localisation,contrat,salaire,date_publication,keyword_metier,keyword_localisation,description
18,https://www.indeed.fr/emplois?q=Data%20Scientist&l=Bordeaux&radius=100&limit=100&sort=date&vjk=150ba74139ee6f13,"Formateur·rice en Data Science/Machine Learning
Simplon.co6 avis - Bordeaux (33)
A répondu à 75 % ou plus des candidatures sur les 30 derniers jours, généralement en 1 jour.","['Bordeaux (33)', 'CDD, Freelance / Indépendant, CDI']",Formateur·rice en Data Science/Machine Learning,Simplon.co,- Bordeaux (33),"CDD, Freelance / Indépendant, CDI",null,"il y a 30+ jours
Signaler cette offre d'emploi",Data Scientist,Bordeaux,"Pourquoi nous rejoindre ?
Simplon.co, une start-up engagée pour un numérique inclusif et solidaire.
Labellisée « French Tech », « La France s’Engage » et « Grande Ecole du Numérique », Simplon.co est une entreprise solidaire d’utilité sociale (ESUS) fondée en 2013, dont le cœur d’activité est de former et accompagner toute personne motivée vers les emplois du numérique.
Pour cela, Simplon propose :
D’ouvrir le numérique à tout type de publics et d’en promouvoir la diversité : demandeur.se.s d’emploi, non-diplômé-e-s, quartiers prioritaires, zones rurales, salariés en reconversion, avec un objectif de parité hommes-femmes
De proposer une formation au développement web/mobile adaptée aux besoins des entreprises et organisations (y compris dans le cadre de reconversion)
D’accompagner à l’emploi nos apprenants, par des interactions suivies avec les entreprises et avec Simplon Prod, notre agence web solidaire
Nous proposons des formations “métiers”, des actions de renforcement de compétences ou de sensibilisation au numérique.
Simplon porte plus de 70 fabriques (lieux de formation) déployées dans toutes les régions de France et à l’étranger.
Notre équipe dynamique et motivée de plus de 200 salarié·e·s de tous horizons n’attend que vous !
Quelles missions ?
En tant que , votre principale mission sera d’assurer pendant 19 mois la formation développeur.se Data IA en accompagnant une promotion d’une vingtaine d’apprenant.e.s dans leurs activités quotidiennes (4 mois de formation intensive et 15 mois d’alternance).
Votre rôle sera de former au métier de Développeur.se IA/Machine Learning. Vous accompagnerez les simplonien·ne·s dans la réalisation de leurs projets au quotidien. Vous serez le garant du bon déroulé de la formation et de la progression pédagogique.
A ce titre vos principales missions seront :
Construire le programme et les ressources pédagogiques
Participer au recrutement des apprenant·e·s
Animer des séances de formation collective
Evaluer la progression des apprentissages
Repérer les difficultés individuelles d’apprentissages et y remédier
Mettre à disposition de Simplon.co les éléments de reporting de la promotion
Coordonner les interventions des experts techniques et autres intervenants dans la formation
Assurer le relais avec l’entreprise dans le cadre de l’alternance
Accompagner les apprenants dans leurs démarches pour l’obtention des la certifications visé(es)
Participer à la synchronisation pédagogique entre les différents formateurs de Simplon.co et aux réunions liées au projet (notamment avec les équipes Simplon.co)
Faire un bilan pédagogique de la formation et de la promotion
Vous pourrez aussi être amené.e à :
Favoriser les rencontres des simplonien·ne·s avec la communauté des data engineers, analysts, developers, scientists, etc. (meetup, participation aux évènements locaux…)
Suivre et accompagner la promotion dans ses activités : action d’apprentissage par l’enseignement, ateliers, rencontres, etc
Participer à enrichir la réflexion pédagogique de Simplon, au travers des rencontres et échanges récurrents avec la communauté des formateurs
Contribuer à alimenter la plateforme d’apprentissage Simplonline avec des ressources pédagogiques et des exercices
Quel profil ?
Compétences requises :
Vous avez de bonnes compétences relationnelles, êtes bon.ne pédagogue
Vous maîtrisez le versionnement avec Git
Vous maîtrise Python ou R
Vous maîtrisez des Mathématiques appliquées à l’IA (Géomatiques, Statistiques descriptives et Algorithmique)
Vous maîtrisez une ou plusieurs bibliothèques ou frameworks de machine learning, par exemple : Scikit-learn, Keras, Tensorflow, PyTorch, Caffe…
Vous avez une première expérience avec l’une des plateformes en Intelligence Artificielle, par exemple : Microsoft Azure Cognitives Services, Google Cloud Platform, IBM Watson, AMAZON Lex…
Vous maitrisez la gestion et l’administration de bases de données relationnelles et non relationnelles
Vous maitrisez le SQL
Vous savez développer pour le web des solutions simples (interfaces, application simples, visualisation de données…)
Expérience souhaitée :
Une expérience professionnelle de deux ans minimum dans le domaine de l’IA/Machine Learning est souhaitée.
Qualités requises :
Esprit d’équipe : collaboration et communication
Capacité d’apprentissage et d’adaptationEt surtout, envie de transmettre votre passion auprès de grands débutants !
Idéalement, ce serait un sacré + si :
Vous maitrisiez l’anglais pour la mise à jour de vos connaissances dans votre domaine d’expertise
Vous aviez une expérience de formateur
Vous maitrisiez le C et/ou le C++
Vous maitrisiez Python ET R
Vous maitrisiez le développement web front et back
Quelles conditions ?
Type d’emploi : CDD, CDI, freelance/indépendant
Lieu : Bordeaux
Date de début souhaitée : début septembre
Salaire : selon profil
Type d'emploi : CDD, Freelance / Indépendant, CDI"
19,https://www.indeed.fr/emplois?q=Data%20Scientist&l=Bordeaux&radius=100&limit=100&sort=date&vjk=2e4bebbab1a17ae8,"DATA SCIENTIST H/F
Ceva Santé Animale10 avis - Libourne (33)",['Libourne (33)'],DATA SCIENTIST H/F,Ceva Santé Animale,- Libourne (33),null,null,"CEVA Animal Health, LLC - il y a 30+ jours
- Continuer pour postuler
Signaler cette offre d'emploi",Data Scientist,Bordeaux,"Animé par le besoin d'innover, et bénéficiant d'une croissance soutenue, Ceva Santé Animale est l'un des acteurs les plus dynamiques parmi les 10 principaux groupes pharmaceutiques vétérinaires dans le monde. Implantés dans 50 pays, nos 5 000 salariés portent les valeurs du Groupe Ceva :
Passion du client, Innovation, Esprit entrepreneurial, Solidarité
Ceva propose depuis plusieurs années des services à ses clients autour de la donnée, et les renforce aujourd'hui grâce à la data science.
En tant que Data Scientist, vous développez des modèles pour aider nos clients - vétérinaires, éleveurs et intégrations agricoles - à valoriser leur activité, autour et au-delà de nos produits. L'objectif est de développer puis améliorer en continu ces modèles afin de garantir une expérience client optimale.
Vous travaillez en collaboration étroite avec nos clients en France et à l'international, avec les équipes métier (key account managers, services vétérinaires, franchise de chaque espèce) et les équipes IT. Des déplacements sont à prévoir.
Plus particulièrement :
Vous êtes responsables de développer, dans un cadre agile, des modules adaptés aux besoins de nos clients, pouvant aller du descriptif, au prédictif et prescriptif.
Vous aiderez nos équipes terrain dans la compréhension et l'analyse des données de nos clients, en développant avec eux des services adaptés autour de ces données.
Vous pilotez la construction de minimal viable products pour montrer la valeur de ces services, et coopérez avec les équipes IT pour l'industrialisation de ces services.
Vous contribuez à la gestion et gouvernance des données, en particulier celles provenant de nos clients et de leurs objets connectés IoT, en l'orientant vers le développement de ces services.
Vous gérez les éventuels problèmes autour de ces outils dans un but d'amélioration continue
Vous assurez la capitalisation, la diffusion des techniques en data science tout en continuant de compléter vos connaissances.
Vous travaillez en collaboration étroite avec les équipes terrain, IT et les clients dans la compréhension et l'analyse des données, pour développer ensemble des services adaptés
Profil & Compétences:
De formation supérieure, de type bac+ 5, idéalement dans le domaine des mathématiques, de la statistique, de l'informatique ou tout autre domaine lié à la donnée.
Vous justifiez d'une expérience professionnelle significative avec une exposition directe avec des métiers.
Vous avez une compréhension approfondie des concepts de modélisation statistique et prédictive, des approches de machine learning voire de deep learning, ainsi que des algorithmes de recommandation, d'optimisation et d'aide à la décision.
Vous êtes expert dans l'analyse d'ensembles de données, complexes et multidimensionnels.
Vous maitrisez de la manipulation de données en Python de préférence, et avec les outils de visualisations de données (type web app / javascript).
De tempérament collaboratif, autonome et proactif, facilitateur, orienté client, vous excellez à rendre les concepts complexes en concepts simples et faciles à comprendre par ceux qui vous entourent.
Une connaissance du monde de l'élevage serait un plus
Langue : Français et Anglais courant.
Ce poste en CDI est rattaché directement au Chief Data Officer, et sera basé à votre convenance en région parisienne ou en Gironde ( Libourne - 35km de Bordeaux)."
20,https://www.indeed.fr/emplois?q=Data%20Scientist&l=Bordeaux&radius=100&limit=100&sort=date&vjk=256ce97f07070808,"DATA SCIENTIST H/F
Ceva - Libourne (33)",['Libourne (33)'],DATA SCIENTIST H/F,Ceva,- Libourne (33),null,null,"il y a 30+ jours
- Continuer pour postuler
Signaler cette offre d'emploi",Data Scientist,Bordeaux,"Animé par le besoin d'innover, et bénéficiant d'une croissance soutenue, Ceva Santé Animale est l'un des acteurs les plus dynamiques parmi les 10 principaux groupes pharmaceutiques vétérinaires dans le monde. Implantés dans 50 pays, nos 5 000 salariés portent les valeurs du Groupe Ceva :
Passion du client, Innovation, Esprit entrepreneurial, Solidarité
Ceva propose depuis plusieurs années des services à ses clients autour de la donnée, et les renforce aujourd'hui grâce à la data science.
En tant que Data Scientist, vous développez des modèles pour aider nos clients - vétérinaires, éleveurs et intégrations agricoles - à valoriser leur activité, autour et au-delà de nos produits. L'objectif est de développer puis améliorer en continu ces modèles afin de garantir une expérience client optimale.
Vous travaillez en collaboration étroite avec nos clients en France et à l'international, avec les équipes métier (key account managers, services vétérinaires, franchise de chaque espèce) et les équipes IT. Des déplacements sont à prévoir.
Plus particulièrement :
Vous êtes responsables de développer, dans un cadre agile, des modules adaptés aux besoins de nos clients, pouvant aller du descriptif, au prédictif et prescriptif.
Vous aiderez nos équipes terrain dans la compréhension et l'analyse des données de nos clients, en développant avec eux des services adaptés autour de ces données.
Vous pilotez la construction de minimal viable products pour montrer la valeur de ces services, et coopérez avec les équipes IT pour l'industrialisation de ces services.
Vous contribuez à la gestion et gouvernance des données, en particulier celles provenant de nos clients et de leurs objets connectés IoT, en l'orientant vers le développement de ces services.
Vous gérez les éventuels problèmes autour de ces outils dans un but d'amélioration continue
Vous assurez la capitalisation, la diffusion des techniques en data science tout en continuant de compléter vos connaissances.
Vous travaillez en collaboration étroite avec les équipes terrain, IT et les clients dans la compréhension et l'analyse des données, pour développer ensemble des services adaptés
Profil & Compétences:
De formation supérieure, de type bac+ 5, idéalement dans le domaine des mathématiques, de la statistique, de l'informatique ou tout autre domaine lié à la donnée.
Vous justifiez d'une expérience professionnelle significative avec une exposition directe avec des métiers.
Vous avez une compréhension approfondie des concepts de modélisation statistique et prédictive, des approches de machine learning voire de deep learning, ainsi que des algorithmes de recommandation, d'optimisation et d'aide à la décision.
Vous êtes expert dans l'analyse d'ensembles de données, complexes et multidimensionnels.
Vous maitrisez de la manipulation de données en Python de préférence, et avec les outils de visualisations de données (type web app / javascript).
De tempérament collaboratif, autonome et proactif, facilitateur, orienté client, vous excellez à rendre les concepts complexes en concepts simples et faciles à comprendre par ceux qui vous entourent.
Une connaissance du monde de l'élevage serait un plus
Langue : Français et Anglais courant.
Ce poste en CDI est rattaché directement au Chief Data Officer, et sera basé à votre convenance en région parisienne ou en Gironde ( Libourne - 35km de Bordeaux)."
21,https://www.indeed.fr/emplois?q=Data%20Scientist&l=Bordeaux&radius=100&limit=100&sort=date&vjk=022c55176ed63838,"Stage Machine Learning – Data Scientist
sense4data - Bordeaux (33)","['Bordeaux (33)', 'Stage']",Stage Machine Learning – Data Scientist,sense4data,- Bordeaux (33),Stage,null,"il y a 7 mois
- Continuer pour postuler
Signaler cette offre d'emploi",Data Scientist,Bordeaux,"Localisation : Bordeaux
Vos futures missions au sein de sense4data
Vous accompagnez nos équipes d’ingénieurs et data scientists sur des projets numériques à forte valeur ajoutée :
(détection de fraudes bancaires, détection de virus informatiques, …)
Vous apprendrez et mettrez en oeuvre les bonnes pratiques pour installer des architectures data complexes,
Vous appliquerez également des algorithmes de prise de décision en temps réel,
Vous confronterez vos connaissances théoriques sur la science des données aux problématiques et limites techniques rencontrées lors de la mise en production d’architectures de prise de décision automatisée.
Votre profil
De formation supérieure de type école d’Ingénieurs ou 3ème cycle universitaire avec une spécialisation en statistiques / Data Science,
Vous êtes curieux, passionné, indépendant, structuré et vous vous épanouissez dans le travail d’équipe.
Vous maîtrisez un ou plusieurs langages / outils de programmation (Python / R, SQL, NoSQL…), possédez une bonne connaissance des techniques de modélisation ainsi que des librairies existantes de Machine Learning.
Vous êtes capable de comprendre le fonctionnement des différents algorithmes de Machine Learning, interpréter des papiers de recherche et de mettre en application les résultats de recherche en Data Science.
Le petit plus !
Vous avez effectué des projets personnels en Data Science,
Vous avez obtenu des résultats en compétitions de Machine Learning (par exemple kaggle)."
22,https://www.indeed.fr/emplois?q=Data%20Scientist&l=Bordeaux&radius=100&limit=100&sort=date&vjk=d0ba8d4da9672fae,"Data Scientist Senior – Tech Lead
sense4data - Bordeaux (33)","['Bordeaux (33)', '55 000 € par an']",Data Scientist Senior – Tech Lead,sense4data,- Bordeaux (33),55 000 € par an,55 000 € par an,"il y a 7 mois
- Continuer pour postuler
Signaler cette offre d'emploi",Data Scientist,Bordeaux,"Salaire brut annuel : à partir de 55 K€/an + plus avantages (négociable selon profil et expérience)
Localisation : Bordeaux
Vos futures missions au sein de sense4data
Lead Data Scientist en charge de plusieurs projets relatifs à la Science des données et à la valorisation des données :
Jalons, délais, gestion des équipes d’Ingénieurs Data
Management et formation d’équipes de data scientists. Possibilité d’encadrement Stages – Thèses,
Travailler en étroite collaboration avec les équipes Data / Big Data,
Etude des données à disposition et définition des besoins en accord avec les exigences client,
Récupération et analyse des données pertinentes liées aux problématiques de l’entreprise,
Construction d’algorithmes permettant d’améliorer les résultats de recherches et de ciblage,
Élaboration de modèles prédictifs afin d’anticiper l’évolution des données et tendances relatives à l’activité de l’entreprise :
Modélisation des résultats d’analyse des données pour les rendre lisibles et exploitables par les opérationnels (rapports fonctionnels, statistiques et métriques, data visualisation…),
Recommandations métier auprès de la direction générale afin d’améliorer les process/ prise de décision.
Définition de solutions de stockage et gestion des données, en lien avec la DSI et les Ingénieurs Data,
Veille technologique et force de proposition sur toutes les nouvelles technologies,
Capacités à intervenir techniquement et valider les bonnes pratiques des data scientists,
Capacité à travailler dans des environnements variés et à côtoyer des profils très différents.
Vous êtes engagé dans le processus de recrutement de nos prochains talents
Votre profil
Ingénieur Statisticien ou Docteur avec une spécialisation en science des données, vous bénéficiez déjà de plusieurs années d’expérience
Vous avez des expériences réussies de gestion et développement de projets Data Science,
Recherche et Développement d’algorithmes de Machine Learning,
Vous êtes pédagogue et enthousiaste, capable d’encadrer des équipes d’Ingénieurs et chercheurs en Data Science,
Vous êtes passionné par la Data et son environnement, êtes capable d’analyser des problématiques clients complexes et nouvelles, capable de gérer de manière indépendantes des projets, remettre en cause l’existant, être force de proposition
Expertises et maîtrises
En plus d’une expertise en data/feature engineering, vous êtes à l’aise avec le management de la donnée sous toutes ses formes: texte, image, vidéo, structurée, séries temporelles…
Cloud : connaissance des différents acteurs et maîtrise des outils cloud (Google, AWS. …),
Big Data : A l’aise avec les technologies Big Data: Hadoop, hdfs, map reduce, spark, kafka, hive, …
BDD : connaissance des bdd SQL et NoSQL et des enjeux
Git, Java, python/R, linux/shell scripts
Machine Learning : maîtrise des différentes librairies d’algorithmes de ML. (algorithmes classiques, réseaux de neurones, deep learning)
Vous disposez de connaissances approfondies dans les différents domaines relatifs au machine learning, algorithmes semi/non supervisés, clustering, réduction de dimensions, online learning, reinforcement learning…"
23,https://www.indeed.fr/emplois?q=Data%20Scientist&l=Bordeaux&radius=100&limit=100&sort=date&vjk=1d584a54c5ee36af,"Lead ingénieur data – Tech Lead
sense4data - Bordeaux (33)","['Bordeaux (33)', '55 000 € par an']",Lead ingénieur data – Tech Lead,sense4data,- Bordeaux (33),55 000 € par an,55 000 € par an,"il y a 7 mois
- Continuer pour postuler
Signaler cette offre d'emploi",Data Scientist,Bordeaux,"Salaire brut annuel : à partir de 55 K€/an + plus avantages (négociable selon profil et expérience)
Localisation : Bordeaux
Vos futures missions au sein de sense4data
Lead ingénieur data capable d’encadrer des petites équipes d’ingénieurs et mener à bien des projets data à forte valeur ajoutée :
Jalons, délais, gestion des équipes d’ingénieurs data
Management et formation d’équipes d’ingénieurs data. Possibilité d’encadrement stages – thèses,
Accompagner les équipes de data scientists dans la mise en production et l’optimisation de leurs modèles (SAAS),
Garant du bon fonctionnement et de l’architecture des processus de machine learning,
Développer et maîtriser les processus ETL en production, les contraintes de réactivité, les processus de stockage et les différents types de bases de données,
Veille technologique et force de proposition sur toutes les nouvelles technologies,
Capacités à intervenir techniquement et valider les bonnes pratiques de développeurs,
Capacité à travailler dans des environnements variés et à côtoyer des profils très différents
Vous êtes engagé dans le processus de recrutement de nos prochains talents
Votre profil
Vous êtes ingénieur ou docteur avec une formation spécialisée en gestion de la donnée / Big Data
Vous avez des expériences réussies de gestion et développement de projets data,
Vous êtes pédagogue et enthousiaste.
Vous êtes passionné par la Data et son environnement, êtes capable d’analyser des problématiques clients complexes et nouvelles, capable de gérer de manière indépendante des projets, remettre en cause l’existant, être force de proposition
Compétences
Vous disposez de connaissance sur des différents types de processus de machine learning. Une ou plusieurs expériences réussies sur des projets ML sont fortement recommandées
Cloud : connaissance des différents acteurs et maîtrise des outils cloud (Google, AWS. …),
Big Data : A l’aise avec les technologies Big Data : Hadoop, hdfs, map reduce, spark, kafka, hive, …
BDD : connaissance des bdd SQL et NoSQL. Force de proposition,
Docker,
Git, Java, Python/R, Linux/shell scripts.
Mais encore …
Vous êtes avant tout passionné.e par le numérique, les données, les enjeux qu’elles représentent et les technologies Big Data avec lesquelles les manipuler (Hadoop, Kafka, ElasticSearch, Spark, Hive, Cassandra, MongoDB, Kibana)
Vous êtes familiarisé.e avec les différentes plateformes et outils qui y sont reliés : Hortonworks, Azure, Amazon, Google, Databricks,
Vous maîtrisez les nouvelles bases de données (NoSQL) : clé-valeur, orientés colonnes, documents (Json),
Vous savez implémenter des chaines de traitement optimisées en utilisant le framework Spark,
Vous aimez coder avec des langages de programmation communément utilisés pour la manipulation de données (Python, Java, Scala),
Vous êtes familiarisé.e avec les concepts et technologies d’intégration continue (Git) et les outils de déploiement (Docker),
Vous êtes coutumier.e des méthodes de travail agile (Scrum),
Vous êtes motivé.e, appliqué.e, organisé.e, autonome, curieux.se dans votre travail au quotidien,
Vous êtes force de proposition et aimez travailler en équipe.
Vous êtes titulaire d’un diplôme d’ingénieur ou Master, idéalement avec une spécialisation sur les métiers de la donnée et du Big Data et une expérience en Data Warehousing"
24,https://www.indeed.fr/emplois?q=Data%20Scientist&l=Bordeaux&radius=100&limit=100&sort=date&vjk=0e939382c06d3b66,"Data Scientist H/F
Scalian14 avis - Bordeaux (33)","['Bordeaux (33)', 'CDI']",Data Scientist H/F,Scalian,- Bordeaux (33),CDI,null,"il y a 7 mois
- Continuer pour postuler
Signaler cette offre d'emploi",Data Scientist,Bordeaux,"Pour participer à cette aventure et vous épanouir dans une équipe Conseils en Valorisation des Données, intégrez SCALIAN en tant que Data Scientist,

Votre quotidien :

Tester les hypothèses de manière itérative et converger vers une solution
Tirer profit des algorithmes Machine Learning pour vous aider dans vos investigations
Explorer visuellement et détecter des patterns dans les données
Présenter vos travaux, documenter vos réflexions et publier vos découvertes.

Vos champs d'intervention pourront concerner les problématiques suivantes :

Mise au point, développement et expérimentation d'algorithmes d'apprentissage performants et scalables
Data Mining et statistiques : élaboration de modèles explicatifs et prédictifs d'aide à la décision (ingénierie statistique, économétrie, prévision, diagnostic quantitatif, ...)
Traitement de données massives, non structurées et time-series
Expérimentation des algorithmes avec des technologies Tensorflow, Spark, Hadoop et bases de données nosql
Formations et compétences
Compétences et expérience souhaitées :

Vous avez une formation de haut niveau (PhD / Ecole d'Ingénieur / BAC+5) dans le domaine du traitement de l'information, de l'ingénierie statistique et de l'économétrie et vous justifiez idéalement d'une première expérience en Big Data ou Data Science, de préférence dans un contexte industriel.

Vous avez un excellent niveau en statistiques et analyse quantitative.

Vous maitrisez la programmation en python, R ou compilés (Java, Scala, C++) et avez une expérience dans les environnements UNIX/LINUX

Vous souhaitez vous impliquer et prendre rapidement des responsabilités sur des missions à forte valeur ajoutée au sein d'une structure dynamique.

Mobile, vous êtes doté(e) d'une ouverture d'esprit et d'une capacité à travailler en équipe et vous souhaitez rejoindre un environnement professionnel motivant où vous partagerez les valeurs que sont la culture du résultat, la qualité et la satisfaction client.

Anglais professionnel indispensable.

Rejoignez-nous sur www.scalian.com
Localisation du poste
Localisation du poste à pourvoir
France, Aquitaine
Lieu
Bordeaux"
