,id,meta1,meta2,titre_poste,entreprise,localisation,contrat,salaire,date_publication,keyword_metier,keyword_localisation,description
25,https://www.indeed.fr/emplois?q=Data%20Scientist&l=Bordeaux&radius=100&limit=100&sort=date&vjk=007dc7dadd7b2ce5,"Consultant Data (h/f)
ippon - Bordeaux (33)",['Bordeaux (33)'],Consultant Data (h/f),ippon,- Bordeaux (33),null,null,"il y a 7 mois
- Continuer pour postuler
Signaler cette offre d'emploi",Data Scientist,Bordeaux,"Contexte du poste :
La donnée vous inspire ? Le Big Data est plus qu’un buzzword pour vous ? Si oui, les portes d’Ippon sont grandes ouvertes pour vous accueillir sur le tatami de l’innovation technique et des projets à haute valeur ajoutée.
. . .
Profil :
Vous savez concevoir, mettre en place et optimiser une architecture adaptée aux volumes et aux enjeux. Vous savez mettre en production un projet de Data Science. Vous êtes à l’aise pour échanger avec les différents profils Data (Architectes, Data Scientists, …). Vous êtes curieux et conservez un regard attentif mais mesuré sur les nouvelles technologies et savez détecter celles porteuses de potentiel.
. . .
Si vous rejoignez IPPON :
Votre bonne élocution vous permet de communiquer aussi bien avec les profils Techniques que les interlocuteurs Métier,
Vous développerez principalement des jobs d’intégration de données, de transformation (nettoyage, enrichissement) et les stocker au bon format dans un espace commun #datalake.
Vous pouvez être amené à travailler avec le data scientist de 2 manières :
En réalisant les pipelines qui alimenteront le datalake avec les données attendues par le data scientist
En industrialisant (gestion d’erreurs, gestion de logs, voire même réécriture) le code du data scientist
Vous êtes curieux et aimez partager votre veille technique avec la communauté worldwide #Data
. . .
Votre plus :
Compétences sur la supervision et connaissance des indicateurs clés des plateformes,
Bonne connaissance d’un ou plusieurs outils et langages de développement adaptés au traitement de la donnée : Spark, Hadoop, Hive, Kafka, ElasticSearch, Cassandra, Scala, Python,
Bases en mathématiques et statistiques pour communiquer avec Data Scientists,
Connaisannces d’ Amazon Cloud ou Google Cloud PLatform."
26,https://www.indeed.fr/emplois?q=Data%20Scientist&l=Bordeaux&radius=100&limit=100&sort=date&vjk=c7c5c998605199d1,"Data Engineer – Startup avancée marché Data (H/F)
Altaide - Bordeaux (33)","['Bordeaux (33)', 'CDI']",Data Engineer – Startup avancée marché Data (H/F),Altaide,- Bordeaux (33),CDI,null,"il y a 8 mois
- Continuer pour postuler
Signaler cette offre d'emploi",Data Scientist,Bordeaux,"Data Engineer – Startup avancée marché Data (H/F)
Startup avancée (20 personnes, plusieurs millions d’€ levés, des centaines de clients actifs…), basée à Paris, Bordeaux et au Canada, nous sommes experts de l’automatisation de l’accès à la data pour les décideurs en marketing digital et ecommerce. Fondée par un serial entrepreneur et un expert de la data, tous deux également passionnés de search et sémantique, notre équipe a pour objectif de construire un produit actionnable et fun pour aider nos utilisateurs à obtenir et comprendre facilement la data dont ils ont besoin et à améliorer leur performance de leurs sites. Par ailleurs, nous nous définissons comme une bande de geeks enthousiastes et innovants et nous faisons tout notre possible pour organiser notre projet autour de cet esprit. Notre réussite business et les résultats obtenus nous permettent d’accélérer notre croissance et donc de renforcer notre équipe. Nous recrutons ainsi un(e) Data Engineer !

Une mission passionnante :
Notre solution s’appuie sur les données pour aider nos clients à prendre des décisions prévisibles en termes de campagnes de référencement. Nous traitons ainsi une très grosse volumétrie.
En tant que Data Engineer, vous rejoignez notre gang de data nerds pour nous aider à fournir à nos clients des outils d’analyse perspicaces et fiables. Nos applications sont conçues pour évoluer à l’échelle du milliard de pages Web et des quantités massives de données sont traitées quotidiennement pour calculer des métriques de très haut niveau telles que l’identification de pages presque dupliquées, des mesures de taux de similarité, des diagrammes de flux de popularité internes (« InRank juice flow diagram ») et bien d’autres.
Au quotidien vos principales missions en tant que Data Engineer seront de :
Ecrire des algorithmes avancés capable d’analyser des centaines de million de pages web et des milliards d’évènements journalisés.
Travailler sur des données structurées et non structurées
S’approprier Spark, Elasticsearch et le data warehouse system pour obtenir stabilité et scalabilité
Créer de nouvelles façons d’explorer et de visualiser les rapports en temps réel
Environnement technologique:
Java
Spark, Hadoop MR, Apache Hbase, Google BigQuery et BigTable
Elasticsearch, MongoDB
Python
Git, CI
Kubernetes et DataProc

Profil :
De formation école d’ingénieur, vous disposez de minimum deux ans d’expérience.
Vous savez développer en Java, et maîtrisez soit Spark, Hadoop MR ou Apache Hive.
Vous avez une expérience dans l’écriture de jobs scalables d’analyse de données ou bien vous souhaitez monter en compétences dessus
Idéalement, vous savez utiliser Elasticsearch et MongoDB
Un plus serait également de connaître Python, Git et l’intégration continue.
Reconnu(e) pour votre excellence technique, vous êtes toujours en veille sur les nouveautés tant en termes de technologies que de solutions existantes permettant d’améliorer l’expérience.
Votre capacité de travail et votre implication, vous permettront de vous intégrer rapidement au sein d’une équipe de passionnés.
Pourquoi rejoindre notre équipe ?
Un projet innovant avec des résultats concrets validés par des centaines de clients (dont les plus grands comptes de l’ecommerce français)
L’opportunité de travailler au sein d’une top équipe intégrant des experts reconnus en développement, data, machine learning…
Une gamme de bénéfices et d’à-côtés variés afin d’aider nos employés à trouver un équilibre entre le temps de travail et le temps personnel.
Notre ambition est de construire un environnement de travail productif et agréable avec par exemple : 100 € d’allocation pour l’achat de livres, horaires de travail flexibles, café à volonté, déjeuners d’équipe et afterworks réguliers, une superbe terrasse de 100m2 pour bosser ou se détendre au soleil…
Un environnement où l’initiative est favorisée avec du temps accordé pour découvrir des nouvelles technos et approches
Des packages salaires compétitifs
Des bureaux dans Bordeaux aux pieds d’une station de Tram

Retrouvez toutes nos offres d’emploi de Data Scientist / BI / IA !"
27,https://www.indeed.fr/emplois?q=Data%20Scientist&l=Bordeaux&radius=100&limit=100&sort=date&vjk=d88dffa2e2439c6a,"Data Scientist H/F (Niort)
Keyrus13 avis - Bordeaux (33)","['Bordeaux (33)', 'CDI']",Data Scientist H/F (Niort),Keyrus,- Bordeaux (33),CDI,null,"il y a 10 mois
- Continuer pour postuler
Signaler cette offre d'emploi",Data Scientist,Bordeaux,"Qui sommes-nous ?
Une success story dans la Data et le Digital !
Notre mission ? Des projets à forte valeur ajoutée pour accroître la performance et la compétitivité des entreprises, faciliter et accélérer leur transformation.
Notre expertise depuis plus de 20 ans ? Le conseil et l'intégration de solutions innovantes autour de trois domaines :
Data Intelligence : Business Intelligence et Big Data & Analytics ;
Digital Experience : Conseil, Stratégie & Performance Digitales ;
Conseil en Management & Transformation : Pilotage de la Performance & Accompagnement des Projets.
Nous sommes plus de 3200 talents sur plus de 18 pays et 4 continents. Notre ADN ? Innover et entreprendre.
Vous êtes ambitieux et souhaitez intégrer un groupe agile et international, où vos qualités professionnelles et personnelles seront reconnues et cultivées ?
Pour cela,
Nous vous proposons de nous rejoindre nos équipes sur Niort !
Nos maîtres mots sont AGILITE, EXPERTISE, DIVERSITE.
Vos missions ?
#DataEnthusiast, mordu d’innovation et explorateur de données, vous souhaitez rejoindre une équipe à taille humaine et passionnée et data science ?
Nous vous proposons :
d'accompagner nos clients dans la formulation de leurs besoins métiers sous de forme de problématique Data Sciences claires et réalisables.
d'explorer de larges volumes de données hétérogènes et complexes afin d’en extraire des connaissances utiles pour la prise de décision et les restituer aux métiers.
de mettre en place des modèles de Machine Learning et de Deep Learning permettant de modéliser des phénomènes complexes et de répondre aux besoins variées de nos clients
de participer, en étroite collaboration avec les Data Engineers, à l’industrialisation et la mise en production des modèles et des pipelines de transformation de données développés.
d'effectuer une veille technologique et une animation de la communauté IA de Keyrus : vous serez toujours incité à améliorer vos connaissances mais également à les partager avec vos collègues.
Votre profil ?
Vous avez le sens du service et souhaitez intégrer un groupe agile et international où vos qualités professionnelles seront reconnues et cultivées, où vos qualités personnelles seront développées et pourront s’épanouir, où vos compétences seront élargies et enrichies.
Dynamisme, curiosité, goût du défi et du travail en équipe, mais aussi rigueur, autonomie, initiative, sens de la communication sont les maîtres pour ce nouveau challenge.
Pourquoi nous rejoindre ?
Pour intégrer une super communauté d’experts curieux et passionnés et évoluer dans un super environnement multiculturel, formateur et favorisant la mobilité internationale.
Et parce que vous êtes #DataGeek, et #InnovationLover !
#KeyrusRocks #YouRock


Keyrus est une entreprise où il fait super bon vivre et travailler !
Découvrez :
> La vie chez Keyrus en 60 sec
> Keyrus en 3 mots
> Nos animations pour nos collaborateurs sur Facebook et sur Instagram"
28,https://www.indeed.fr/emplois?q=Data%20Scientist&l=Bordeaux&radius=100&limit=100&sort=date&vjk=3da72c57cdd08f6f&advn=7899359816794743,"Data Scientist - Bordeaux
Fieldbox.ai - Bordeaux (33)","['Bordeaux (33)', 'Temps plein, CDI']",Data Scientist - Bordeaux,Fieldbox.ai,- Bordeaux (33),"Temps plein, CDI",null,"il y a 6 jours
Signaler cette offre d'emploi",Data Scientist,Bordeaux,"As part of the Data Science team, you work closely collaboration with the project and engineering teams to move the data projects of our customers forward, contribute to the evolution of the product, and participate in the R & D effort within FieldBox with the founders of the company.
As such, you have a particular interest in one of the following areas:
Data engineering,
Machine learning engineering,
Predictive modeling,
Data visualisation.
On a daily basis, your missions can be:
Transform customer issues into relevant data science issues, formulate the question that needs an answer,
Identify and extract the data needed to solve the problem,
Perform in-depth analysis of datasets of all sizes,
Build training datasets and validation,
Create predictive models, put them in production and manage their life cycle,
Set up visualizations of the results obtained,
Contribute to the reflection on the evolution of the product,
Set up exploratory prototypes,
Contribute to the implementation of a robust, efficient and easy to use tool set,
Contribute to the scientific influence of society through participation in conferences, colloquia, or publications.
PROFIL
You like challenge and adventure and are looking for an experience in a dynamic start-up working in an innovative demanding industrial context. You are autonomous and flexible, enjoy learning as much as doing, and know how to communicate your ideas.
We are looking for PhD / PhD, Grande Ecole, Master or equivalent in applied mathematics, computer science, machine learning or other quantitative discipline related to the position.
The following skills are appreciated:
Data Science: machine learning (supervised / unsupervised), time series analysis, complex systems modeling, artificial neural networks, natural language processing, data visualization
Computer science: knowledge of a scripting language (python), good practices in software development, Unix / Linux. You know how to use Git and live in a terminal. Database: SQL (preferrably PostGre SQL)
Exposure to industrial engineering or industrial data.
COMPENSATIONS AND BENEFITS
Competitive salary based on your profile and experience.
You will work independently in a team with strong technical skills.
You will work in a quiet and pleasant environment, with views of the Cité du Vin. Our offices are located in the centre of Bordeaux.
You are joining a company where kindness and respect allow everyone to realize their full potential.
Damn good coffee! Tickets restaurant, sweets & fruits à volonté!
Job Types: Full-time, Permanent"
29,https://www.indeed.fr/emplois?q=Data%20Scientist&l=Bordeaux&radius=100&limit=100&sort=date&vjk=0b8ffc1e4b29833e&advn=760911243417165,"Ingénieur Junior Developpement Software (Relocalisation BE ou DE)
The AKKAdemy5 avis - France","['France', 'Temps plein, Autre, CDI']",Ingénieur Junior Developpement Software (Relocalisation BE ou DE),The AKKAdemy,- France,"Temps plein, Autre, CDI",null,"il y a 30+ jours
Signaler cette offre d'emploi",Data Scientist,Bordeaux,"Please note that we can only consider candidates with EU citizenship.
With more than 21’000 skilled engineers and a solid presence in Europe, Asia and America, the AKKA Technologies Group is one of the leaders among European consulting engineering companies, always eager to meet the highest quality standards.
Our Mission
To keep pace with this fast-changing world, AKKA Technologies set up an
International Graduate Engineering Program, providing young talents with the opportunity to build a successful career and acquire a lifelong set of consulting skills
Must-Have
EU citizenship
Master’s Degree or PhD
Proficient in English. French and/or German are a big plus
What is your benefit to participate in this Program?
A permanent contract from day one
A career path inside The AKKA Technologies Group with highly diversified sectors
You will be challenged in order to solve, create and innovate
Unlimited Access to Online training (Udemy Business, Rosetta Stone online language courses)
A competitive salary and compensation package (International Health Insurance and much more)
Our International Graduate Program addresses those who have a genuine passion for technologies. As a part of a digital transformation program, we created The AKKAdemy. Bringing together high-potential engineers from all over Europe and train them to become the next generation of top engineering consultants – capable of meeting our clients' most difficult innovation & business challenges.
Roadmap of this Program
The AKKAdemy: 1 month in Geneva (Switzerland)
Hands-On-Project: 12 months in France, Belgium, Netherlands or Germany
Graduation and next step in the Group
Types of roles you can expect:
Information Technologies:
Software Engineers / Test Engineers / Computer Engineers /
AI Engineers / Big Data Engineers / Data Scientists /
Electronic Engineers / Embedded Software Engineers /
UX-UI Designers / App Developers / Junior Software Developer /
Cyber Security Engineers
With one or more of the following skills(non-exhaustive list):
Programming languages: Java, C/C++, C#, .NET, JavaScript or Python, etc.
Advanced knowledge in: Object-Oriented Design Principles, Data Structures, Algorithms, SQL/NoSQL, Operating Systems, and Software Engineering, etc.
Engineering
Automotive Engineers / Aeronautic-space Engineers /
Mechatronic Engineers / Electrical Engineers /
Electronic Engineers / Hardware Engineers /
Embedded Systems Engineers or similar.
With one or more of the following skills (non-exhaustive list):
Simulators: Matlab, Simulink, PSpice, GT Power, Dymola, etc.
CAD/CAM/CAE-Tools: CATIA V5, Siemens NX, Creo, etc.
Testing-Tools: CANoe / CANape, CANalyzer, INCA, DiagRA, etc.
Looking forward for your application!
Job Types: Full-time, New-Grad, Permanent
Education:
Master's (Preferred)
License:
EU Citizenship (Required)
Language:
English (Required)
French (Preferred)
German (Preferred)"
30,https://www.indeed.fr/emplois?q=Data%20Scientist&l=Bordeaux&radius=100&limit=100&sort=date&vjk=625473b8983580ed&advn=6002061405913665,"Développeur web Full-Stack (H/F)
Agence SEPPA - Floirac (33)
A répondu à 51 %-74 % des candidatures des 30 derniers jours, généralement en 3 jours.","['Floirac (33)', '30 000 € - 35 000 € par an']",Développeur web Full-Stack (H/F),Agence SEPPA,- Floirac (33),30 000 € - 35 000 € par an,30 000 € - 35 000 € par an,"il y a 8 mois
Signaler cette offre d'emploi",Data Scientist,Bordeaux,"En tant que Développeur full-stack, vous travaillerez en coopération au sein d’une équipe en plein développement constituée : d’une web designer, d’un développeur Front-end en alternance, d’un data scientist et d’un directeur conseil web.
Vous vous occuperez de développer des projets web variés tels que l’intégration des maquettes graphiques, des cartes interactives, la relation avec les bases de données.
Votre profil
Nous recherchons des individus bizarres, procrastinateurs et habitués à l'échec pour apprendre au quotidien et réussir les projets.
Vous êtes passionné par votre métier, curieux, organisé, rigoureux, autonome et force de proposition pour trouver les solutions aux problèmes soumis.
Vous avez envie d'apprendre, vous aimez les difficultés techniques et les solutions élégantes.
Vous êtes désireux d’améliorer les process actuels, d’apprendre de nouveaux langages.
Si les compétences suivantes incarnent votre quotidien alors n’hésitez pas :
Maitrise des technologie web (HTML, CSS, PHP, JS, SQL)
Maitrise du CMS Wordpress
Notions de Node.js
Une bonne connaissance et une première expérience en AJAX, WebGL, webpack, Grunt serait un plus
Être à l’aise avec git (Gitlab) et l’environnement Mac.
Réalisation de l’analyse technique (sous la responsabilité du chef de projet) :
Analyser les besoins du client spécifiés par la maitrise d’ouvrage et les traduire en cahier des charges techniques.
Écrire les spécifications techniques générales et détaillées en envisageant les problèmes éventuels et les évolutions.
Développement des sites web / applications :
Rédiger les lignes de codes nécessaires à la création d’un site web / application
Appliquer les règles de navigation et respecter les règles en vigueur de la W3C
Corriger et optimiser les fonctionnalités
Documenter les applications/sites pour les développements ultérieurs et la mise en production
Tests et écriture des corrections nécessaires :
Préparer et réaliser les test unitaires
Apporter les correctifs nécessaires suite à ces tests ou aux tests fonctionnels réalisés par les utilisateurs ou la maitrise d’ouvrage
Maintenance corrective et évolutive :
Assurer les corrections suite aux problèmes soulevés (bugs)
Prendre en compte les évolutions des solutions techniques existantes
Assurer la programmation des évolutions demandées par les utilisateurs
L’agence SEPPA
4 millions d'euros de chiffre d'affaires (croissance moyenne annuelle de 8 % depuis 9 ans consécutifs)
29 collaborateurs internes
30 ans d'expertise dans la communication
Communication globale pour clients institutionnels et privés
Type d'emploi : Temps plein
Salaire : 30 000,00€ à 35 000,00€ /an"
31,https://www.indeed.fr/emplois?q=Data%20Scientist&l=Bordeaux&radius=100&limit=100&sort=date&vjk=1a23b590c42351dc&advn=4190676325902957,"Ingénieur Logiciel Full-Stack - H/F
POLYCONSEIL - Bordeaux (33)","['Bordeaux (33)', 'CDI', '55 000 € par an']",Ingénieur Logiciel Full-Stack - H/F,POLYCONSEIL,- Bordeaux (33),CDI,55 000 € par an,"ChooseYourBoss - il y a 3 jours
- Continuer pour postuler
Signaler cette offre d'emploi",Data Scientist,Bordeaux,"Linux / Python / React / Javascript / Elasticsearch
Frontend Developer, Développeur Frontend, Backend Developer, Lead Developer, Full Stack Developer / CDI / Environ 55k€ / 3 - 6 ans / Bordeaux

Le poste
Au sein d'une équipe projet touche à tout et créative, composée de consultants, développeurs, data scientists, vous avez la possibilité d'avoir un impact réel sur la solution finale tout en étant en contact direct avec les décisionnaires de nos entreprises et institutions clientes. Quelques exemples de missions : - Conception du plus grand service d’ auto partage électrique au monde ( USA, Italie, Singapour) puis amélioration continue du SI et des parcours clients - Développement du logiciel de conception collaborative pour le lanceur Européen Ariane 6 - Création des portiques d’embarquement (hardware software) aujourd’hui déployés dans les gares TGV - Développement et commercialisation en SaaS d’un système de gestion intelligente de la politique de stationnement pour les plus grandes villes de France
Les responsabilités
Vous appliquez et développez vos compétences techniques à tous les niveaux : infrastructure (VM, docker, ...), architecture (micro-service, ...), développement (python, js, java, ...) ou gestion de projet.s les niveaux (review, intégration continue, ...)
Vous devenez « owner » de votre sujet et vous positionnez en véritable expert des questions que vous traitez
Vous êtes constamment force de proposition sur des sujets à fort enjeu pour nos clients et savez accompagner le projet de bout en bout, du cadrage stratégique à sa mise en oeuvre opérationnelle puis à son déploiement
Vous êtes en contact direct avec les décisionnaires de nos entreprises et institutions clientes
Pourquoi venir chez nous?
À 2 pas des Champs Elysées, Polyconseil est à la fois une startup orientée produit & un cabinet de conseil. Nous sommes en phase d'ouverture d'un nouveau bureau à Bordeaux et cherchons à monter une équipe de développeurs sur place. Rejoignez des équipes d'ingénierie de haut vol : o développez vos compétences transverses (projet, dév, infra, data science, ...) o devenez expert sur un métier donné (""le query planner de postgre n'a aucun secret pour moi"") => Domaines d'intervention variés (autopartage, aérospatial, ferroviaire, routier, ...) => Compétences sur toute la verticale (infrastructure, cloud, développement, assistance maîtrise d'ouvrage, cadrage strat) => Travail en équipes projets (3 à 12) rapprochées"
