,id,meta1,meta2,titre_poste,entreprise,localisation,contrat,salaire,date_publication,keyword_metier,keyword_localisation,description
83,https://www.indeed.fr/jobs?q=Data%20manager&l=Bordeaux&radius=100&sort=date&limit=50&start=50&vjk=29258d4fe0801491,"International Fieldwork Project Manager H/F
Cherche Susan Désespérément - Bordeaux (33)","['Bordeaux (33)', 'CDI']",International Fieldwork Project Manager H/F,Cherche Susan Désespérément,- Bordeaux (33),CDI,null,"il y a 6 mois
- Continuer pour postuler
Signaler cette offre d'emploi",Data manager,Bordeaux,"Notre client, un institut d’études Quantitatives basé à Bordeaux qui réalise des études en France et à l’international pour des clients essentiellement Food, Beauty et Retail, cherche à renforcer ses équipes avec un(e) International Fieldwork Project Manager.
Mission
Sous la Responsabilité de la Directrice du Département terrain, Le/La International Fielwork Project Manager/ Responsable International Production Quanti coordonne la mise en place des terrains internationaux en assurant le lien entre le chargé d’études et le prestataire, et en mettant en œuvre les moyens nécessaires au respect de la conformité et de la qualité du service rendu, dans le souci du respecte des normes qualité de l’entreprise.
Briefe les partenaires (après analyse et compréhension du projet)
Sélectionne le partenaire sur l’étude en fonction de critères de coûts (négocie les prix), de respect des délais, de conformité avec le projet, de compréhension de la méthodologie étude
Développe la connaissance des partenaires (spécificités métiers, marchés, compétitivité prix)
Confirme l’étude au partenaire (coût, délais, structure de l’étude), le forme aux méthodologies spécifiques Strategir (types d’étude, exigences logistiques et techniques, qualité du recueil, normes de codification et traitement des données)
Valide puis transmet au partenaire les éléments nécessaires au démarrage du terrain : questionnaires, quotas, matériel de test, consignes.
Assure le suivi des terrains
Réalise des audit de qualité sur le terrain
Réceptionne les datas et les transmet au service traitement de données
Evalue le partenaire en fin d’étude (notation qualité) et met à jour la liste des partenaires référenciés
Contribue à l’élaboration et à la mise à jour des documents de référence nécessaires au brief et à la formation des partenaires
Assiste ponctuellement aux démarrages terrains et peut être amené à effectuer le brief des équipes terrains à l’étranger (parfois en présence des clients)
Est référent expert du recueil à l’international (connaissance des spécificités liées aux pays, des partenaires, connait et suit l’historique des collaborations avec les différents partenaires / pays, …)
Peut être amené ponctuellement à soutenir l’activité terrain sur la zone France
Déplacements à prévoir pour rencontrer les partenaires

Profil
Vous avez une première expérience significative de terrain à l’international, vous avez une bonne compréhension des partenaires à l'étranger et de leurs spécificités culturelles, vous avez des capacités d'analyse et de compréhension de l’échantillonnage, vous maîtrisez la gestion multi projets au sens planification, organisation et coordination, vous avez une expérience de la gestion financière et du suivi de rentabilité
Votre anglais est courant à l'écrit comme à l'oral.
Vous avez envie de rejoindre une équipe terrain intégrée en y apportant votre expertise internationale."
84,https://www.indeed.fr/jobs?q=Data%20manager&l=Bordeaux&radius=100&sort=date&limit=50&start=50&vjk=a1d0f1eb6d4f4ed3,"On Line Fieldwork Project Manager H/F
Cherche Susan Désespérément - Bordeaux (33)","['Bordeaux (33)', 'CDI']",On Line Fieldwork Project Manager H/F,Cherche Susan Désespérément,- Bordeaux (33),CDI,null,"il y a 6 mois
- Continuer pour postuler
Signaler cette offre d'emploi",Data manager,Bordeaux,"Notre client, un institut d’études Quantitatives basé à Bordeaux qui réalise des études en France et à l’international pour des clients essentiellement Food, Beauty et Retail, cherche à renforcer ses équipes avec un(e) On Line Fieldwork Project Manager.
Mission
Sous la Responsabilité de la Directrice du Département terrain, Le/La Responsable Production Enquêtes Online/ On Line Fieldwork Project Manager coordonne la mise en place des terrains online en assurant le lien entre le chargé d’études et le prestataire, et en mettant en œuvre les moyens nécessaires au respect de la conformité et de la qualité du service rendu, dans le souci du respecte des normes qualité de l’entreprise.
Briefe les partenaires (après analyse et compréhension du projet)
Sélectionne le partenaire sur l’étude en fonction de critères de coûts (négocie les prix), de respect des délais, de conformité avec le projet, de compréhension de la méthodologie étude
Participe au développement de la connaissance des partenaires (spécificités métiers, marchés, compétitivité prix)
Confirme l’étude au partenaire (coût, délais, structure de l’étude), le forme aux méthodologies spécifiques de notre client (types d’étude, exigences logistiques et techniques, qualité du recueil, normes de codification et traitement des données)
Valide puis transmet au partenaire les éléments nécessaires au démarrage du terrain : questionnaires, quotas, matériel de test, consignes.
Assure le suivi des terrains online
Réceptionne les datas et les transmet au service traitement de données
Evalue le partenaire en fin d’étude (notation qualité)
Contribue à l’élaboration et à la mise à jour des documents de référence nécessaires au brief et à la formation des partenaires
Est référent expert du recueil online (connaissance des partenaires, des méthodes de sampling, de programmation…)

Profil
Vous avez des connaissances en techniques/méthodes/outils de recueil digitaux, vous avez des capacités d'analyse et de compréhension de l’échantillonnage, vous maîtrisez la gestion multi projets au sens planification, organisation et coordination, vous avez une expérience de la gestion financière et du suivi de rentabilité
Vous maitrisez l'anglais écrit
Vous avez envie de rejoindre une équipe terrain intégrée en y apportant votre expertise on line."
85,https://www.indeed.fr/jobs?q=Data%20manager&l=Bordeaux&radius=100&sort=date&limit=50&start=50&vjk=c8fcf0b501ac25c2,"Scrum Master H/F
AKKA TECHNOLOGIES124 avis - Bordeaux (33)","['Bordeaux (33)', 'CDI']",Scrum Master H/F,AKKA TECHNOLOGIES,- Bordeaux (33),CDI,null,"il y a 6 mois
- Continuer pour postuler
Signaler cette offre d'emploi",Data manager,Bordeaux,"AKKA Technologies, expert reconnu de l’Ingénierie et du Conseil en Technologies, compte aujourd’hui plus de 21 000 collaborateurs dans le monde.
Nos équipes accompagnent les acteurs des secteurs industriels et tertiaires dans leur processus d’innovation. Notre mission est de contribuer à l’amélioration de leur productivité, à travers des expertises métiers complémentaires : Ingénierie Mécanique, Process et Documentaire, Informatique Industrielle et Systèmes Embarqués, Systèmes d’Information.
Le Groupe est présent dans plus de 22 pays : Allemagne, Belgique, Espagne, France, Inde, Italie, Maroc, Roumanie, Royaume-Uni, Canada, ...

LE POSTE QUE NOUS PROPOSONS ET LES MISSIONS QUI VOUS SERONS CONFIÉES
Au sein du Pôle Informatique & Systèmes du Groupe AKKA Technologies, nous recherchons un Scrum Master (H/F) sur la région Bordelaise.
Intégré(e) auprès des équipes clients, vous travaillerez sur des projets à la pointe de l'innovation des technologies.
Vous aurez pour principales missions de :
Maitriser et améliorer la productivité de l'équipe en mettant en place une mesure et un suivi d'indicateurs agiles (burn up, leadtime…)
Participer avec l'équipe aux phases de définition d'architecture et de conception technique
La méthodologie SCRUM est au cœur du métier : Backlog, itinération, sprint, rétrospection
Superviser le bon fonctionnement en production et intervenir en support le cas échéant pour rétablir le plus rapidement le service aux utilisateurs
Manager / Coacher l’équipe pour améliorer les processus

PROFIL
QUI ETES-VOUS ?
De formation Bac+4/5 en informatique ou vous détenez une expérience réussie sur un poste similaire. Vous justifiez d'une solide expérience dans le poste ou en gestion de projet technique. La certification Scrum Master est un plus.
Vous avez donc développé des compétences et une expertise technique dans les technologies suivantes :
Compétences techniques requises en Java, C#, Talend ou Big Data (Hadoop, Hive, Spark).
Leader dans l'âme, vous savez fédérer l'équipe autour de vous et possédez un excellent relationnel.
Doté(e) de bonnes capacités relationnelles, vous avez le goût du travail en équipe et souhaitez, vous investir dans des projets techniques à forte valeur ajoutée. Passionné(e) par les nouvelles technologies, vous aimez la complexité et êtes capable d'appréhender les problématiques des clients avec pragmatisme et précision.
POURQUOI NOUS REJOINDRE ?
Akka c’est :
Un groupe qui valorise avant tout ses compétences techniques
Un environnement international
La possibilité de découvrir des secteurs d’activités passionnants : Aéronautique, Ferroviaire, Automobile, Défense, Energie...
L’opportunité de travailler sur des missions à forte valeur ajoutée de A à Z
…tout en étant accompagné par un leader technique sur le terrain
Mais n’oubliez pas, Akka c’est aussi :
Un groupe élu top employeur pour la 3ème année consécutive
Une équipe de business managers et recruteurs humains, réactifs et ayant le goût du challenge.
Une ambiance chaleureuse
L’occasion d’intégrer des clients situés dans une région où il fait bon vivre !
Concernant la rémunération, nous avons des fourchettes de salaire correspondantes à vos compétences et votre expérience. A cela s’ajoutera plusieurs avantages. Faites-nous part de vos prétentions, nous en discuterons !

A compétences égales, le poste est ouvert aux personnes en situation de handicap."
86,https://www.indeed.fr/jobs?q=Data%20manager&l=Bordeaux&radius=100&sort=date&limit=50&start=50&vjk=9270ffc18c479790,"Data Engineer F/H
Kent FR - Bordeaux (33)","['Bordeaux (33)', 'CDI', '35 000 € - 40 000 € par an']",Data Engineer F/H,Kent FR,- Bordeaux (33),CDI,35 000 € - 40 000 € par an,"il y a 6 mois
- Continuer pour postuler
Signaler cette offre d'emploi",Data manager,Bordeaux,"KENT, marque de GroupAgora dédiée aux recrutements de profils IT, recherche 1 Data Engineer F/H.
Rôles & Missions
Pourquoi ne pas vous laissez tenter par une offre très intéressante ? C’est ce que nous vous proposons aujourd’hui !
En effet, notre client spécialisé dans le négoce, recherche actuellement un data engineer dans un cadre d’expansion de son équipe composée de 5 techniciens supports, de 2 webmaster et d’un autre data engineer.
Fort de ses 30 ans d’ancienneté et possédant plus de 1 200 collaborateurs, vous deviendrez un réel membre de cette société dynamique où « travail » rime avec « convivialité ».

Environnement :
SQL Server
T-SQL
SSIS, SSRS, SSAS, Power BI
Outil GIT
XML
JSON
Missions :
Rédiger les specs fonctionnelles et/ou techniques
Développer le flux alimentation ETL
Conceptualiser et modéliser les cubes
Manager les livraisons dans différents environnements
Participer à l’optimisation des processus de développement
Effectuer des rapports et tableaux de bord
Profil Attendu
Nous recherchons donc un data engineer de formation bac+3/5 et justifiant de 3 à 5 ans d’expérience dans un poste similaire.
Vous êtes curieux, autonome et rigoureux.
Des connaissances sur le langage C# est un plus et/ou vous maîtrisez un autre langage de programmation.
Si vous êtes intéressé(e) par cette offre, n’hésitez pas à nous envoyer au plus vite votre cv !
Date de début souhaitée
ASAP"
87,https://www.indeed.fr/jobs?q=Data%20manager&l=Bordeaux&radius=100&sort=date&limit=50&start=50&vjk=cb9130cfe3dd3874,"Customer Success Manager - EMEA
OnCrawl - Bordeaux (33)","['Bordeaux (33)', 'CDI']",Customer Success Manager - EMEA,OnCrawl,- Bordeaux (33),CDI,null,"il y a 6 mois
- Continuer pour postuler
Signaler cette offre d'emploi",Data manager,Bordeaux,"OnCrawl is looking for a Customer Success Manager to help our clients and users efficiently use our solutions.
In collaboration with the Customer Success Team and under the supervision of the Head of Growth, you will carry out the following missions:
User portfolio management:
Onboard, develop and feed your own user portfolio
Assistance on certain issues
Support on the testing of new features
Daily management of the work flow of all users mainly via Intercom
Feedback from the field (take into account ideas / feedback / suggestions from users to make the tool evolve).
Contribution to product development (R&D):
Conduct research to develop the product (example: benefits of Natural Language Processing in SEO)
Identification of best practices by industry based on log data, etc
Reading and interpretation of Google’s patents to make the crawler evolve as close as possible to Googlebot’s behavior
Evangelization of SEO techniques:
Writing articles on OnCrawl’s blog
Participation in SEO events in Europe and North America
Lectures of conferences / workshops
Required skills
Minimum 2 years of SEO experience.
Technical appeal rather than off page
Mastery of the main tools on the market
Having used OnCrawl is a plus
Written English is required
Good interpersonal skills: you know how to adapt to the different personalities of your contacts
Experience: 2 years / 4 years experience
Salary: based on profile and experience
Permanent contract
Based in Bordeaux, France
Apply now"
88,https://www.indeed.fr/jobs?q=Data%20manager&l=Bordeaux&radius=100&sort=date&limit=50&start=50&vjk=340bd6d3ee1a0133,"Acquisition Manager
OnCrawl - Bordeaux (33)","['Bordeaux (33)', 'CDI']",Acquisition Manager,OnCrawl,- Bordeaux (33),CDI,null,"il y a 6 mois
- Continuer pour postuler
Signaler cette offre d'emploi",Data manager,Bordeaux,"Apply now
Your mission
OnCrawl is looking for a Acquisition Manager to join our team and to lead paid acquisition, growth hacking, funnel optimization and referrals to grow our community and customers. In direct collaboration with the CMO, the applicant will be responsible for:
Drive new customers by designing, implementing and scaling acquisition campaigns across different marketing tools (SEA, SEO, Display, Affiliation, Social ads,…)
Maximize paid and organic campaigns by conducting tests to optimize conversions.
Set KPIs and review performance to respect objectives.
Manage acquisition budget in collaboration with the CMO
Create, manage and monitor affiliate marketing strategies
Optimize the entire automation process to engage, nurture and improve user experience from defining scenarii to content creation, emailing and tracking in collaboration with the Content Manager.
Manage and optimize emailing campaigns regarding product releases, newsletters, events and more from creation to analytics.
Required skills
At OnCrawl, we value initiative, co-creation and creativity to help us create a B2B software that satisfy our user’s needs and meet the market expectations. The right candidate will need to have:
Knowledge and proven experience of digital marketing for a SaaS solution
Proven experience of paid ads management and optimization on Google Adwords, Facebook Ads, Twitter Ads
Strong understanding of the SEO industry and its mechanism
Used to working to deadlines and project-managing a range of campaigns and activities independently
Excellent copywriting, interpersonal skills and a persuasive communicator
Strong knowledge of CRM, Analytics and CMS tools
Ability to analyse, interpret and explain data for business purposes
Demonstrable understanding of social media marketing and how to apply this to campaigns
Highly self-motivated, enjoy working as part of a team and able to work independently
Fluent/Native in English and French. Other languages such as Spanish or German are a plus.
Experience : at least 2-5 years experience
Permanent contract
Based in Bordeaux, France
Salary: based on profile and experience
Apply now"
89,https://www.indeed.fr/jobs?q=Data%20manager&l=Bordeaux&radius=100&sort=date&limit=50&start=50&vjk=2382fa1dc0f50888,"Coach agile (h/f)
ippon - Bordeaux (33)",['Bordeaux (33)'],Coach agile (h/f),ippon,- Bordeaux (33),null,null,"il y a 7 mois
- Continuer pour postuler
Signaler cette offre d'emploi",Data manager,Bordeaux,"Ippon recherche un(e) coach agile
Ippon est un cabinet de conseil en solutions digitales, cloud et data créé en 2002 par un ancien champion de judo. Aujourd'hui, Ippon propose une offre End to End permettant d'accompagner nos clients sur l'ensemble du cycle de transformation digitale : cadrage stratégique, expérience client, vision produit, transformation agile. Rattaché au pôle Digital Consulting, vous interviendrez en Conseil stratégique et opérationnel ainsi qu’en accompagnement au sein d’équipes pluridisciplinaires.
. . .
Votre mission :
En tant que coach agile, vous menez des transformations/transitions agile auprès d’équipes opérationnelles multiples (IT et métier), transverses ou managériales.
Vous accompagnez les équipes de réalisation dans l’appropriation et la mise en oeuvre des pratiques agiles.
Vous accompagnez les métiers et les product owners sur les problématiques de gestion de produit et d’innovation des produits logiciels (Innovation Games, Lean StartUp, customer experience mapping, etc.).
Vous intervenez en mode conseil auprès de nos clients en vue de faire évoluer leurs organisations et vous opérez la transformation agile.
Vous accompagnez les managers (middle et top management) dans le cadre de la transformation agile de leur organisation
Vous êtes à l’aise pour faciliter tout type de réunion, y compris en utilisant des approches innovantes tels que des serious games (agile games, innovation games, …)
Vous agirez en tant qu’évangéliste de l’Agilité aussi bien chez nos clients qu’en interne
. . .
Pour cela, il est recommandé :
De toujours vouloir apprendre et partager
D’avoir une grande capacité d’écoute et d’être bon communiquant
D’être fun et pédagogue"
90,https://www.indeed.fr/jobs?q=Data%20manager&l=Bordeaux&radius=100&sort=date&limit=50&start=50&vjk=465ccce5fc3fe76c,"Data Engineer H/F (Bordeaux)
Keyrus13 avis - Bordeaux (33)","['Bordeaux (33)', 'CDI']",Data Engineer H/F (Bordeaux),Keyrus,- Bordeaux (33),CDI,null,"il y a 8 mois
- Continuer pour postuler
Signaler cette offre d'emploi",Data manager,Bordeaux,"Qui sommes-nous ?
Une success story dans la Data et le Digital !
Notre mission ? Des projets à forte valeur ajoutée pour accroître la performance et la compétitivité des entreprises, faciliter et accélérer leur transformation.
Notre expertise depuis plus de 20 ans ? Le conseil et l'intégration de solutions innovantes autour de trois domaines :
Data Intelligence : Business Intelligence et Big Data & Analytics
Digital Experience : Conseil, Stratégie & Performance Digitales
Conseil en Management & Transformation : Pilotage de la Performance & Accompagnement des Projets
Nous sommes plus de 3200 talents sur plus de 18 pays et 4 continents. Notre ADN ? Innover et entreprendre.
Vous êtes ambitieux et souhaitez intégrer un groupe agile et international où vos qualités professionnelles et personnelles seront reconnues et cultivées ?
Pour cela,
Nous vous proposons de nous rejoindre et d’intégrer notre agence de Bordeaux !
Nos maîtres mots sont AGILITE, EXPERTISE, DIVERSITE.
Notre ADN ? Innover et entreprendre.
Bordeaux recherche un Data Engineer
Votre mission :
Il s’agit d’un projet orienté sur le calcul de la performace et ROI des produits clients en vue d'une restitution aux fronts clients, commerciaux et différents acteurs internes.
Le projet dispose :
d’une partie back office de consommation, contrôles, intégration, consolidation de flux de données
d’une partie front de restitution de données au travers d’une api graphQL sur laquelle se greffe un portail vendeurs, une api PDF et un moteur de production industrielle de documents MSOffice.
La mission consiste en :
développement des US de la backlog
migration des flux sur cloud Google (GCP)
support technique sur la qualité des développements
amélioration de la supervision des flux
développement du contrôle qualité des données
développement d’alertes sur la qualité des flux de données
Votre profil:
Vous avez pu mettre à profit durant 3 ans minimum des compétences dans :
Développement : Scala/Spark – ElasticSearch – GraphQL
CI/CD : Git – Jenkins - Azkaban - Docker
Agile : Scrum – Kanban
Cloud : GCP (pub/sub, BigQuery, DataFlow, DataProc, BigTable) – Azure (APP services)
Pourquoi nous rejoindre ?
Parce que notre équipe saura vous accueillir et votre manager vous accompagner dans votre épanouissement professionnel.
#KeyrusRocks #YouRock
Keyrus est une entreprise où il fait bon vivre et travailler !
Découvrez :
> La vie chez Keyrus en 60 sec
> Keyrus en 3 mots
> Nos animations pour nos collaborateurs sur Facebook et sur Instagram."
91,https://www.indeed.fr/jobs?q=Data%20manager&l=Bordeaux&radius=100&sort=date&limit=50&start=50&vjk=ff19a1a9ba6558da,"City Developer Bordeaux - CDI ️
Brigad13 avis - Bordeaux (33)","['Bordeaux (33)', 'CDI']",City Developer Bordeaux - CDI ️,Brigad,- Bordeaux (33),CDI,null,"il y a 8 mois
- Continuer pour postuler
Signaler cette offre d'emploi",Data manager,Bordeaux,"Apprendre chaque jour, battre des records, te dépasser dans tes missions. Voilà, dans les grandes lignes, ce qui t’attend chez Brigad. Dans le détail, tu participeras au lancement de la ville puis seras en charge de faire croître le nombre de clients et de maintenir une croissance exponentielle, mois par mois.
MISSION
Création et développement de listes de premiers prospects qualifiés (Secteur Food & Beverage)
Démarchage téléphonique + rdv physique
Activation des établissements inscrits sur Brigad.co
Gestion et développement d’un portefeuille de clients
Suivi et optimisation de tes performances via un CRM
Animation des sessions physiques d’onboarding Brigader
Quelques mots sur BRIGAD
Brigad met en relation en quelques minutes des entreprises avec des professionnels indépendants. Un restaurant / traiteur a un besoin de personnel qualifié? BRIGAD s’occupe de tout.
Janvier 2016 : Lancement de BRIGAD
Mai 2016 : BRIGAD remporte le #UberPITCH 2016
Août 2016 : Première levée de fonds auprès de 50 Partners Capital, Uber technologies Inc.
Février 2017 : Lévée de fond de 2,4 millions d’euros ️
Novembre 2017 : Lancement de Brigad à Lyon
Avril 2018 : Lancement du service à Londres.
Janvier 2019 : Expansion géographique du service en France (Bordeaux, Lille, Marseille).
Profil recherché
Nous recherchons un profil ayant au minimum un an d’expérience en tant que Business Developer et/ou Account manager. Une connaissance du secteur CHR serait un avantage considérable.
Trois composantes majeures du poste de Business Developer :
Performance : atteindre et dépasser les objectifs ambitieux fixés en ligne avec la forte croissance de Brigad à Bordeaux.
Organisation : bonne répartition des actions entre la chasse de nouveaux comptes stratégiques et le développement du portefeuille de clients existants. Être organisé(e) et rigoureux est indispensable pour ce poste.
Autonomie : équipe locale à forte responsabilité.
Ce profil devra également avoir un attrait pour la gestion de data et la création de reporting, afin de mesurer au mieux le resultat des actions prises et l’évolution du portefeuille clients.
Si tu aimes le challenge, travailler dans un environnement très dynamique ce poste est fait pour toi !"
