,id,meta1,meta2,titre_poste,entreprise,localisation,contrat,salaire,date_publication,keyword_metier,keyword_localisation,description
78,https://www.indeed.fr/jobs?q=Data%20Engineer&l=Toulouse&radius=100&sort=date&limit=50&start=50&vjk=60f831b246e121b4,"Ingénieur Réseau en Alternance
Dimension Data704 avis - Toulouse (31)",['Toulouse (31)'],Ingénieur Réseau en Alternance,Dimension Data,- Toulouse (31),null,null,"il y a 30+ jours
- Continuer pour postuler
Signaler cette offre d'emploi",Data Engineer,Toulouse,"Ingénieur Réseau en Alternance
Looking for the next step in your career? Enjoy a challenge? Do you have an ambition for innovation? Want to make a difference?
If you join our growing global team, you’ll be working for an industry leader with offices across five continents, in over 47 countries and more than 28 000 employees. You will work with some of the leading world brands across the Fortune 100 and Fortune 500 companies – who are all relying on Dimension Data to help them use the power of technology to achieve their ambition in this digital era.You’ll be part of a team who’s passionate about making a difference to the way technology shapes how we live and work – whether it’s protecting the rhino, connecting the G20 Summit, or revolutionising cycling, giving you the opportunity to do great things.
You’ll be joining a Global Top Employer, recognised for investing in talent because people are at the heart of our success. You provide the skills, passion and ideas, and we’ll provide the platform to realise your ambitions.Great talent. Great teams. Great work. Great opportunities.
Want to be part of our team?
The role is responsible for providing a service to clients to ensure that their IT infrastructure and systems remain operational through proactively identifying, investigating and resolving technical incidents and problems and to restore service to clients by managing incidents to resolution.

Their primary objective is to ensure zero missed service level agreement conditions. The MS Services Engineer (L1) focuses on first line support for standard and low complexity incidents.
What you'll be doing
Stakeholder engagement
Internal: engage with internal services engineering team, receive instructions, and manage escalation of incidents as necessary following agreed procedures.
External: proactively act as first-line technical support for clients and monitoring platform (including call handling, ticket creation and logging and the analysis, assignment and escalation thereof).
Value Chain Linkage
Managed Services Operations Centre
Managed Services Center of Excellence (CoE)
Managed Services Transition
Managed Services Cross Functional Services
Skills and attributes
Managed Services:
Identifies and resolves technical problems and fulfils requests following agreed procedures. Uses appropriate and standard tools and procedures to diagnose and resolve incidents. Carries out agreed maintenance tasks and fulfils requests as required.
Service Level Management:
Proactively monitors and confirms the resolution of incidents or completion of requests such that accurate service level measurements are maintained.
Incident Management:
Following agreed procedures, identifies, registers and categorises incidents. Gathers information to enable incident resolution, resolves incidents according to agreed procedures and where necessary promptly allocates incidents to other functions or resolver groups. Update knowledge articles to reflect new work instructions or procedures.
Configuration Management:
Applies tools, techniques and processes to track, log, report on and correct configuration items, components and changes.
Service Request Management:
Apply standard process and procedures to fulfil requests from clients, adhering to service level agreements or operational agreements. Route them to the right function, resolver group as necessary. Update knowledge articles to reflect new work instructions or procedures.
Teamwork:
Work effectively as part of a team which may be local or virtual/global.
Work Outputs
Monitor operational infrastructure:
The MS - Services Engineer (L1) monitors client infrastructure and solutions. In this regard they will respond to monitoring events and perform corrective and/or resolution actions or escalated accordingly and/or log as required.
Identify problems and errors:
The MS – Services Engineer (L1) identifies problems and errors prior to or when they occur by monitoring the system. He or she will log all such incidents in a timely manner with the required level of detail necessary. They liaise with all stakeholders including client IT environments, vendors, carriers and Dimension Data colleagues to expedite diagnosis of errors and problems and to identify a resolution. The MS – Services Engineer (L1) will routinely identify common incidents and opportunities for avoidance as well as general opportunities for incident reduction. This could include identification of problematic systems in a client environment or regular times certain incidents occur. They will either identify potential solutions for reduction/avoidance or seek assistance from L2+ team members or other functional teams. MS Service Engineer (L1) also flags any repeat incidents or service requests for automation.
Incident management
When required they will take responsibility receiving calls, emails, chat sessions and incidents at the services desk. They assist in analysing, resolving and where required assigning and escalating the support requests. They also provide telephonic or chat support to clients where required. They update incidents with progress and resolution details.
Execute approved maintenance activities:
Where required, the MS – Services Engineer (L1) will execute approved maintenance activities. These activities could include system patching, system upgrades including software deployment or configuration changes. Taking direction from their team leader or senior team members, they will execute the maintenance activities assigned to them. This will include familiarising themselves with the work instructions, ensuring the change record is approved, executing the activities according to work instructions, executing any exceptions or errors to senior team members and updating the change record to indicate the completion time and status.
Ensure resolution of incidents and requests:
Investigate incidents assigned to them and apply appropriate procedures to resolve them. Apply standard operating procedures for service requests. Ensure efficient and comprehensive resolution of incidents and service requests. This could involve resolution following agreed procedures calling on their own technical skills and competency or ensuring that resolution is completed by coordinating with other team members. They will also report and escalate issues to 3rd party vendors if necessary. They take full ownership for managing the incident to resolution within the service level conditions. Where necessary, they escalate incidents and requests to a resolver group or other functional teams. Provide continuous feedback to clients and affected parties and update all systems and/or portals as prescribed by Dimension Data procedures.
Shift handover:
MS – Services Engineers (L1) that work shifts will be required to follow the required handover procedures for shift changes to ensure service continuity. They complete and maintain any shift hand hover schedules.
Knowledge Management:
They will utilise knowledge management systems as part of all work activities to ensure adherence to agreed procedures. They will proactively identify opportunities for additions, modifications or improvements to knowledge management systems in order to reduce incident resolution time and increase the number of activities that can be completed at L1.
Quality Management:
They will proactively identify opportunities for work optimisation including opportunities for automation of work, request fulfilment and incident resolution tasks performed by L2+ that could be completed by L1, opportunities for repeat incident avoidance and other general process improvement opportunities.
Next career steps
MS – Services Engineer (L2)
Senior Service Delivery Service Desk Agent
Incident Coordinator (Cross Functional Services)
Education required
Diploma, degree or relevant qualification in IT/Computing (or demonstrated equivalent work experience)
15 years of education
Advantageous Certifications
ITIL v3 Foundation
Cisco Certified Network Associate - Routing and Switching (CCNA-R/S)
Cisco Certified Network Associate - Wireless (CCNA-WL)
Riverbed Certified Solutions Associate - WAN Optimization (RCSA-W)
Cisco Certified Network Associate - Security (CCNA-SEC)
IP, WINS, DHCP, DNC, etc
MS-Office, MS-Outlook, Symantec Backup Exec, Symantec EndPoint Protection, Symantec System Recovery, Citrix Go-To-Assist
MS-Active Directory
MS-Windows Server
MS-Windows XP Professional
MS-Windows Terminal Server
MS-Exchange Server
MS-SQL Server
MS-IIS Server
Citrix Metaframe
Switches and Routers
SonicWall Firewalls and SSL VPN Security Appliances
Cisco Firewalls and Routers
Cisco Certified Network Associate - Data Center (CCNA-DC)
MCSA+VCP, RHCE or equivalent
Cisco Certified Network Associate - Video (CCNA-VID)
Cisco Certified Network Associate - Voice (CCNA-V)
Any of the above certifications is a plus. The MS – Services Engineer (L1) is expected to gain certifications relevant to services supported. Certifications carry additional weight on candidate’s qualification for the role.
Work experience required
2 - 4 years’ work experience or completion of relevant intern program
1 to 2 years of experience with troubleshooting and providing support required in network/ data centre/ systems/ storage administration and monitoring Services within a medium to large ICT organisation.
Working knowledge of management agent, redundancy concepts, and products within the supported technical domain (i.e. Network, Data Center, Telephony, Exchange, Storage, Cloud, Backup etc)
What would make you a good fit for this role?
Join our growing global team and accelerate your career with Dimension Data. Apply today.
Diversity in Dimension Data
Dimension Data is an equal opportunity employer with a global culture that embraces diversity. All qualified applicants will receive consideration for employment and will not be unfairly discriminated against on any arbitrary ground including race, colour, sex, religion, national origin, veteran status, disability, gender identity, sexual orientation, or other protected category."
79,https://www.indeed.fr/jobs?q=Data%20Engineer&l=Toulouse&radius=100&sort=date&limit=50&start=50&vjk=d53476acf4e8c554,"Data Engineer H/F
BVA groupe79 avis - Balma (31)","['Balma (31)', 'CDI']",Data Engineer H/F,BVA groupe,- Balma (31),CDI,null,"il y a 30+ jours
- Continuer pour postuler
Signaler cette offre d'emploi",Data Engineer,Toulouse,"À propos
Société d’études et conseil, spécialiste du comportement, le groupe BVA est reconnu comme l’un des leaders les plus innovants du secteur.
Afin de participer à la réalisation de nos études et de nos projets de R&D, nous recherchons un(e) Data Engineer H/F pour rejoindre notre équipe. Vous aurez l’opportunité de travailler pour des clients de l’univers de la banque-assurance, automobile, télécom-multimédia, tourisme, transport, industrie, du commerce et de la distribution.
Descriptif du poste
Ce que nous pouvons accomplir ensemble …
Notre équipe data-engineering a la responsabilité de concevoir, orchestrer et maintenir nos pipelines de données, colonne vertébrale des dispositifs techniques mis en œuvre pour nos clients.
Nos Data Engineers sont intégrés à des équipes pluridisciplinaires incluant des experts passionnés (Data Scientists, Data Collection, BI, Data Analysts) où ils collaborent étroitement pour délivrer en continu une forte valeur ajoutée à nos clients.
Attachés à l’excellence technique, ils conçoivent, maintiennent et améliorent en continu nos systèmes d’orchestration de flux de données.
Force de proposition, ils participent activement à l’évolution de nos infrastructures en collaboration étroite avec nos équipes d’architectes IT/Cloud.
Une infrastructure en constante évolution est mise à leur disposition pour leur permettre l’accès aux meilleures technologies open-source (Spark, Hadoop, conteneurisation, orchestration Kubernetes) et ainsi concevoir des solutions répondants à nos impératifs de scalabilité et de qualité.
Responsabilisés, ils sont encouragés à constamment faire évoluer nos pratiques et à explorer les dernières technologies pour répondre et devancer les attentes de nos clients.
Passionnés, ils participent activement à nos communautés techniques (Dev/Ops, Data) pour partager leurs connaissances et profiter d’un environnement encourageant l’innovation.
Profil recherché
*Vous êtes la perle rare car … *
Vous justifiez d’une expérience de 1 à 3 ans et vous avez des connaissances en :
Extensive knowledge of data processing (pandas, luigi, sqlalchemy) and storage, in Python, PostgresSQL or MSSQL.
Knowledge of Linux Environment
Experience of Machine Learing in Python or R is appreciated
Knowledge of Spark, Talend, Impala is appreciated
Good english communication skills required
Vous êtes capable de :
Recueil des besoins des end-users
Collaborer avec d'autres équipes pour résoudre des problèmes business
Communiquer vos résultats à d'autres équipes et partager les meilleures pratiques au sein de l’équipe Data Engineering
Vous avez une forte capacité de priorisation, une qualité rédactionnelle et de présentation de vos travaux à l'oral, un esprit analytique poussé et êtes force de proposition
Vous êtes organisé, rigoureux, autonome et orienté client
*On est fait pour vous car … *
ESPRIT START’UP que nous avons gardé : collaboration, reconnaissance, convivialité et esprit d’initiative font partie de nos valeurs.
LET’S INNOVATE nous investissons 4% de notre chiffre d’affaires dans la R&D : venez relever les défis de demain dans une entreprise qui adore se réinventer !
FRENCH BUT WORLDWIDE Avec plus de 98 nationalités différentes et une présence dans 16 pays, l'international fait partie de notre ADN : source de diversité culturelle, d'ouverture d'esprit et de projets internationaux !
WORK HARD, PLAY HARD Nos soirées sont à l'image de nos collaborateurs : créatives, innovantes et un peu folles. Etes-vous prêt à en prendre plein les yeux ?
Informations complémentaires
Type de contrat : CDI
Lieu : Balma, France (31130)
Expérience : > 1 an"
80,https://www.indeed.fr/jobs?q=Data%20Engineer&l=Toulouse&radius=100&sort=date&limit=50&start=50&vjk=6f97164379b0f893,"Data Analyst BI H/F
BVA groupe79 avis - Balma (31)","['Balma (31)', 'CDI']",Data Analyst BI H/F,BVA groupe,- Balma (31),CDI,null,"il y a 30+ jours
- Continuer pour postuler
Signaler cette offre d'emploi",Data Engineer,Toulouse,"À propos
Société d’études et conseil, spécialiste du comportement, le groupe BVA est reconnu comme l’un des leaders les plus innovants du secteur.
Afin de participer à la réalisation de nos études et de nos projets de R&D, nous recherchons un(e) Data Analyst BI H/F pour notre équipe Data. Vous aurez l’opportunité de travailler pour des clients de l’univers de la banque-assurance, automobile, télécom-multimédia, tourisme, transport, industrie, du commerce et de la distribution.
Descriptif du poste
Ce que nous pouvons accomplir ensemble …
Passionné de Data Visualisation, et au-delà de vos compétences techniques avérées de développement, vous vous appuierez sur votre expérience métier construites sur des projets BI Marketing pour créer le poste de Data Analyst BI :
Compréhension des problématiques business et data de nos clients
Participation aux phases d’avant-vente : étude des cahiers des charges clients, rédaction de nos propositions de valeur, création de POC
Prise de brief et traduction en besoins techniques et fonctionnels
Conception des solutions dans une démarche de co-construction avec les clients car vous êtes l’interlocuteur privilégié des équipes métiers
Vous évoluerez dans un environnement de spécialistes de la Data et serez entourés d’expert Data Engineer, Data Scientist, Data Analyst et UX Designer
Profil recherché
Vous êtes la perle rare car …
Vous justifiez d’une expérience de 1 à 3 ans sur un poste similaire :
Possédez une expérience significative sur les outils BI et maitriser Power BI
Vous avez une très forte appétence pour la Data et l’Analytics
Vous maitriser R ou Python
Vous avez un bon niveau en SQL
Vous êtes à l’aise avec les concepts de Data Warehouse et ETL
Votre niveau d’anglais est courant
Votre dynamisme et votre aisance relationnelle vous permettent d’être facilement en contact avec tous les experts métier dans un constante posture Client Centric.
Votre attitude Solution Oriented et votre réactivité font de vous un team player reconnu et apprécié.
Vous avez une forte capacité de synthèse et de priorisation, un esprit analytique poussé et êtes force de proposition.
Vous êtes organisé, rigoureux et autonome.
On est fait pour vous car …
ESPRIT START’UP que nous avons gardé : collaboration, reconnaissance, convivialité et esprit d’initiative font partie de nos valeurs.
LET’S INNOVATE nous investissons 4% de notre chiffre d’affaires dans la R&D : venez relever les défis de demain dans une entreprise qui adore se réinventer !
FRENCH BUT WORLDWIDE Avec plus de 98 nationalités différentes et une présence dans 16 pays, l'international fait partie de notre ADN : source de diversité culturelle, d'ouverture d'esprit et de projets internationaux !
WORK HARD, PLAY HARD Nos soirées sont à l'image de nos collaborateurs : créatives, innovantes et un peu folles. Etes-vous prêt à en prendre plein les yeux ?
Lieu : Toulouse / Balma (31)
Contrat : CDI
Disponibilité : ASAP
Informations complémentaires
Type de contrat : CDI
Lieu : Balma, France (31130)
Expérience : > 1 an
Télétravail possible"
81,https://www.indeed.fr/jobs?q=Data%20Engineer&l=Toulouse&radius=100&sort=date&limit=50&start=50&vjk=8272779d9278239b,"Analyste Bi F/H
Kent FR - Haute-Garonne","['Haute-Garonne', 'CDI', '37 000 € - 42 000 € par an']",Analyste Bi F/H,Kent FR,- Haute-Garonne,CDI,37 000 € - 42 000 € par an,"il y a 30+ jours
- Continuer pour postuler
Signaler cette offre d'emploi",Data Engineer,Toulouse,"KENT, marque de GroupAgora dédiée aux recrutements de profils IT, recherche 1 Analyste Bi F/H.
Rôles & Missions
Vous êtes curieux et aimez comprendre les tendances de demain, vous challenger et expérimenter de nouveaux dispositifs?
Kent vous propose de rejoindre son client final en tant que Analyste BI pour une entreprise spécialisé dans le comportement et le conseil.
Elle est amenée à travailler avec des clients diverses dans le secteur Automobile, télécom...
Vous serez amené à travailler avec l’équipe Data composé de Data engineer, scientist, analyst et UX Designer.
Vos différentes missions s’axeront sur :
Une bonne compréhension des problématiques buisness data des clients.
La participation aux phases d’avant-vente (Etude cahiers des charges clients, création de POC).
Une bonne compréhension du briefing client pour pouvoir le traduire en besoin techniques et fonctionnels.
La conception des solutions dans une démarche de co-construction avec les clients car vous serez l’interlocuteur privilégié des équipes métiers.
Profil Attendu
Vous justifiez d’une expérience de 1 à 2 ans sur un poste similaire :
Possédez une expérience significative sur les outils BI et maitriser Power BI(tableau SoftWare),
Vous avez une très forte appétence pour la Data et l’Analytics
Vous maitriser R ou Python et un bon niveau en SQL
Votre niveau d’anglais est courant.
Vous avez une forte capacité de synthèse et de priorisation, un esprit analytique poussé et êtes force de proposition.
Vous êtes organisé, rigoureux et autonome.
Date de début souhaitée
ASAP"
82,https://www.indeed.fr/jobs?q=Data%20Engineer&l=Toulouse&radius=100&sort=date&limit=50&start=50&vjk=d45f62b53255c9fc,"FRA - Gestionnaire de Paie MA
ADP5,526 avis - Blagnac (31)",['Blagnac (31)'],FRA - Gestionnaire de Paie MA,ADP,- Blagnac (31),null,null,"il y a 30+ jours
- Continuer pour postuler
Signaler cette offre d'emploi",Data Engineer,Toulouse,"We are looking for :
A Payroll Clerk MA H / F
At ADP, the world leader in Payroll and Human Resources and as part of the ADP MA Offer, you will be integrated into a Customer Service team and will be responsible for managing one or more clients.
You ensure the quality of our services and payroll control in accordance with customer / ADP processes defined contractually.
Your main missions are:
Control and evolve the customer's payroll regulation:
Maintain and evolve the customer's regulations with the support and Application Engineers;
Centralize customer requests and validate them;
Take into account the specific requests of the customer within the limits of the model.
Produce and control payroll in accordance with defined processes:
Receive and integrate into the workstation the payroll data appearing on the liaison media or files (hiring, STC, management of oppositions, etc.);
Validate and process payroll data
Produce and control the pay according to the processes defined in collaboration with the structures of Back Office;
Elaborate the social charges;
Manage administrative records
Follow payroll schedules.
Manage the customer relationship:
Respond to customer requests and guarantee the contractual framework;
Anticipate the customer relationship;
Assist and advise the client on all payroll and declarative matters;
Animate production meetings at the customer.
Trained at least 2 years, you have a first experience of payroll in business or service company. Your experience has allowed you to develop your sense of customer relationship (external and / or internal), your team spirit, your rigor and your sense of responsibility.
The mastery of ADP tools is a real asset (Zadig).
We're designing a better way to work, so you can achieve what you're working for. Consistently named one of the 'Most Admired Companies' by FORTUNE® Magazine, and recognized by DiversityInc® as one of the 'Top 50 Companies for Diversity,' ADP works with more than 740,000 organizations across the globe to help their people work smarter, embrace new challenges, and unleash their talent. ""Always Designing for People"" means we're creating platforms that will transform how great work gets done, so together we can unlock a world of opportunity.
At ADP, we believe that diversity fuels innovation. ADP is committed to equal employment opportunities regardless of race, color, genetic information, creed, religion, sex, sexual orientation, gender identity, lawful alien status, national origin, age, marital status, or protected veteran status. We support an inclusive workplace where associates excel based on personal merit, qualifications, experience, ability, and job performance."
