,id,meta1,meta2,titre_poste,entreprise,localisation,contrat,salaire,date_publication,keyword_metier,keyword_localisation,description
60,https://www.indeed.fr/jobs?q=Data%20Engineer&l=Toulouse&radius=100&sort=date&limit=50&start=50&vjk=345a244ab6292041,"EVYAA - Autopilot test engineer
Airbus1,455 avis - Toulouse (31)",['Toulouse (31)'],EVYAA - Autopilot test engineer,Airbus,- Toulouse (31),null,null,"il y a 30+ jours
- Continuer pour postuler
Signaler cette offre d'emploi",Data Engineer,Toulouse,"Airbus Operations SAS
Airbus is a global leader in aeronautics, space and related services. In 2018 it generated revenues of € 64 billion and employed a workforce of around 134,000. Airbus offers the most comprehensive range of passenger airliners. Airbus is also a European leader providing tanker, combat, transport and mission aircraft, as well as one of the world's leading space companies. In helicopters, Airbus provides the most efficient civil and military rotorcraft solutions worldwide.

Our people work with passion and determination to make the world a more connected, safer and smarter place. Taking pride in our work, we draw on each other's expertise and experience to achieve excellence. Our diversity and teamwork culture propel us to accomplish the extraordinary - on the ground, in the sky and in space.
Job Description
Contact :
Please apply on line for this vacancy on line at our careers site (www.airbus.com) with your CV and cover letter attached.
By submitting your CV or application you are consenting to Airbus using and storing information about you for monitoring purposes relating to your application or future employment. This information will only be used by Airbus.

Description of the job :
Have you ever thought about piloting one of our Airbus commercial Aircraft?

Would you like to learn how the airlines pilot operate the aircraft in real conditions? Or prepare what the flight test crew will perform in flight?

If you feel excited by this mission, this job is for you!

A vacancy for an Autopilot test Engineer has arisen within Airbus (Commercial Aircraft) in Toulouse. You will join the Autopilot testing team which is in charge of developing and verifying systems and aircraft physics on simulators, before flight testing for final validation. This team is responsible of Autopilot integration tests, flights test analysis and lead innovation activities related to the discipline on all Airbus aircraft programs. Our top objective is to deliver higher safety standards, more mature products, innovative solutions, while rethinking our way of working.

Have you ever thought about piloting one of our Airbus commercial Aircraft?

Would you like to learn how the airlines pilot operate the aircraft in real conditions? Or prepare what the flight test crew will perform in flight?

If you feel excited by this mission, this job is for you!

Task & accountabilities :
Your main tasks and responsibilities will include:

Learning the airline operational procedures in order to build fully representative test scenarii
Testing the system beyond standard procedures in order to demonstrate the robustness and the safety of the system in any conditions
Being trained on new digital solution and advanced data analytics methods (machine learning, artificial intelligence) since the team is leading some key projects, in this field in order to prepare the next Airbus challenges on autonomous vehicle.

This role will involve some very rare travel for business in Europe and as such you must be able to travel accordingly.

Required skills :
You will have the following skills and experience:

Educated to degree level (or equivalent) in Engineering or a related discipline.
Experience in Flight physics or System logics (SAO, Scrade reading) or Tests activities (benches, tools, ...)
A good knowledge of airline operating procedures and environment is a real added value
Advanced data analytics method (machine learning, artificial intelligence) is also a key asset
Good communication skills and a pro-active, approach to drive innovation
Ability to work to strict timescales as part of an integrated, multidisciplined team
Assertiveness
Advanced level of English and French.

This job requires an awareness of any potential compliance risks and a commitment to act with integrity, as the foundation for the Company’s success, reputation and sustainable growth.

By submitting your CV or application you are consenting to Airbus using and storing information about you for monitoring purposes relating to your application or future employment. This information will only be used by Airbus.
Airbus is committed to achieving workforce diversity and creating an inclusive working environment. We welcome all applications irrespective of social and cultural background, age, gender, disability, sexual orientation or religious belief."
61,https://www.indeed.fr/jobs?q=Data%20Engineer&l=Toulouse&radius=100&sort=date&limit=50&start=50&vjk=aa74836cbace23e3,"HO Cyber Security Foundations and Extended Enterprise m/f
Airbus1,455 avis - Toulouse (31)",['Toulouse (31)'],HO Cyber Security Foundations and Extended Enterprise m/f,Airbus,- Toulouse (31),null,null,"il y a 30+ jours
- Continuer pour postuler
Signaler cette offre d'emploi",Data Engineer,Toulouse,"Airbus Operations SAS
Airbus is a global leader in aeronautics, space and related services. In 2018 it generated revenues of € 64 billion and employed a workforce of around 134,000. Airbus offers the most comprehensive range of passenger airliners. Airbus is also a European leader providing tanker, combat, transport and mission aircraft, as well as one of the world's leading space companies. In helicopters, Airbus provides the most efficient civil and military rotorcraft solutions worldwide.

Our people work with passion and determination to make the world a more connected, safer and smarter place. Taking pride in our work, we draw on each other's expertise and experience to achieve excellence. Our diversity and teamwork culture propel us to accomplish the extraordinary - on the ground, in the sky and in space.
Job Description
Contact :
Please apply for this vacancy online at our careers site: Find your perfect job! (www.airbus.com/careers.html) with your CV and a cover letter in English attached. By submitting your application you are consenting to Airbus Group using and storing information about you for monitoring purposes relating to your application or future employment. This information will only be used by Airbus Group.



Description of the job :
A vacancy for HO Cyber Security Foundations and Extended Enterprise, (m/f) has arisen within Airbus (Commercial Aircraft) in Toulouse. You will join the Information Management Cyber Security Department

You will benefit working with vibrant and diverse teams of engineers, developing your skills through extensive dedicated training programs, opportunity to travel and you will be empowered to make the difference!

This position will require a security clearance or will require being eligible for clearance by the recognized authorities.

Leadership
a. There are demonstrably passionate and are focused on business value and cyber risk management
b. Influence and impact - They have the ability to identify the key senior stakeholders to engage, how to engage them, and get their buy in.
c. They set standards and live by these for leadership.
d. They can set a common vision, roadmap and lead their teams to this.
e. They are structured and risk driven in their prioritization.
f. They turn strategy into execution.

Key behavioural traits:
a. Joining the dots. A natural propensity to collaboration across Airbus Group.
b. Speed matters. They have a propensity for speed and execution

Problem solving
a. They use the past to help define the future
b. They can take risk based decisions
c. They do not need 100% data to make a decision.
d. They can draw down on their experience where it makes sense/low risk to go fast

People development
a. They are passionate about their people and their development
b. They are aware of their peoples needs and how to development them
c. They embrace diversity and background of thought, and use the collective intelligence to solve problems.

Communication skills
a. Able to communicate complex topics to senior leaders to gain buy in
b. Able bridge business and technical topics to achieve desired outcomes
c. Able to facilitate and drive commercial discussions with multiple parties for an optimum outcome

Task & accountabilities :

Lead the service delivery of all Cyber Products and Services relating to Security Foundations, Extended Enterprise and Global Airbus Commercial international regions. This includes but not limited to:
o Foundational cyber security controls (hosting, end user computing etc) and risks management
o Extended enterprise cyber security controls and risks management
o Airbus Commercial international regions, cyber security controls and risks management
Work closely with Cyber Transformation Program to identify the business risks relating to Security Foundation and Extended Enterprise, develop and execute risk treatment plan by implementing technical capabilities
Drive the technical and non-technical discussion regarding Foundations, Extended Enterprise and Airbus commercial international regions to ensure the appropriate security capabilities, compliance, key reporting and continuous improvement in place.
Steering complex technical and commercial decisions with significant business impact within and beyond our organization
Bridge the cyber security gaps between Airbus IM and Airbus Commercial regions under the One Roof.
Set strategic directions that supports the seamless integration and collaboration between One Roof and Airbus Group (including IM and ZS)
Facilitate governance forums with participants of varying level from senior leadership team to technical IM lead
This role will involve some travel for business in Europe and OneRoof regions and as such you must be able to travel accordingly.
Execute the associated transformation.

Required skills :
You will have the following skills and experience:
Bachelor's or Master's Degree in Computer Science, Computer Engineering, Information Technology, or relevant field
15+ years experience in security, risk, compliance and commercial functions in large enterprise organisations
10+ years leadership roles, directly managing people and teams of over 20+ people across multiple regions
Demonstrated leader / influencer / decision maker profile in high impact business decision
People management skills, proven track record of mentoring and coaching team members
Great communication, mentoring team members, collaborative culture across multiple regions
Negotiation Level of English

This job requires an awareness of any potential compliance risks and a commitment to act with integrity, as the foundation for the Company’s success, reputation and sustainable growth.

By submitting your CV or application you are consenting to Airbus using and storing information about you for monitoring purposes relating to your application or future employment. This information will only be used by Airbus.
Airbus is committed to achieving workforce diversity and creating an inclusive working environment. We welcome all applications irrespective of social and cultural background, age, gender, disability, sexual orientation or religious belief."
62,https://www.indeed.fr/jobs?q=Data%20Engineer&l=Toulouse&radius=100&sort=date&limit=50&start=50&vjk=3fc40619c3aee6ac,"NAVBLUE - Head of Airspace and Airport Solutions (m/f)
Airbus1,455 avis - Toulouse (31)",['Toulouse (31)'],NAVBLUE - Head of Airspace and Airport Solutions (m/f),Airbus,- Toulouse (31),null,null,"il y a 30+ jours
- Continuer pour postuler
Signaler cette offre d'emploi",Data Engineer,Toulouse,"NAVBLUE SAS
Airbus is a global leader in aeronautics, space and related services. In 2018 it generated revenues of € 64 billion and employed a workforce of around 134,000. Airbus offers the most comprehensive range of passenger airliners. Airbus is also a European leader providing tanker, combat, transport and mission aircraft, as well as one of the world's leading space companies. In helicopters, Airbus provides the most efficient civil and military rotorcraft solutions worldwide.

Our people work with passion and determination to make the world a more connected, safer and smarter place. Taking pride in our work, we draw on each other's expertise and experience to achieve excellence. Our diversity and teamwork culture propel us to accomplish the extraordinary - on the ground, in the sky and in space.
Job Description
Company :

NAVBLUE is the new generation of digital, user-friendly Flight Operations and Air Traffic Management solutions. Powered by Airbus' pioneer spirit and infused with Navtech's agility, it combines the best of both worlds. A leading global provider of flight operations solutions serving more than 400 airlines and aviation service companies across all platforms, NAVBLUE has a proven track record in product innovation. With access to Airbus' resources and data, NAVBLUE provides its customers with the best solutions based on the best data, fully supporting them in their digital transformation.
NAVBLUE is a fully owned subsidiary of Services by Airbus and is based in Hersham (UK), Toulouse (France) and Waterloo, ON (Canada), with offices around the world.

Contact :
Please apply on line for this vacancy using your e-Recruiting profile with your CV attached.
By submitting your CV or application, you are consenting to Airbus and/or NAVBLUE using and storing information about you for monitoring purposes relating to your application or future employment. This information will only be used by Airbus and/or NAVBLUE.

Description of the job :
A vacancy for a Head of Airspace & Airport Solutions (m/f) has arisen within NAVBLUE in Toulouse.

NAVBLUE is a wholly owned subsidiary dedicated to the development of value added flight operations services for Airlines, ANSPs, Airports and other OEMs.
The Head of Airspace and Airport Solutions reports to the VP Ground Solutions.
He/She is accountable for:
Global P&L management and operational objectives
Manage 3 Business Lines (Airspace Design Solutions, Airport Solutions, GNSS Solutions)
Ensure business growth in close cooperation with marketing and sales and developing the portfolio of product and services both organically and via partnership with SIO
Represent Navblue at industry leading conferences supporting the position of a worldwide leader in this business
Managing the interfaces with Airbus Engineering (E), Safety (GS), Programs (B) and Customer Services (S)

You will have to manage a team (around 30 people).

Task & accountabilities :
Your main tasks and activities will include:

The jobholder manages the full Profit and Loss responsibility for product and services coordinating with marketing and sales ensuring proper commercial follow-up securing the resources necessary to the execution.

The jobholder leads and develops the Airspace & Airport team:
encompassing business analysts, project managers, designers, experts and engineers
in Navblue offices and deployed at Airbus sites (Biejing, Miami...)

The jobholder manages the development of software products in close cooperation with Airbus CTO and sub-contractors.

The jobholder organizes the lobbying of worldwide aviation institutions, airworthiness authorities in order to position Navblue as a leader in global ATM optimization.

The jobholder ensures the coordination of the key stakeholders either internal (S, C, B, E, G) or external (Avionics Suppliers, Airports, ANSPs ...).

Support Innovation and Business Development to grow the business

Required skills :
As the successful candidate, you should be able to demonstrate the following skills and competencies:
Experience working with the assigned product at any of the following:
# Airframe manufacturer
# Aviation hardware provider
# Aviation software provider
# Government aviation authorities
# Aviation industry association
Experience in the aviation industry is required minimum eight years of relevant experience, including in-depth knowledge of aviation software products and services
In-depth understanding of Air Traffic Management at large
Managerial experience is required and international / multi-cultural would be a plus.
Global B2B marketing experience desired
Ability to influence and communicate at multiple levels both internally and externally
Professional and collaborative approach to interacting with colleagues and customers superior interpersonal and decision-making skills to resolve critical or contentious issues.
Strong team orientation to provide necessary leadership in the multiple interactive environments the position demands
Understanding of the software development process
Experience with enterprise solutions in large customer bases
Willingness to travel Internationally
Results-oriented, innovative, and a strong problem solver
Fluent in English both written and spoken

This job requires an awareness of any potential compliance risks and a commitment to act with integrity, as the foundation for the Company’s success, reputation and sustainable growth.

By submitting your CV or application you are consenting to Airbus using and storing information about you for monitoring purposes relating to your application or future employment. This information will only be used by Airbus.
Airbus is committed to achieving workforce diversity and creating an inclusive working environment. We welcome all applications irrespective of social and cultural background, age, gender, disability, sexual orientation or religious belief."
63,https://www.indeed.fr/jobs?q=Data%20Engineer&l=Toulouse&radius=100&sort=date&limit=50&start=50&vjk=f569b3f97c436a8d,"Functional Validation Activities Engineer (m/f)
Airbus1,455 avis - Toulouse (31)",['Toulouse (31)'],Functional Validation Activities Engineer (m/f),Airbus,- Toulouse (31),null,null,"il y a 30+ jours
- Continuer pour postuler
Signaler cette offre d'emploi",Data Engineer,Toulouse,"Airbus Defence and Space SAS
Airbus is a global leader in aeronautics, space and related services. In 2018 it generated revenues of € 64 billion and employed a workforce of around 134,000. Airbus offers the most comprehensive range of passenger airliners. Airbus is also a European leader providing tanker, combat, transport and mission aircraft, as well as one of the world's leading space companies. In helicopters, Airbus provides the most efficient civil and military rotorcraft solutions worldwide.

Our people work with passion and determination to make the world a more connected, safer and smarter place. Taking pride in our work, we draw on each other's expertise and experience to achieve excellence. Our diversity and teamwork culture propel us to accomplish the extraordinary - on the ground, in the sky and in space.
Job Description
Contact :
Please apply on line for this vacancy on line at our careers site (www.jobs.airbus.com) with your CV and cover letter attached.

By submitting your CV or application you are consenting to Airbus using and storing information about you for monitoring purposes relating to your application or future employment. This information will only be used by Airbus.

Description of the job :
A vacancy for a Functional Validation Activities Engineer has arisen within Airbus Defence and Space in Toulouse. You will join the Functional Avionics Engineering and Lead department.

Functional Avionics engineering and development encompasses several complementary technical disciplines, spread on different departments, to develop, validate and operate the on-board Software of our satellites :
On-board Software engineering and development (Software running on on-board computer),
AOCS engineering and development (Attitude and Orbit Control System),
Operations engineering and development (using Flight Operations Procedures, FOPs),
FDIR engineering and implementation (Failure Detection, Isolation and Recovery),
Database engineering (gathering functional and electrical data in a reference repository),
Simulators engineering and development, supporting Software, Operations and AIT (Assembly Integration and Test) validation,
Functional Validation engineering, through both numerical and Hardware-in-the-loop tests.

Functional Avionics Engineering and Lead department is in charge of driving the Functional Avionics development of all satellites under development in Toulouse, for all Airbus Defence & Space markets (Science, Earth Observation, Telecom). It is also directly in charge of Satellite & System Operations engineering, Functional Validation, Database engineering and FDIR engineering.

As Functional Validation Activities Engineer of a given satellite or satellite family (product approach), you will be in charge of participating in the preparation, implementation and execution of functional tests on simulated and real-time test benches.

This position may require being eligible for clearance by the recognized authorities.

Task & accountabilities :
You will be in charge of the following main activities:

Establishing the necessary and sufficient configuration to perform the functional validation task,
Validating the functional chains through end-to-end open-loop tests,
Validating the nominal and reconfiguration functions of the sub-assembly through closed-loop tests,
Developing and debugging Automated Test Procedures and scripts, in the dedicated language, working within a specified process and using templates and Functional Validation tools against a test specification. This will include liaising with the various project architects and domain specialists,
Executing the Automated Test Procedures on the various test benches together with test data analysis and test report compilation. This will include liaising with specialist areas for result data analyses, technical management and Product Assurance,
Investigating anomalies and producing diagnoses - determining root causes (equipment, environment model, software flight, test bed, data bases, procedures, and test specifications),
Producing test reports.

Required skills :
You will have the following skills and experience:

Engineering degree or equivalent in general engineering,
Knowledge or experience in spatial domain would be a plus,
Autonomous, proactivity, results-oriented,
Team spirit, interface management, Adaptability,
Languages: Advanced levels in both English and French.

This job requires an awareness of any potential compliance risks and a commitment to act with integrity, as the foundation for the Company’s success, reputation and sustainable growth.

By submitting your CV or application you are consenting to Airbus using and storing information about you for monitoring purposes relating to your application or future employment. This information will only be used by Airbus.
Airbus is committed to achieving workforce diversity and creating an inclusive working environment. We welcome all applications irrespective of social and cultural background, age, gender, disability, sexual orientation or religious belief."
