,id,meta1,meta2,titre_poste,entreprise,localisation,contrat,salaire,date_publication,keyword_metier,keyword_localisation,description
28,https://www.indeed.fr/emplois?q=Data%20Engineer&l=Toulouse&radius=100&limit=100&sort=date&vjk=fcb90d8b7339caea,"Stage ingénieur : Développeur logiciel CAO éléctronique (f/m)
NXP Semiconductors239 avis - Toulouse (31)",['Toulouse (31)'],Stage ingénieur : Développeur logiciel CAO éléctronique (f/m),NXP Semiconductors,- Toulouse (31),null,null,"il y a 11 jours
- Continuer pour postuler
Signaler cette offre d'emploi",Data Engineer,Toulouse,"NXP Semiconductors N.V. enables secure connections for a smarter world, advancing solutions that make lives easier, better, and safer. As the world leader in secure connectivity solutions for embedded applications, NXP is driving innovation in the automotive, industrial & IoT, mobile, and communication infrastructure markets. Built on more than 60 years of combined experience and expertise, the company has approximately 30,000 employees in more than 30 countries and posted revenue of $9.41 billion in 2018.
Contexte
Le département « Design Enablement – Analog » basé à Toulouse, en charge de fournir des solutions pour la conception de circuits électroniques analogiques, mixte A/D et RF, recrute un(e) stagiaire de fin d’étude sur une durée de 6 mois afin de d’étudier et de prototyper de nouvelles fonctionnalités.
Vos Missions
Le(a) stagiaire prendra en charge/réalisera l’une des missions suivantes :
Etude/bibliographie autour des méthodes permettant de réaliser des calculs sur les résultats intermédiaires produits au fur et à mesure de l’exécution par un simulateur analogique, puis développement et mise à disposition d’une librairie de fonctions documentées
Connaissances souhaitées : simulation électronique (analogique), langages de modélisation comportementale (Verilog, Verilog-A, …)
Etude/bibliographie autour de la manipulation de données de simulation analogique, filtrage, visualisation de courbes (X/Y, polaire, histogrammes, …) en technologie mixte application web et client lourd, prototypage et documentation.
Connaissances souhaitées : technologies web/JS/NodeJS, Linux
Etude et prototypage de solutions visant à optimiser la parallélisation de groupes complexes de simulations de circuits électroniques reliées et/ou chaînées entre elles, gestion des points de rencontre et interdépendances.
Connaissances souhaitées : scripts (sous Linux), automatisations de tâches, multithreading, communications inter processus.
Les tâches attendues quel que soit le sujet retenu sont :
Etude/bibliographie pour présenter un état de l’art ;
Etude du contexte de la conception de circuits électroniques ;
Etude de faisabilité, prototypage, éventuellement développement plus poussé ;
Rapport d’étude, document de conception ;
Rédaction de documents et commentaires de code rédigés en Anglais.
Votre Profil:
Niveau d’études : Bac + 5, dernière année d’école d’ingénieur en informatique, avec une forte affinité pour la micro-électronique, ou micro-électronique, avec de bonnes notions de développement logiciel.
Connaissances requises :
Bonnes bases de l’utilisation de l’environnement Linux, les outils utilisés tournant sur cette plateforme.
Connaitre l’utilité/utilisation d’un outil de gestion de configuration
Connaitre l’utilité/utilisation d’un outil de gestion des défauts (bug-tracker)
Un bon niveau d’anglais est exigé (participation à des réunions et présentations au sein d’une équipe internationale, lecture et rédaction de documents en Anglais).
Do you have a strong affinity for software engineering and would like to gain practical experience in a multinational environment?
Would you like to contribute to developing in-house EDA tooling?
We have an opportunity for a student in his/her final year to join our Analog Design Enablement department in Toulouse in the role of SW Development Intern.
In this position, you will focus on software work in the areas of tools used in IC design (EDA tooling). The work will be based on existing software and it will introduce multiple aspects of software development: analysis, proposing solution, prototyping, QA actions and documentations.
When you work at NXP Semiconductors you become part of a dynamic company. We have an informal culture, a can-do mentality and every day we learn from each other. This combination contributes to the success of our organization, our teams, and our people.
Intern will cover one of the following topics:
Bibliographical and technical study around methods to compute metrics on intermediate simulation results produced during the execution of electronic circuit simulation software, then development and delivery of a library of results processing functions, with documentation.
Expected knowledge: electronic simulation (analog), behavioral modeling languages (Verilog, Verilog-A, …)
Bibliographical and technical study about analog simulation output data manipulation, filtering, display and plotting (X/Y, polar, histogram, …) applied to both web and desktop applications, prototyping and documentation.
Expected knowledge: web technologies/JS/NodeJS, Linux
Technical study and prototyping of a solution to optimize parallel execution of complex groups of electronic circuit simulations, linked and/or dependent between each other, management of results wait points and interconnects.
Expected knowledge: scripting (under Linux), task automation, multithreading, inter-process communications
Whichever topic is elected, following tasks are expected:
Study/bibliography to present state of the art;
Understanding in electronic circuit design context;
Feasibility study, prototyping, possibly advanced stage development;
Study report, design document;
All documents and code comments to be written in English.
Your profile:
Level of studies: Bac + 5 (graduate), last year of engineer school, computing domain with strong affinity for micro-electronics, or micro-electronics domain with strong bases/understanding of software development.
Expected skills:
Know Linux environment usage, as all development tools are running on this platform;
Know usefulness/usage of versioning/data-management tools;
Know usefulness/usage of bug-tracking tools.
A good level of English is required (attendance to meetings / presentations with international team, reading and writing of documentation)
Please note that in order to be considered for an internship/working student position, you need to be registered as a student during the entire period.
If you are as excited about this opportunity as we are, then we kindly invite you to apply now!"
29,https://www.indeed.fr/emplois?q=Data%20Engineer&l=Toulouse&radius=100&limit=100&sort=date&vjk=8e30e0d205cc6436,"Software Engineer – Toulouse, France
CGTech - Toulouse (31)",['Toulouse (31)'],"Software Engineer – Toulouse, France",CGTech,- Toulouse (31),null,null,"il y a 15 jours
- Continuer pour postuler
Signaler cette offre d'emploi",Data Engineer,Toulouse,"Hours: Full time
Location: Toulouse, France
Join our growing European team of software development experts! CGTech is a stable and consistently profitable business, owned and managed by the original founders since 1988. We are looking for a Software Engineer to join our Composites Product Group. The position is based out of Lorient, France with occasional travel to CGTech headquarters near world famous surfing beaches in Southern California.
Job Description
Software Engineer is responsible for and is involved in the design and development of VERICUT software to meet customer requirements through team and individual efforts.
QUALIFICATIONS
2 years of programming experience (preferred)
Good English
Strong proficiency in Java, C/C++
Experience with GUI and computer graphics
Experience with CAD/CAM, Dassault, Catia, CAA
Understanding of algorithms and data structures
Solid understanding of 3D concepts
Strong math skills and background
Excellent problem-solving, software design, coding, testing, and debugging skills
Bachelor’s of Science degree in Computer Science, Computer Engineering, or related field
In addition to the above, the following qualifications are desirable but not required:
Experience in commercial software development for Windows
Knowledge of CAD/CAM development
Manufacturing experience"
30,https://www.indeed.fr/emplois?q=Data%20Engineer&l=Toulouse&radius=100&limit=100&sort=date&vjk=c9fe471b5189b67f,"Senior Engineer, Embedded Software
Sierra Wireless34 avis - Toulouse (31)",['Toulouse (31)'],"Senior Engineer, Embedded Software",Sierra Wireless,- Toulouse (31),null,null,"il y a 14 jours
- Continuer pour postuler
Signaler cette offre d'emploi",Data Engineer,Toulouse,"Overview

Sierra Wireless (NASDAQ: SWIR) (TSX: SW) is an IoT pioneer, empowering businesses and industries to transform and thrive in the connected economy. Customers Start with Sierra because we offer a device to cloud solution, comprised of embedded and networking solutions seamlessly integrated with our secure cloud and connectivity services. OEMs and enterprises worldwide rely on our expertise in delivering fully integrated solutions to reduce complexity, turn data into intelligence and get their connected products and services to market faster. Sierra Wireless has 1,400 employees globally and operates R&D centers in North America, Europe and Asia. For more information, visit www.sierrawireless.com.

Sierra Wireless is an equal-opportunity employer committed to fostering an inclusive and diverse working environment. We welcome people of every race, color, religion, sex, sexual orientation, gender perception or identity, national origin, age, marital status, protected veteran status, or disability status.
Responsibilities
Our team is building leading cellular routers and gateways that make a difference to first responders by enabling better access to critical data, to help utility companies to operate their equipment more environmentally responsible in renewable energy, and to provide needed connectivity to remote people and equipment. This is a great time to join as we are continuing to expand our product line.

Sierra Wireless is looking for a talented embedded software engineer who can enhance the capabilities of our next generation gateways.

Key responsibilities include:
Enjoy coming to work and be part of a great team that is doing some amazing work that we are all proud of.
Apply your experience, enthusiasm, and creativity to help us solve challenging problems.
Grow and learn with us as you are exposed to our customer's real-world applications and how we together make our products better together.
Develop smartly written quality software in collaboration with the rest of our team and in partnership with product management, testing team, etc.
Help us become even better by participating in conversations focused on improving how we plan, develop, test, release, and support our customers.
Requirements
Degree in Electrical or Computer Engineering, Computer Science or a Technology Diploma with relevant industry experience
5+ years of experience in the following areas:
Developing kernel or user space software for Linux-based platforms
IP networking on Linux platforms including IPv4/IPv6, TCP/IP, Firewall, QoS, DHCP, PPP/SLIP, SSL, and IPsec
Real-time embedded software development using C++ and C
Script programming using Python and Bash
Systematically troubleshooting embedded software for root causes
Knowledge of Linux Wi-Fi support including host, client, and mesh
Experience in cellular radio module programming and wireless communications test equipment would be an asset
Experience with software development life cycles
Must work well individually and in a team environment
Must have excellent written and verbal communications skills
Must have excellent interpersonal skills
Must be well organized, methodical, detail oriented with excellent analytical skills"
31,https://www.indeed.fr/emplois?q=Data%20Engineer&l=Toulouse&radius=100&limit=100&sort=date&vjk=b99af0aa8c7459f6,"CDI client final - Software Engineer - Java Backend
Idée Blanche Recrutement - Labège (31)","['Labège (31)', 'Temps plein, CDI', '45 000 € - 50 000 € par an']",CDI client final - Software Engineer - Java Backend,Idée Blanche Recrutement,- Labège (31),"Temps plein, CDI",45 000 € - 50 000 € par an,"il y a 14 jours
Signaler cette offre d'emploi",Data Engineer,Toulouse,"Bachelors/Masters degree in Computer Science
4 years or more of experience developing large scale multi-users complexJAVA enterprise applications, including validated experience of topics like multi-threading, streaming, clustering, horizontal scalabilty, etc.
Awareness of Algorithmic complexity principles and knowledge of java classical data structures time and space complexity
Appetite and experience with software architecture design and knowledge of modern micro-services design principles
Appetite and experience for algorithmic, complex problems, performance driven development
Experience working with SQL or NoSQL relational databases
Outstanding analytical, problem solving, verbal & written communication skills
Willingness to learn new technology in-depth
Preferred:
Experience with REST APIs development
Knowledge in Constraint Programming, operational research, graph theory or any AI themes
Knowledge of Microsoft Azure offer
Experience with Git and JIRA
Experience or familiarity with HTML5 UI development
Experience with Agile development processes
Experience with test-driven development
Job Types: Full-time, Permanent
Salary: 45,000.00€ to 50,000.00€ /year
Experience:
TDD: 4 years (Preferred)
java: 4 years (Required)
Education:
Master's (Required)
Location:
Labège (31) (Preferred)
Language:
anglais (Preferred)"
32,https://www.indeed.fr/emplois?q=Data%20Engineer&l=Toulouse&radius=100&limit=100&sort=date&vjk=c86e1ce093e2bc94,"Internship on Digital Flight Test Customer Report improvement (m/f)
Airbus1,455 avis - Toulouse (31)","['Toulouse (31)', 'Temps plein, Stage']",Internship on Digital Flight Test Customer Report improvement (m/f),Airbus,- Toulouse (31),"Temps plein, Stage",null,"il y a 14 jours
- Continuer pour postuler
Signaler cette offre d'emploi",Data Engineer,Toulouse,"Airbus Operations SAS
Airbus is a global leader in aeronautics, space and related services. In 2018 it generated revenues of € 64 billion and employed a workforce of around 134,000. Airbus offers the most comprehensive range of passenger airliners. Airbus is also a European leader providing tanker, combat, transport and mission aircraft, as well as one of the world's leading space companies. In helicopters, Airbus provides the most efficient civil and military rotorcraft solutions worldwide.

Our people work with passion and determination to make the world a more connected, safer and smarter place. Taking pride in our work, we draw on each other's expertise and experience to achieve excellence. Our diversity and teamwork culture propel us to accomplish the extraordinary - on the ground, in the sky and in space.
Job Description
What if YOU starts your journey with US!
As part of , you are looking for a mandatory internship or integrated into a gap year that will allow you to validate your studies. The internship duration is 4 to 6 months maximum.
We offer you to work in a world-leading company which is at the heart of a digital transformation, at the cutting edge of research and innovation.
We are looking for Internship on Digital Flight Test Customer Report improvement (m/f) who will be joining us at Airbus site in Toulouse.
This internship is to be filled from Feb, 3rd 2020 to July 31th 2020.
You will be joining the department A/C Test & Operations Support which activities include Software development & support for testing on production, development, and in-service A/C. The technical domain of the internship is around a tool suite dedicated to testing of production A/C.
The objective of the internship is to rework the digital generation of reports to perform new reports (with internal airbus tools: CuPTeR, PATCC) with a dynamic technology, friendly format and independ of Office tools (Word).
Tasks and Responsibilities :
You will be working under the supervision of your manager who will help you identify your professional objectives and support you in the development of your skills.
Your main activities will include:
Facilitate generation and improve content of the Customers reports of production flight tests
Manage new evolutions in the CuPTeR (internal tool to handle digital Flight test customer reports format&content) easily and less costly
via tool improvement: reduce lead time for Flight Test Engineer work during Customer phase
Be independent of Office tools and Gsuite: technical solutions already proposed by partners shall be benchmarked during the internship. Stakeholders for this study are: developers of the Production Aircraft Test System, users of PATS (flight crew on production A/C, flight Test support Engineers).
Required skills:
You are preparing a diploma level Bac+ 5 Master or engineering school, in Software engineering or equivalent, with specialisation in data processing / programming and you obtain following competences:
English: INTERMEDIATE
French: ADVANCED
Your first experience has enabled you to be familiar with industrial needs in term of process improvements through IT developments
You are interested in challenging industrial objectives, with the aim to bring value to a business by applying & developing your skills.
You have a good knowledge of programming / document edition tools
You are able to use proficiently such languages & techno as C/ html / web
Soft skills:
Rigorous, curious and autonomous
Able to integrate into team and be a flexible team player: multi-team interaction is a key factor for this internship
Able to analyze and synthesize information
If your profile catches our attention, you will be invited to perform a video interview during which you will have a few minutes to tell us about your background, motivations and your professional project. Afterwards, your application could be proposed to the managers for further review.
If the prospect of joining our innovative Group motivates you do not hesitate and apply online on our website www.airbus.com/careers!

This job requires an awareness of any potential compliance risks and a commitment to act with integrity, as the foundation for the Company’s success, reputation and sustainable growth.

By submitting your CV or application you are consenting to Airbus using and storing information about you for monitoring purposes relating to your application or future employment. This information will only be used by Airbus.
Airbus is committed to achieving workforce diversity and creating an inclusive working environment. We welcome all applications irrespective of social and cultural background, age, gender, disability, sexual orientation or religious belief."
33,https://www.indeed.fr/emplois?q=Data%20Engineer&l=Toulouse&radius=100&limit=100&sort=date&vjk=300518d04eaa4781,"Data Engineer H/F
CS Communication & Systèmes2 avis - Toulouse (31)","['Toulouse (31)', 'CDI']",Data Engineer H/F,CS Communication & Systèmes,- Toulouse (31),CDI,null,"il y a 27 jours
- Continuer pour postuler
Signaler cette offre d'emploi",Data Engineer,Toulouse,"DESCRIPTION DE L'OFFRE
Nous recherchons un(e) Data Engineer (H/F) sur Toulouse afin d'intégrer nos projets Data Science IKATS (Innovative ToolKit for Analysing Time Series) et R&D.

Vos principales missions seront les suivantes :
Gérer et faire évoluer l’infrastructure actuelle en lien avec le business et les Data Scientists ;
Proposer et réaliser les nouveaux plans d’architecture, les plans de gestion des données et les outils nécessaires à la mise en œuvre des infrastructures physiques et virtuelles pour les nouveaux cas d’utilisation des projets Data Science ;
Spécifier et mettre en œuvre l’outillage, les processus et les exigences de sécurité des données pour le passage à l’échelle et pour différents modes de déploiement des projets dans différents clouds…

PROFIL REQUIS
Ingénieur(e) de formation ou équivalent universitaire, vous bénéficiez d’au moins 5 ans d'expérience dans les Systèmes d'Information et 2 ans dans la gestion et la gouvernance des données, la gestion de systèmes / clusters physiques.
Vous connaissez certains des environnements suivants :
Gestion de systèmes clouds internes ou externes, de VM, de conteneurs, et des déploiements horizontaux,
Calculs Spark ; Stack Hadoop
Docker, Docker compose/Swarm ; Systèmes d’orchestration Kubernetes
Langages : Bash, Python, Java,
Workflows Git; Maven ; PIP, Wheels
Outils et techniques ETL
Déploiements et Intégration Continue sur des plateformes Jenkins, Gitlab CI.

Un bon niveau de communication, de rédaction et de présentation est nécessaire.
Vous serez amené(e) à faire de la rédaction et des présentations en anglais.

CS en quelques mots ?
CS est un concepteur, intégrateur et opérateur de systèmes d’information et de communication critiques.
En proposant des solutions innovantes dans les domaines de la cyber sécurité, des systèmes sûrs industriels et embarqués, de la continuité numérique et de la gestion de crise et de la surveillance de zones, CS a su s’imposer en tant que partenaire privilégié pour les acteurs des secteurs de la Défense et de la Sécurité, du Spatial, de l’Aéronautique et de l’Energie. (www.c-s.fr)

Nous sommes près de 600 collaborateurs sur la région toulousaine.

Nous rejoindre c’est :
Bénéficier d’un management de proximité.
Progresser individuellement et collectivement.
Evoluer dans un environnement flexible (télétravail…), à dimension humaine et convivial (organisation de soirées et d’activités : karting, escalade, ping-pong, yoga, plongée, œnologie…).

Où sommes-nous situés ?
Notre agence se situe à Saint-Martin du Touch - 6 rue Emmanuel Arin - 31300 Toulouse.
Le site Europarc 2 est accessible en transports en commun :
- Ligne de Bus L2 - Arrêt Jean Petit.
Ligne C SNCF TER – Arrêt Saint-Martin.

Si vous préférez, CS rembourse des indemnités kilométriques vélos !

Intéressé ? Déposez votre CV et additionnons nos talents !"
34,https://www.indeed.fr/emplois?q=Data%20Engineer&l=Toulouse&radius=100&limit=100&sort=date&vjk=1f1096b8894b285f,"Data engineer
Dev6group - Toulouse (31)","['Toulouse (31)', 'CDI']",Data engineer,Dev6group,- Toulouse (31),CDI,null,"Alsacreations emploi - il y a 22 jours
- Continuer pour postuler
Signaler cette offre d'emploi",Data Engineer,Toulouse,"Nous recrutons, pour un de nos clients grand compte sur Toulouse, un Data Engineer F/H.

Dans ce cadre vous serez amené à intervenir et à développer vos compétences sur les thématiques suivantes :
Développer les différents éléments logiciels en Python
Intégrer des algorithmes dans le logiciel
Débuguer des algorithmes
En charge de la création du maintien et de la création de data pipelines
Participer au déploiement des mises à jour, ainsi qu'à l'installation du logiciel
Assurer le support du produit auprès de des clients
Veille technologique afin de proposer des améliorations logicielles

Vous rêvez de travailler sur les outils du futur ? Ce poste est fait pour vous.

Rejoignez-nous si vous êtes curieux, dynamique, autonome et force de proposition !

Compétences indispensables : Python, MongoDB, the Hive, Spark, Tensorflow, PySpark, spark-streaming, Elastic, Logstash, the Hive4Py

Connaissances très appréciables : Docker, Agile/Scrum, Keras, Scikitlearn, Kafka, Pandas
Type de contrat
Durée indéterminée (CDI)
Poste à pourvoir à une date précise : ASAP
Lieu : Toulouse Midi-Pyrénées
Compétences souhaitées
python"
35,https://www.indeed.fr/emplois?q=Data%20Engineer&l=Toulouse&radius=100&limit=100&sort=date&vjk=49a7bd71c417f230,"FLIGHT TEST ENGINEER
Tech'Firm Industrie AG - Toulouse (31)
A répondu à 51 %-74 % des candidatures des 30 derniers jours, généralement en 9 jours.","['Toulouse (31)', 'Temps plein, CDI']",FLIGHT TEST ENGINEER,Tech'Firm Industrie AG,- Toulouse (31),"Temps plein, CDI",null,"il y a 21 jours
Signaler cette offre d'emploi",Data Engineer,Toulouse,"Tech'Firm is a Swiss engineering company with more than 20 years of experience and 200 dedicated engineers.
Our motto: Delivering with happiness!
We offer a friendly environment with trustworthy relationships. Our mission is to give meaning to the activities of everyone in the company.
We are looking for a FLIGHT TEST ENGINEER
Job description:
Support engineering with test plan creation
Ensure that test planning requirements have been met
Support and/or lead test preparation activities, test execution, post-test activities
Process, analyze, and draw conclusions from post flight data
Make assessments to ensure safety of flight determination
Document flight test design problems for long term fix
Significative experience in the aeronautical sector
Degree in Engineering, or in a related technical discipline is required
Excellent written and oral communication skills
Organized, reliable, customer-service oriented
Fluent in English
Position based in Switzerland.
For more information, feel free to contact Nita ZECIRI at the following number + 41 76 444 20 07
Job Types: Full-time, Permanent"
