,id,meta1,meta2,titre_poste,entreprise,localisation,contrat,salaire,date_publication,keyword_metier,keyword_localisation,description
0,https://www.indeed.fr/emplois?q=Data%20Engineer&l=Toulouse&radius=100&limit=100&sort=date&vjk=68837e38d2719974,"Internship - Development of the Manual Repair Application (m/f)
Airbus1,455 avis - Toulouse (31)","['Toulouse (31)', 'Temps plein, Stage']",Internship - Development of the Manual Repair Application (m/f),Airbus,- Toulouse (31),"Temps plein, Stage",null,"il y a 17 heures
- Continuer pour postuler
Signaler cette offre d'emploi",Data Engineer,Toulouse,"Airbus Operations SAS
Airbus is a global leader in aeronautics, space and related services. In 2018 it generated revenues of € 64 billion and employed a workforce of around 134,000. Airbus offers the most comprehensive range of passenger airliners. Airbus is also a European leader providing tanker, combat, transport and mission aircraft, as well as one of the world's leading space companies. In helicopters, Airbus provides the most efficient civil and military rotorcraft solutions worldwide.

Our people work with passion and determination to make the world a more connected, safer and smarter place. Taking pride in our work, we draw on each other's expertise and experience to achieve excellence. Our diversity and teamwork culture propel us to accomplish the extraordinary - on the ground, in the sky and in space.
Job Description
What if YOUR adventure started with US!
As part of a school course in initial training, you are looking for a mandatory internship or integration into a gap year, lasting from 4 to 6 months maximum, allowing you to validate your year.
We offer you the opportunity to work in a world-leading company in its field, oriented towards digital technology, at the forefront of research and innovation.
An internship offer in Development of the Manual Repair Application (m/f) has just been opened at Airbus on our Toulouse site.
This internship is to be filled from January 2020 (date subject to some flexibility).
You will join the department in charge of digital transformation, processes and tools supporting the development of the Structural Repair Manual.
The purpose of the internship will be to participate in the development of the Structural Repair Manual for Mechanics application.
Tasks and responsibilities:
You will be under the responsibility of a manager who will help you identify your professional objectives and support you in the development of your skills.
In this context, your main activities will be as follows:
simplify the process of validating and verifying application scenarios that support Mechanics' decisions on the treatment of allowable damage and repairs to the aircraft structure,
establish the specification documentation for this new Technical data product and tool/business guides for the Designer and Technical documentation Engineer community.

Required profile and skills required:

You are preparing a diploma at Bac + 3/4/5 level in Computer Engineering or equivalent, and you have the following skills:
English: ADVANCE
A strong interest in digital applications and aeronautics
Knowledge of the XML and JSON standard
A mastery of tools such as Microsoft Office, G Suite, Visio,...
Know how to be:
Rigorous (se), curious (se) and autonomous
Good interpersonal skills and communication skills
Ability to integrate into a team and flexibility to adapt
Recognized for your organizational skills
Ability to analyze and synthesize
and equipped with team spirit.
Finally, knowledge of project management would be a plus.
Depending on the offers offered, you may have to travel.

If we are interested in your profile, you will be invited to conduct a video interview during which you will have a few minutes to convince us. Then, your application can be proposed to the managers.
If the prospect of joining our innovative Group motivates you?
Do not hesitate! Apply online! www.airbus.com/careers

This job requires an awareness of any potential compliance risks and a commitment to act with integrity, as the foundation for the Company’s success, reputation and sustainable growth.

By submitting your CV or application you are consenting to Airbus using and storing information about you for monitoring purposes relating to your application or future employment. This information will only be used by Airbus.
Airbus is committed to achieving workforce diversity and creating an inclusive working environment. We welcome all applications irrespective of social and cultural background, age, gender, disability, sexual orientation or religious belief."
1,https://www.indeed.fr/emplois?q=Data%20Engineer&l=Toulouse&radius=100&limit=100&sort=date&vjk=deffc6adbf4b4ebf,"Stage Ingénieur: Acquisition de données RADAR automobile
NXP Semiconductors239 avis - Toulouse (31)","['Toulouse (31)', 'Temps plein, Stage']",Stage Ingénieur: Acquisition de données RADAR automobile,NXP Semiconductors,- Toulouse (31),"Temps plein, Stage",null,"il y a 22 heures
- Continuer pour postuler
Signaler cette offre d'emploi",Data Engineer,Toulouse,"NXP Semiconductors N.V. enables secure connections for a smarter world, advancing solutions that make lives easier, better, and safer. As the world leader in secure connectivity solutions for embedded applications, NXP is driving innovation in the automotive, industrial & IoT, mobile, and communication infrastructure markets. Built on more than 60 years of combined experience and expertise, the company has approximately 30,000 employees in more than 30 countries and posted revenue of $9.41 billion in 2018.
Contexte
L’équipe circuit pour radar 77GHz, basée à Toulouse est en charge de définir, concevoir et valider des circuits intégrés pour radar automobile et améliorer les fonctions d’un radar embarqué sur un véhicule pour rendre possible le véhicule autonome.
L’équipe recherche un(e) ingénieur(e) en informatique pour capturer et traiter des données de radars automobile.
Missions
Le (la) stagiaire prendra en charge les missions suivantes:
Continuer à développer du logiciel sur PC (Python, matlab) commencé par un précédent stagiaire, et potentiellement du code embarqué sur un Microcontrolleur NXP dédié au traitement du signal radar (famille S32R) en langage C, dans le but de capturer et traiter des données des capteurs radar.
Utiliser et améliorer le logiciel d’un radar haute performance (langage C) et son logiciel de capture et traitement de données tournant sur une machine Linux basée sur un processeur GPU multi-coeur. Le(la) stagiaire devra reprogrammer le code C d’un micro-controlleur dans le capteur qui tourne sur un FPGA pour le rendre plus versatile, et mettre a jour en même temps le code C de la machine Linux.
Les deux logiciels effectuent du traitement numérique du signal de données radar et doivent à la fin afficher des images radar (Range-Doppler, bird-view, micro-doppler...)
Une fois les logiciels a un niveau suffisant de maturité, le(la) stagiaire devra ajouter une caméra (mono voire stéréo) pour capturer des images vidéo en même temps que les données radar, les stocker de façon synchrone grâce au langage ROS (Robot Operating System) et python ou C++ et écrire un logiciel pour superposer images camera et radar sous ROS.
Profil

Niveau d’études : Bac + 5, dernière année d’école d’ingénieur en informatique ou mastère, avec des connaissances en traitement numérique du signal, programmation en divers langages (matlab, C, C++, Python, ROS…) et intéresse par les capteurs radar, les micro-contrôleurs et l’automobile.Un bon niveau d’anglais écrit et oral est exigé.

_____________________________________________
Context
The NXP 77GHz radar team in Toulouse is in charge of defining, validating and designing integrated circuits for automotive radar to enable on-car radar towards autonomous cars.
The team is looking for a software engineer to capture and process radar data.
Missions
The intern charter will be to take care of the following tasks:
Continue writing software on PC (Python, matlab) that was started by a previous intern, and possibly some code on NXP MCUs specialized in radar signal processing (S32R family) in C language that exists to capture data from the sensors.
Use and improve the software from a high performance Imaging radar (C language) and its capture software running on Linux machine based on multi-core GPU processor. The intern will have to re-program the code of a micro-controller in the sensor that is running on an FPGA to make it more versatile, and update at the same time the C code from the Linux machine.
Both software perform digital signal processing on radar data and must ultimately display radar images (Range-Doppler, bird-view, micro-doppler...)
Once the radar capture softwares are to an adequate level, the intern will have to add a camera to capture images at the same time as radar data, store them in a synchronous way (ROS language) and write software to overlay camera and radar images.
Profile
Educational level : Master thesis, last year in french engineering school in computer science with, knowledge of digital signal processing theory, programming languages (matlab, C, Python, Ros…) and interest in radar sensor, micro-controllers and automotive.
A good level of written and spoken English is required."
2,https://www.indeed.fr/emplois?q=Data%20Engineer&l=Toulouse&radius=100&limit=100&sort=date&vjk=ef643c3ff6ed6297,"ATR- Fleet Support Engineer
Airbus1,455 avis - Toulouse (31)",['Toulouse (31)'],ATR- Fleet Support Engineer,Airbus,- Toulouse (31),null,null,"il y a 1 jour
- Continuer pour postuler
Signaler cette offre d'emploi",Data Engineer,Toulouse,"Avions de Transport Regional (ATR) GIE
Founded in 1981, ATR has become world leader on the market for regional aircraft with 90 seats or less. Since its creation, ATR has sold over 1,500 aircraft to over 200 operators based in more than 100 countries. ATR planes have totaled over 28 million flights. ATR is a joint partnership between two major European aeronautical players: Airbus Group and Leonardo. The ATR headquarters are located in Toulouse. ATR is ISO 14001 certified, the international benchmark for respecting the environment. Contact : If you are interested in this position, please apply online. By submitting your CV or application you are consenting to ATR and Airbus using and storing information about you for monitoring purposes relating to your application or future employment. This information will only be used by ATR and Airbus. ATR is committed to achieving workforce diversity and creating an inclusive working environment. We welcome all applications irrespective of social and cultural background, age, gender, disability, sexual orientation or religious belief.
Job Description
MISSION
Within the Structures Fleet Support Department, ensure, with timely answers, continuous engineering support to customers for structural queries.
ACTIVITIES
As Fleet Support Engineer, he/she is responsible to:
Provide structural repair support on complex matters needing quick resolution, as well as support for minor and major repairs required by customers on a long term support basis
Investigate existance of previous similar damage&repair cases in order to ensure consistent support
Communicate and liaise with customers and internal stakeholders from receipt of support queries to their full resolution
Develop generic repair procedures to efficiently address repetitive matters
Contribute to safe and economical operations of the ATR fleet by providing customers with efficient and timely structural repair and engineering services
Engage in the Design Organization activity, through the preparation and release of approval documents (such as Technical Adaptation, Structural Repair Approval Sheet) under Part21J delegation
Participate in damage assessment missions on-site, to evaluate structural integrity of in-service aircraft subject to potentially severe damage scenarios (engine fire, hard-landing, runway excursion, ground collision, etc…).
Provide on-site technical support during major repairs and/or replacements accomplished either by customers or by ATR Working Parties, as required
Frequent interactions with customers, Structural Data (ESD, stress office), Repair Drawing Team (ESSD), Daily Repairs Team (ESSC) and other ATR departments (customer support, spares engineering, safety, quality, etc)
PROFILE
Master’s degree (Bac +5) in aeronautical structures or mechanical engineering.
5 to 10 years of experience, min 4y in aircraft structure stress analysis or repair
Technical skills:
Aircraft structures (and if possible in ATR structures).
Aircraft structural repairs principles (metallic & composite).
Metallic & composite materials.
Non-destructive testing methods
Knowledge of Leonardo / Airbus drawings is a plus
Language skills (and level):
English (B2)
Any other languages will be a plus
IT skills (tools):
Microsoft Office
ATR IT tools (CRM, SAMONIT, GILDA…) is a plus
Soft skills (2-3 key skills)
Autonomous, rigorous and with good organizational skills.
Open minded, positive thinking, great teamworker
Strong orientation to customers
Specific constraints (eg: night working, regular business trips…):
The position may require eventual participation in 7days/week rotations, i.e., availability for working during weekends & public holidays, plus morning and evening shifts from Monday to Friday
ATR is committed to achieving workforce diversity and creating an inclusive working environment. We welcome all applications irrespective of social and cultural background, age, gender, disability, sexual orientation or religious belief.

This job requires an awareness of any potential compliance risks and a commitment to act with integrity, as the foundation for the Company’s success, reputation and sustainable growth.

By submitting your CV or application you are consenting to Airbus using and storing information about you for monitoring purposes relating to your application or future employment. This information will only be used by Airbus.
Airbus is committed to achieving workforce diversity and creating an inclusive working environment. We welcome all applications irrespective of social and cultural background, age, gender, disability, sexual orientation or religious belief."
3,https://www.indeed.fr/emplois?q=Data%20Engineer&l=Toulouse&radius=100&limit=100&sort=date&vjk=49b3698913096db9,"ATR-Ingénieur support avions en service
Airbus1,455 avis - Toulouse (31)",['Toulouse (31)'],ATR-Ingénieur support avions en service,Airbus,- Toulouse (31),null,null,"il y a 1 jour
- Continuer pour postuler
Signaler cette offre d'emploi",Data Engineer,Toulouse,"Avions de Transport Regional (ATR) GIE
Fondé en 1981, ATR est devenu le leader mondial sur le marché des avions régionaux jusqu'à 90 places. Depuis sa création, ATR a vendu plus de 1 500 avions, exploités par plus de 200 opérateurs dans plus de 100 pays. Les ATR ont cumulé plus de 28 millions de vol. ATR est un partenariat conjoint entre deux acteurs majeurs européens de l'aéronautique : Airbus Group et Leonardo. Le siège social d'ATR se situe à Toulouse. ATR est certifié ISO 14001, la norme de référence internationale dans le domaine du respect de l'environnement. Contact: Si ce poste retient votre attention, nous vous remercions de bien vouloir postuler en ligne. En soumettant votre CV ou votre candidature, vous consentez à ATR et Airbus l'utilisation et l'enregistrement d'informations vous concernant à des fins de suivi relatif à votre candidature ou futur emploi. Ces informations resteront à l'usage exclusif d'ATR et d'Airbus. ATR s'engage pour la Diversité. Nous encourageons toutes les candidatures indépendamment de l'origine sociale et culturelle, de l'âge, du genre, du handicap, de l'orientation sexuelle ou des croyances religieuses.
Description de l'offre
MISSION
Within the Structures Fleet Support Department, ensure, with timely answers, continuous engineering support to customers for structural queries.
ACTIVITIES
As Fleet Support Engineer, he/she is responsible to:
Provide structural repair support on complex matters needing quick resolution, as well as support for minor and major repairs required by customers on a long term support basis
Investigate existance of previous similar damage&repair cases in order to ensure consistent support
Communicate and liaise with customers and internal stakeholders from receipt of support queries to their full resolution
Develop generic repair procedures to efficiently address repetitive matters
Contribute to safe and economical operations of the ATR fleet by providing customers with efficient and timely structural repair and engineering services
Engage in the Design Organization activity, through the preparation and release of approval documents (such as Technical Adaptation, Structural Repair Approval Sheet) under Part21J delegation
Participate in damage assessment missions on-site, to evaluate structural integrity of in-service aircraft subject to potentially severe damage scenarios (engine fire, hard-landing, runway excursion, ground collision, etc…).
Provide on-site technical support during major repairs and/or replacements accomplished either by customers or by ATR Working Parties, as required
Frequent interactions with customers, Structural Data (ESD, stress office), Repair Drawing Team (ESSD), Daily Repairs Team (ESSC) and other ATR departments (customer support, spares engineering, safety, quality, etc)
PROFILE
Master’s degree (Bac +5) in aeronautical structures or mechanical engineering.
5 to 10 years of experience, min 4y in aircraft structure stress analysis or repair
Technical skills:
Aircraft structures (and if possible in ATR structures).
Aircraft structural repairs principles (metallic & composite).
Metallic & composite materials.
Non-destructive testing methods
Knowledge of Leonardo / Airbus drawings is a plus
Language skills (and level):
English (B2)
Any other languages will be a plus
IT skills (tools):
Microsoft Office
ATR IT tools (CRM, SAMONIT, GILDA…) is a plus
Soft skills (2-3 key skills)
Autonomous, rigorous and with good organizational skills.
Open minded, positive thinking, great teamworker
Strong orientation to customers
Specific constraints (eg: night working, regular business trips…):
The position may require eventual participation in 7days/week rotations, i.e., availability for working during weekends & public holidays, plus morning and evening shifts from Monday to Friday
ATR is committed to achieving workforce diversity and creating an inclusive working environment. We welcome all applications irrespective of social and cultural background, age, gender, disability, sexual orientation or religious belief.

Ce poste exige une connaissance des risques potentiels de non-conformité. Le/la titulaire s’engage à agir avec intégrité, fondement du succès, de la réputation et de la croissance durable de la Société.

En soumettant votre CV ou votre candidature, vous autorisez Airbus à utiliser et stocker des informations vous concernant à des fins de suivi de votre candidature ou de futurs emplois. Ces informations ne seront utilisées que par Airbus.
Airbus s’engage pour la Diversité. Nous encourageons toutes les candidatures indépendamment de l’origine sociale et culturelle, de l’âge, du genre, du handicap, de l’orientation sexuelle ou des croyances religieuses."
4,https://www.indeed.fr/emplois?q=Data%20Engineer&l=Toulouse&radius=100&limit=100&sort=date&vjk=98c9a8722a028478,"Architecte infrastructure data F/H
MP DATA - Toulouse (31)","['Toulouse (31)', 'CDI']",Architecte infrastructure data F/H,MP DATA,- Toulouse (31),CDI,null,"Apec.fr - il y a 1 jour
- Continuer pour postuler
Signaler cette offre d'emploi",Data Engineer,Toulouse,"Au titre d'un projet de grande ampleur, vous contribuerez à la mise en place de passerelles entre une plateforme unpremise et une infrastructure cloud, au choix des data base. Votre rôle sera dans un premier temps de participer à la structuration et l'indexation des données. Dans un second temps ,vous serez le référent des métiers sur les questions liées aux données, ainsi qu'au pilotage des projets. Sur cette phase de gestion de projets, vous serez amené à accompagner l'équipe dans les choix et les échanges avec les autres équipes du groupe.
Profil recherché De formation ingénieur, avec une forte expérience, vous avez des connaissances en Python, C++ acquises lors de votre scolarité ou de vos expériences passées. Vous connaissez Spark et Hadoop. Vous êtes familier avec les langages de manipulation des bases de données et les technologies associées (MongoDB, Blob Storage, SQL, NoSQL). Votre autonomie et votre capacité à être force de proposition ont été reconnues durant vos précédentes expériences ainsi que votre esprit de synthèse. Une formation sur certains de ces composants pourra vous être dispensée par nos Lead Data Engineers en amont de la mission dépendamment de vos connaissances.
Entreprise MP DATA est une société de Conseil spécialisée dans la transformation digitale des entreprises. Dans le cadre de son développement, MP DATA recrute un(e) data scientist débutant(e) directement rattaché à la direction technique amené à travailler sur différents projets pour une multinationale engagée dans l'aéronautique."
5,https://www.indeed.fr/emplois?q=Data%20Engineer&l=Toulouse&radius=100&limit=100&sort=date&vjk=c0f6ba7aa2573356,"Stage ingénieur: Développement logiciel machine learning appliqué à la pre-distortion RF 5G
NXP Semiconductors239 avis - Toulouse (31)","['Toulouse (31)', 'Temps plein, Stage']",Stage ingénieur: Développement logiciel machine learning appliqué à la pre-distortion RF 5G,NXP Semiconductors,- Toulouse (31),"Temps plein, Stage",null,"il y a 4 jours
- Continuer pour postuler
Signaler cette offre d'emploi",Data Engineer,Toulouse,"NXP Semiconductors N.V. enables secure connections for a smarter world, advancing solutions that make lives easier, better, and safer. As the world leader in secure connectivity solutions for embedded applications, NXP is driving innovation in the automotive, industrial & IoT, mobile, and communication infrastructure markets. Built on more than 60 years of combined experience and expertise, the company has approximately 30,000 employees in more than 30 countries and posted revenue of $9.41 billion in 2018.
Key words : développement logiciel, IA, machine learning, data scientist, prédistorsion digitale, 5G RF
Contexte
Le département Radio Power Solution, basé à NXP Toulouse, en charge du développent et du test de produits radio fréquence pour la téléphonie 5G recrute un stagiaire de fin d’étude sur une durée de 6 mois afin de participer à mise en place d’un logiciel de banc de test RF utilisant des techniques de machine learning pour linéariser de façon optimale un transistor de puissance RF.

Le(a) stagiaire prendra en charge/réalisera les missions suivantes :
Effectuer un travail de data scientist et réaliser la constitution d’une base de donnée qualifiée de mesures de linéarité RF, obtenues à partir d' algorithmes traditionnels de recherche opérationnelle pour déterminer un modèle de transistor de puissance adéquat pour la pré-distorsion digitale.
L’utilisation puis l’évaluation des limites d’algorithmes de recherche opérationnelle.
Participation à l’utilisation de l’IA (machine learning) pour dépasser ces limites.
Votre Profil
Niveau d’études : Bac + 5, dernière année d’école d’ingénieur en informatique spécialité télécom et ou intelligence artificielle.
Connaissances et ou expérience en programmation Matlab, électronique Radio fréquence, algorithmes de recherche opérationnelles, machine learning, techniques de pré-distorsion digitale.
Un bon niveau d’anglais est exigé.
Engineer Internship : IA software development for 5G RF digital predistortion
Target domain : RF division
Key words : Software development, IA, machine learning, Digital-predistorsion, 5G RF
Context
NXP Radio power solution department , located in Toulouse France, in charge of the development and test of RF products for the 5G telecom market, hire an engineer intern for a 6 months duration, to participate to the design of a RF test software using machine learning technics to linearize RF power amplifiers.
Responsibilities
The intern will contribute to the following missions
As a data scientist the intern should create a qualified database of RF linearity measurements, obtained on RF test bench thanks to legacy operational research type of algorithms used to determine the RF power amplifier model suitable for RF linearization
Research the limits of legacy algorithms
Potentially create upgraded algorithms based on machine learning technics.
Your profile :
Bac + 5, last year internship of french « école d’ingénieur » in computer science with telecom and, or IA specialty.
Knowledge or experience in matlab programming, RF electronic, operational research algorithms, machine learning, digital predistortion is required.
Good English level is mandatory."
