,id,meta1,meta2,titre_poste,entreprise,localisation,contrat,salaire,date_publication,keyword_metier,keyword_localisation,description
12,https://www.indeed.fr/emplois?q=Data%20Engineer&l=Nantes&radius=100&limit=100&sort=date&vjk=5ff8a688fdf066b1,"Back End Engineer Scala (H/F)
iAdvize2 avis - Nantes (44)",['Nantes (44)'],Back End Engineer Scala (H/F),iAdvize,- Nantes (44),null,null,"il y a 11 jours
- Continuer pour postuler
Signaler cette offre d'emploi",Data Engineer,Nantes,"Job Description

En qualité de Back End Engineer (H/F), vous avez pour mission de spécifier, architecturer, implémenter, tester, livrer, monitorer. En bref, vous serez en charge de concevoir et développer le produit.
Notre vision chez iAdvize, c’est que vous soyez le plus autonome possible sur votre poste. Cependant, autonomie ne doit pas signifier isolement, nous apportons une grande importance à la collaboration, la communication et le partage.
Intégré dans des ""swarms"", de petites équipes travaillant en Scrum, chacune dédiée à une thématique du produit, chacun est amené à réfléchir et à contribuer à l’amélioration et l’innovation du produit et de son socle technique.

Qualifications

Compétences attendues :
Maîtrise de Scala et de son écosystème
Maîtrise du développement en architecture micro-services (via Docker)
Un minimum de 4 ans d’expérience professionnelle en développement
Profil recherché :
Pragmatique, vous produisez un code de qualité, simple, scalable, et performant
Critique mais constructif, vous êtes créatif, et aimez les challenges
Bon communiquant, vous aimez collaborer en équipe, et adhérez aux principes Agile
Humble, vous aimez les échanges simples et bienveillants
Passionné par votre métier, vous êtes moteur et force de proposition
Nice to have :
Expérience dans une boite SaaS
Expérience avec des technologies Big Data telles que Elasticsearch, Kafka, ou Spark
Contributions open-source

Additional Information

Date de démarrage : A définir
Salaire : En fonction de votre profil
Localisation : Nantes
Nous sommes bien entendu attachés à la diversité de nos équipes, nous pratiquons une politique de non-discrimination."
13,https://www.indeed.fr/emplois?q=Data%20Engineer&l=Nantes&radius=100&limit=100&sort=date&vjk=f2e8ed2d57e32a51,"Un développeur python spark + Git sur Nantes / Freelance
Almatek - Nantes (44)","['Nantes (44)', 'Temps plein, Freelance / Indépendant']",Un développeur python spark + Git sur Nantes / Freelance,Almatek,- Nantes (44),"Temps plein, Freelance / Indépendant",null,"Freelance-info - il y a 8 jours
- Continuer pour postuler
Signaler cette offre d'emploi",Data Engineer,Nantes,"Je recherche pour l’un de mes clients, grand compte, un développeur python/ spark sur Nantes

Data engineer
Rôle
Mettre en uvre les traitements Big Data d’ingestion de données dans le datalake et d’alimentation de la base de données selon le modèle pré défini.
Créer le modèle de données dans la base de données Elastic.
Assurer la cohérence et la mise en qualité des données ingérées.
Respecter les normes de développement et documenter les travaux réalisés.
Réaliser les user stories demandées par le Product Owner.
Savoir échanger et questionner sur les fonctionnalités à développer lors des cérémonies agiles.
Travailler avec le data scientist.

Compétences
Développement confirmé en langage Python Spark + Git.
Une première expérience sur le cloud Azure : Databricks, Azure data factory.
Expérience sur la Stack Elastic ou une autre base de données orientée moteur de recherche.
Environnement de travail agile : Jira, Confluence.
Idéalement utilisation d’un outil de gouvernance de données.

Compétences techniques
Python Spark + Git. - Confirmé - Impératif
Stack Elastic - Confirmé - Impératif
Jira, Confluence - Confirmé - Impératif
cloud Azure : Databricks, Azure data factory - Confirmé - Important

Démarrage 14/10/209
Durée : 6 mois renouvelables."
14,https://www.indeed.fr/emplois?q=Data%20Engineer&l=Nantes&radius=100&limit=100&sort=date&vjk=583960da44c15b0e,"Un développeur Web React JS sur NANTES / Freelance
Almatek - Nantes (44)","['Nantes (44)', 'Temps plein, Freelance / Indépendant']",Un développeur Web React JS sur NANTES / Freelance,Almatek,- Nantes (44),"Temps plein, Freelance / Indépendant",null,"Freelance-info - il y a 8 jours
- Continuer pour postuler
Signaler cette offre d'emploi",Data Engineer,Nantes,"Je recherche pour l’un de mes clients, grand compte, un développeur web react.js
Démarrage : ASAP
Durée : Longue

Rôle
Développer les IHMs de requêtage de la base de données Elastic.
Respecter les normes de développement et documenter les travaux réalisés.
Réaliser les user stories demandées par le Product Owner.
Savoir échanger et questionner sur les fonctionnalités à développer lors des cérémonies agiles.
Travailler avec le data engineer.

Compétences
Expérience significative en langage de développement : React.js + framework react-search + Git.
Bonne connaissance de la Stack Elastic.
Environnement de travail agile : Jira, Confluence.

Compétences techniques
React.js + framework react-search + Git - Confirmé - Impératif
Jira, Confluence - Confirmé - Impératif
Stack Elastic - Confirmé - Important"
15,https://www.indeed.fr/emplois?q=Data%20Engineer&l=Nantes&radius=100&limit=100&sort=date&vjk=a39eb635d5916d88,"Développeur Big Data - Bank - CDI
montreal - Nantes (44)","['Nantes (44)', 'CDI']",Développeur Big Data - Bank - CDI,montreal,- Nantes (44),CDI,null,"il y a 20 jours
- Continuer pour postuler
Signaler cette offre d'emploi",Data Engineer,Nantes,"Big Data
Cloud AWS
Java Spark
L'entreprise est une banque digitale indépendante basée à Nantes.
Vous interviendrez dans un contexte technologique riche en méthode agile dans un environnement dynamique.

Au sein de la direction informatique, vous aurez un poste de Développeur Big Data/Data Engineer.

Votre rôle:
Développement des jobs Spark
Développement des outils DevOps
Amélioration des outils de testing et de déploiement
Mise en place et exploitation plateforme Big Data

Qui êtes-vous?
Vous maitrisez le développement en Java,Scala ou Spark
Vous êtes en veille technologique
La connaissance Cloud (AWS) est un plus
Vous êtes curieux et avez envie d'apprendre

Avantages:
45 jours de congés
CE
Formation

Cerise sur le gâteau:
Abondement

Montreal Associates is acting as an Employment Agency in relation to this vacancy.
Montreal Associates is acting as an Employment Agency in relation to this vacancy.

JN -072019-50466_156879122306931"
16,https://www.indeed.fr/emplois?q=Data%20Engineer&l=Nantes&radius=100&limit=100&sort=date&vjk=7f76a62284422d2d,"System Security Engineer
FAMOCO - Rennes (35)",['Rennes (35)'],System Security Engineer,FAMOCO,- Rennes (35),null,null,"il y a 19 jours
- Continuer pour postuler
Signaler cette offre d'emploi",Data Engineer,Nantes,"FAMOCO has developed the world’s first Android transactional solution to help companies meet their digital transformation goals. We provide a fully integrated, mobile, business-centric and secure end-to-end solution. We target several markets including cashless payment, service management, transportation and access control markets.
We have designed three components that help us change the world:
Our hardware: a secure and affordable NFC mobile device
Our OS and apps: a secure enterprise-ready Android OS
Our cloud service: an online service to manage devices remotely

In 3 years, we have deployed +250,000 devices in over 35 countries, and we work with international groups like Orange, Vodacom, AliPay, WFP, AccorHotels, Keolis. We have offices in Paris, Brussels, Rennes and Abidjan.
We believe that adventures are a team effort that draw on the unique strengths of each member and we strive to reveal and enhance the potential of our colleagues every day.

As part of Famoco engineering team, the candidate will have the responsibility of the design and implementation of all solutions involving hardware security, for instance around Secure access module and smartcards, for customers like governmental and non-governmental organization (eg: World Food Program)
As a Security Engineer, the candidate will
Identify and define system security prerequisites
Design high quality and cost-effective solutions to meet business requirements
Implement those solutions and be accountable for the deliverables
Provide technical study about data privacy and risks in hardware and software solutions
Provide internal and external documentation about his/her work
Follow best practices and drive innovation in technology
Requirements
Profile
Engineering degree
+3 years experience in similar field
The candidate has expertise in
Multiple programming languages (Mainly Python, Java/kotlin, bash, ...)
Linux, Docker
Advanced Security concepts (asymmetric / symmetric cryptography, signatures, security criteria)
Continuous Integration / Continuous Delivery
Backend system development
Database systems
Knowledge on smartcards is a plus
Joining our team means:
Working in a stimulating and dynamic environment with great challenges every day and a real opportunity to witness the impact of your work on Famoco’s development
Take part in a real human adventure with passionate, talented colleagues
The unique opportunity to work on state-of-the-art technology with multiple applications across countless markets and customers
Benefits
Joining our team means:
Working in a stimulating and dynamic environment with great challenges every day and a real opportunity to witness the impact of your work on Famoco’s development
Take part in a real human adventure with passionate, talented colleagues
The unique opportunity to work on state-of-the-art technology with multiple applications across countless markets and customers
The possibility to reveal your skills, enhance them and fulfill yourself greatly
Be among a multicultural community always in search of new ways to enhance each individual’s potential
Working in a beautiful place in the center of Paris
If you want to join a fun team and learn to work in an international start-up company facing an extremely rapid growth, send us your application!"
17,https://www.indeed.fr/emplois?q=Data%20Engineer&l=Nantes&radius=100&limit=100&sort=date&vjk=dc9acf5b0c9fb167,"NFV Software Engineer / Ingenieur(e) logiciel
EXFO - Rennes (35)",['Rennes (35)'],NFV Software Engineer / Ingenieur(e) logiciel,EXFO,- Rennes (35),null,null,"il y a 19 jours
- Continuer pour postuler
Signaler cette offre d'emploi",Data Engineer,Nantes,"Job title: NFV Software Engineer / Ingenieur(e) logiciel
Division/function: Research & Development (DF0007)
Business unit / department: Monitor Wireless Prot &NFV (BU0064)
Country: France
State: BRETAGNE
City(ies): Rennes
EXFO develops smarter network test, monitoring and analytics solutions for the world’s leading telecommunications service providers, network equipment manufacturers and webscale companies—and we love what we do! With nearly 1,900 employees in more than 25 countries, EXFO is no. 1 worldwide in fiber optic test solutions and has the largest active assurance deployment. Our broad portfolio of intelligent hardware and software solutions enable our customer’s network transformations related to fiber, 5G, virtualization and big data analytics. We’re always looking for top talent to help us lead the way in a thriving industry with boundless opportunities.
We are the telecom network test, monitoring and analytics experts—and we love what we do. With over 2,000 employees in more than 25 countries, we help the world’s leading communications service providers, network equipment manufacturers and webscale companies make sure their networks deliver. With the acquisition of Astellia, EXFO has emerged as a leading provider of network and subscriber intelligence, enabling mobile operators to drive service quality, maximize operational efficiency, reduce churn and develop revenues. Our real-time monitoring and troubleshooting solutions optimize networks end-to-end, from radio to core. We’re always looking for top talent to help us lead the way in a thriving industry with boundless opportunities.
Job summary
Located in Rennes, integrated into the R&D team, you will develop and deliver the NFV infrastructure integration for probing solution. You provide the technical support, and find solution to complex issues by gathering stakeholders such as architects, experts…
If you enjoy developing high performance, high available and highly scalable NFV infrastructure that is a great opportunity.
What you’ll do
You are responsible of the quality of the delivered software components by providing the right level of specifications, tests cover and run of tests
You contribute to specifications and risks analysis
You share expertise and knowhow by publishing documentation and by capitalizing on reuse of software components
You are in charge of developments, tests, documentation.
You provide the expected technical expertise to Support teams in field issues analysis.
In the context of Agile/Scrum methodology, you actively participate to daily meeting, sprint planning, grooming, demonstration, retrospectives…). As a scrum team player, you respect Agile/Scrum rules and good practices such as Continuous Integration.
What we’re looking for
Technical
Software development:
Linux: RHEL or CentOS
Languages : Python, script Ansible, HEAT, YANG, TOSCA
Tools : SVN, Git, JIRA
CI/CD : Jenkins, Robot framework, Nexus
MicroServices, Docker containers
Open Source solutions
Virtualization & Automation:
Modern cloud : OpenStack, vCloud, compute, storage, networking
Orchestration platforms: MANO, ONAP, VNF, kubernetes
Networking
SDN: controllers, OVS, VMware NSX , Juniper contrail, OpenDayLight
Tunneling and Encapsulation: MPLS, VXLAN, GRE, UDP
DPDK, SRIOV, Direct-IO
Continuous Integration, CI/CD, DevOps
Professional experience of agile working methods
Required aptitudes
Excellent communication and interpersonal skills
Self-starter with strong analytical and problem-solving skills
Ability to work in an innovation and team-oriented environment
Eager to learn
Your analytics and synthetic capabilities, your customer-oriented mind, your innovation, your focus on results and your ability to work in a team and communicate skills will be key assets to succeed in this position.
Experience
As a graduated computer science engineer, you have minimum 4 years of expertise in software development with at least 2 years of experience in OpenStack ecosystem.
Must have
Pertinent experience: a minimum of 4 years of experience in software development with at least 2 years of experience in OpenStack ecosystem
Language requirements: Fluent in English.
Education: BS/MS Degree level in Computer Science, or equivalent
Local work permit mandatory
EXFO is an equal opportunity employer.
Thanks for your interest in EXFO.
If you have questions, please write us at careers@EXFO.com
We look forward to hearing from you soon."
18,https://www.indeed.fr/emplois?q=Data%20Engineer&l=Nantes&radius=100&limit=100&sort=date&vjk=c09a89538a4fae87,"DevOps Engineer
EXFO - Rennes (35)",['Rennes (35)'],DevOps Engineer,EXFO,- Rennes (35),null,null,"il y a 30+ jours
- Continuer pour postuler
Signaler cette offre d'emploi",Data Engineer,Nantes,"Job title: DevOps Engineer
Division/function: Research & Development (DF0007)
Business unit / department: Transport Protocol BigData HW Platform&OS (BU0063)
Country: France
State: Bretagne
City(ies): Rennes
EXFO develops smarter network test, monitoring and analytics solutions for the world’s leading telecommunications service providers, network equipment manufacturers and webscale companies—and we love what we do! With nearly 1,900 employees in more than 25 countries, EXFO is no. 1 worldwide in fiber optic test solutions and has the largest active assurance deployment. Our broad portfolio of intelligent hardware and software solutions enable our customer’s network transformations related to fiber, 5G, virtualization and big data analytics. We’re always looking for top talent to help us lead the way in a thriving industry with boundless opportunities.
Résumé du poste:
Au sein d'une équipe agile, vous participerez à mettre en place une approche CI/CD du Framework de traitement de données sur nos plateformes BigData.
Contexte :
Nous sommes basés à Rennes et travaillons en collaboration avec une équipe de Montréal.
L'équipe est pluridisciplinaire et est composée de développeurs Java, d'ingénieurs QA et d'administrateurs système.
Les 2 équipes de Rennes et Montréal constituent un Centre d’excellence technique Big Data. Notre mission est de fournir un Framework aux équipes Produits en charge de livrer nos solutions d’analyse, de surveillance et d’optimisation de réseau à nos clients qui sont de grands opérateurs Telecom.
Le Framework est un composant Backend regroupant des fonctions comme:
la production des données dans Kafka
le traitement des données via Spark
l’insertion dans diverses bases de données (Hive, HBase,…)
la mise à disposition d'API de requêtage pour les composants FrontEnd
la compatibilité avec différentes plateformes
Votre rôle:
Vous participerez aux travaux de Continuous Integration et Continuous Delivery sur nos plateformes BigData et sur les composants de notre Framework, tout en veillant au maintien en conditions opérationnelles de nos clusters.
Les principales activités du poste seront les suivantes :
Participer aux travaux de CI/CD pour nos plateformes BigData et pour nos composants Framework
Participer au maintien en condition opérationnel des clusters de l'équipe
Participer à l'industrialisation de notre plateforme BigData (déploiements, documentations, administration, supervision)
Participer au Support et aux corrections des incidents
Les outils utilisés sont : Jira, Spirateam, GitLab, SVN, Ansible, Robot Framework, Jenkins, VMWare.
Plateformes : HortonWorks, Cloudera et Azure (HDInsight)
Ce que nous recherchons:
Nous recherchons une personne impliquée, et ayant une bonne expérience DevOps sur des environnements systèmes complexes. Une expérience sur des infrastructures Big Data serait appréciée.
Vous devrez également savoir vous intégrer dans une équipe agile pluridisciplinaire, dont les valeurs sont : l’esprit d’équipe, la compétence, l’engagement, la curiosité et la rigueur.
Compétences techniques:
Maitrise des principes et des pratiques de CI/CD
Maitrise de langages de scripts de type Ansible, Shell, Python
Expérience des environnements techniques complexes
Connaissances systèmes et réseaux (Linux)
Des compétences en Administration de cluster BigData seraient un plus
Aptitudes requises:
Autonome et curieux avec un bon esprit d’équipe
Adaptabilité dans un contexte technique complexe et évolutif
Exigences:
Une expérience minimum de 2 ans en DevOps
La connaissance des environnements Big Data est un plus.
L’anglais est nécessaire pour travailler à distance avec une partie de l’équipe de Montréal.
Formation supérieure (Bac +2 à 5)
Toute combinaison études/expériences pertinentes sera considérée.
EXFO is an equal opportunity employer.
Thanks for your interest in EXFO.
If you have questions, please write us at careers@EXFO.com
We look forward to hearing from you soon."
19,https://www.indeed.fr/emplois?q=Data%20Engineer&l=Nantes&radius=100&limit=100&sort=date&vjk=f90fb6b681c29401,"Product Designer - Nantes
Side16 avis - Nantes (44)",['Nantes (44)'],Product Designer - Nantes,Side,- Nantes (44),null,null,"il y a 30+ jours
- Continuer pour postuler
Signaler cette offre d'emploi",Data Engineer,Nantes,"Side is currently working on opening another product offices outside of Paris.
So, this job offer is open in 3 different french cities as well (Nantes, Montpellier and Strasbourg).
Our main goal is to find a talented and ambitious individual to join the team.
We deeply think that working at Side, with the processes and the tools we are using, should be as flexible as possible as long as we are able to reach our objectives and communicate properly.
While applying, please keep in mind that this job could be remote in the end, depending on the city Side will be choosing.
-
Founded in June 2015, Side is the first “on-demand” online platform that offers a brand-new temp work experience. More personalized, more reliable and more scalable. This experience has been made possible by establishing the community spirit of Siders and by developing the obsession of our team to provide an excellent operational and technological service.
At the beginning of the adventure, Pierre, Hugo, Gaspard and David were teaming up as freelancers to help companies on different digital projects. At this point, a question came up: How only a small part of students could get access to those kinds of opportunities when companies struggle to find help? Side was born.
Today, thousands of people (mostly between 18 and 30 years old) enjoy the coaching and expertise from Side, and work in the best companies in retail, logistics, in startups ... before finding even bigger opportunities.
Side offers more than 3000 jobs every month in 7 cities in France (Paris, Lyon, Lille, Marseille, Aix-en-Provence, Bordeaux and Nantes). And more to come!

Make sure you offer the simplest user experience possible, supporting the business and the long-term vision of the product. As a product designer, you will be fully involved in the problem-solving process, you take development complexities into account and you are able to design product solutions quickly as well as work on the long term vision of the product/solution.
In the short term
Discover and understand Side user journeys
Discover the tools we use internally for design and discovery
Understand Side’s challenges and of our users’ pains
Understand what we want to build on the long run product-wise
In the medium term
Collaborate with product and operations to tackle problems.
Master each phase of the Product Design Process.
Sketch and prototype ideas and test them for feedback.
Present and perform user testing with internal and external stakeholders.
Follow developments with engineers.
Ship a first product with your squad, from conception to release.
In the long term
Identify future challenges to be tackled by design.
Support the Product Design team in improving process.
Own and improve the vision of our product design.
Use quantitative and qualitative data to learn, refine and iterate on designs.
Propose solutions on your own.
Requirements
Must have
Experience in designing digital products and systems, not just websites.
You love taking part in the entire product development process, from problem solving through to visual design and prototyping.
You know your way around Sketch, and dabble in Invision, Framer, HTML/CSS/JS, etc.
You're a good communicator.
you pro-actively speak with engineers, PMs and other teams in the company to understand their constraints.
You are highly user-centric, empathic like crazy.
You make the complex simple and for you, details aren't details, they are the product.
Bonus skills
Knowledge of user interviews.
Knowledge of prototyping for user testings.
Knowledge of data tools: Looker, amplitude.
Benefits
Attractive package
High level of responsibility / autonomy
Ambitious journey within a close and unified team
Offsites & team building moments with the team"
