,id,meta1,meta2,titre_poste,entreprise,localisation,contrat,salaire,date_publication,keyword_metier,keyword_localisation,description
29,https://www.indeed.fr/emplois?q=Data%20Engineer&l=Nantes&radius=100&limit=100&sort=date&vjk=92152943d8f116eb,"Software Developer in Automation - Pipeline Designer
Talend18 avis - Nantes (44)",['Nantes (44)'],Software Developer in Automation - Pipeline Designer,Talend,- Nantes (44),null,null,"il y a 30+ jours
- Continuer pour postuler
Signaler cette offre d'emploi",Data Engineer,Nantes,"WHO WE ARE:

Talend is a leader in cloud data integration and data integrity.
We are a global company with offices in Redwood City, Paris, London, Bonn, Beijing, Tokyo, Singapore, Sydney, and Bangalore. Our customers are pioneers/innovative leaders in their market when it comes to data and cloud projects. We are proud to count Domino’s, the world’s largest pizza company, Euronext, the #1 stock exchange in Europe, and HP Inc., a leading IT company, as Talend customers.
We enable companies to transform their business by delivering trusted data at the speed of business. Talend offers a suite of apps for data integration and integrity that brings data, people and technology together by generating end-to-end data pipelines.
Customers can collect data; transform it to power analytics; govern it from end-to-end; and share it across internal and external stakeholders. They can work across systems and across environments: in the cloud and on-premises.

Talend is hiring a QA Engineer for its Pipeline Designer team based in Nantes, France.

Pipeline Designer is the new data integration Cloud application developed at Talend. It brings a rich Web application where users can interactively design, manage and run their data integration pipelines at scale. Pipeline execution is managed by the next generation Talend runtime, leveraging Apache Beam, Apache Spark and Talend components kit providing a full Cloud / on-premise hybrid solution. Pipeline Designer is developed in Scala (play, akka), JavaScript React and Java. It uses Docker, Kubernetes and modern CI / CD technology.
Key responsibilities:
Ensure the end-to-end tests can be run in a continuous integration pipeline, from environments provisioning to the test results report
Design and execution of manual tests
Report and track defects
Required Skills:
BS or MS in Computer Science or equivalent
2 to 5 years of practical experience in the role of QA Engineer or Java Software Developer
Good knowledge on test Tools and frameworks like JBehave, Selenium, CypressJS, RestAssured
In-depth knowledge and practical experience in testing techniques
Good knowledge and understanding of REST based services, Messaging / Streaming
Experience in working within a distributed agile team environment
Passionate about software quality to provide the best experience to our customers
Strong willing to learn new things including the latest technology
Fluent professional English (spoken and written)
Fluent French desirable
Optional, but desirable:_
Experience in load and performance testing methodology and framework (Gatling)
Container and Container Orchestration (Docker / K8S)
Cloud Environments / Deployments (AWS, Azure)
Good understanding of big data technologies (EMR, CDH, Hadoop, Spark, HDFS, Kinesis, Kafka)
#LI-PB1

AND NOW, A LITTLE ABOUT US:

Talend has received some pretty impressive accolades along the way:
""2018 Best Public Cloud Computing Companies To Work For"" by Glassdoor
Named a Leader for Data Integration Tools in the Gartner Magic Quadrant
Named a Leader in Big Data Fabric for the Forrester Wave
Ranked in the DBTA “100 Companies that Matter Most in Data”
Listed in the CRN Big Data 100 Companies

We are passionate about helping companies become more data driven; and, if we can be honest, we are all geeks at heart who pride ourselves on the vibrant company culture that we have built.

As a global employer, at Talend, we believe our success depends on diversity, inclusion and mutual respect among our team members. We seek to recruit, develop and retain the most talented people from a diverse candidate pool. We are committed to making all employment decisions on the basis of business need, merit, capability and equality of opportunity. All qualified applicants will receive consideration for employment without regard to race, color, religion, sex, sexual orientation, gender identity, or national origin."
30,https://www.indeed.fr/emplois?q=Data%20Engineer&l=Nantes&radius=100&limit=100&sort=date&vjk=b7ac6995d78f630e,"Technical Support Engineer
MediaKind - Rennes (35)","['Rennes (35)', 'CDD']",Technical Support Engineer,MediaKind,- Rennes (35),CDD,null,"il y a 30+ jours
- Continuer pour postuler
Signaler cette offre d'emploi",Data Engineer,Nantes,"Permanent position
Rennes, France

Are you an experienced technical support engineer with exposure to resolving issues with MPEG, OTT and DVB systems?
Would you like to be a part of a media revolution and join us as we embark on a journey to create truly innovative and immersive media experiences for consumers across the globe?

If so, we want to hear from you.

Who we are
MediaKind is the new identity for Ericsson’s Media Solutions business.

Backed by Ericsson’s pioneering heritage and strong foundations – all fueled by deep innovation, we have a single goal in mind: to enable our customers to create and deliver immersive media experiences that enrich life.

We provide end-to-end video products for our customers, ranging from market-leading TV platforms, to cloud DVR and pioneering video decoding. Our 1600+ employees are based in 29 locations all over the world such as France, the UK, India, China, Israel, United States and more.

We welcome pioneers and entrepreneurs who want to be heard. Your individual voice will be amplified; after all, we are media kind of people.

The role
To investigate, diagnose and provide technical solutions to Incidents reported by customers or MediaKind support organizations with Digital Broadcast (TV) systems. The position includes investigation of complex technical problems, trouble-shooting of systems that are in operation and, if requested, participation in the remedy of critical systems situations.
The role will be located in Rennes, France and is required to support one of MediaKind’s broadcasting customers and reports directly to the Regional Service Delivery Support Manager.

Key Responsibilities:
Work with assigned Incidents, using support tools and according to global support processes and procedures.
Through contact with external customers and internal support functions gather data and information about any specific problem that has been reported to MediaKind.
Take ownership of the customer communication on assigned Incidents.
Analyse problems and identify suitable solutions to these problems.
Undertake customer visits to resolve significant or complex faults, after other interventions have failed.
Participate in a 24x7 standby roster to support Contract customers.
When required, provide basic product and system training to internal and external customers.
Report on faults and failures, including recommendations on remedial steps and improvements, for feedback to the development and production functions.
About you
To be a MediaKind Support Engineer, you will have a classic Engineering mindset and can think logically to resolve issues and constantly strive to improve your way of working.
You will strive to deliver good results and meeting customers’ expectations, working in close, direct collaboration with the customer.

Educated to a degree level in Electronic/Electrical Engineering, Communications Engineering or a related discipline OR have 3 years technical experience in a related industry.
A flexible approach to the working environment – both internally and customer focused.

In-depth knowledge of MPEG, OTT and DVB systems with a technical knowledge/experience covering but not limited to: Networks and Communications using IP Ethernet and routers, an understanding of Broadcast and IP protocols including use of associated analysis tools, Windows Server, Linux OS and virtual machine environments.

We are MediaKind

Visit www.mediakind.com for more information.

What MediaKind offers
Pension
Healthcare
10 extra holiday days
Restaurant + Meal Card"
31,https://www.indeed.fr/emplois?q=Data%20Engineer&l=Nantes&radius=100&limit=100&sort=date&vjk=7aa6c9650c201cdc,"Analytics System Engineer / DevOps
EXFO - Rennes (35)",['Rennes (35)'],Analytics System Engineer / DevOps,EXFO,- Rennes (35),null,null,"il y a 4 mois
- Continuer pour postuler
Signaler cette offre d'emploi",Data Engineer,Nantes,"Job title: Analytics System Engineer / DevOps
Division/function: Research & Development (DF0007)
Business unit / department: Applications Analytics Market Solutions & SSI (BU0061)
Country: France
State: Rennes
City(ies): Rennes
EXFO propose des solutions intelligentes de test, de monitoring et d’analyse de réseaux aux plus grands fournisseurs de service de télécommunications, fabricants d’équipements de réseau et de services Web, et cette mission nous passionne ! Avec au-delà de 1900 employés dans plus de 25 pays, EXFO est le no.1 mondial des tests de fibre optique et possède le plus imposant déploiement d’assurance de services actifs.
Notre vaste gamme de solutions matérielles et logicielles permet à nos clients de suivre les transformations technologiques en lien avec la fibre optique, la 5G, la virtualisation, l’internet des objets et le Big Data. Si vous aimez partager votre expertise et apporter votre valeur ajoutée dans un contexte de transformation, ce poste est fait pour vous !
Votre rôle
Au sein de l'équipe Analytics, votre rôle consiste à :
Maintenir en condition opérationnel les clusters de l'équipe
Développer le CI/CD pour les composants Analytics sur nos plateformes BigData
Participer à l'industrialisation de notre solution Analytics (déploiements, documentation, administration, supervision)
Participer au support et aux actions correctives
Développer l'automatisation des tests (RobotFramework, Microstrategy)
Ce que nous recherchons
Compétences techniques
Développement DevOps : Ansible, Shell, Python
Connaissance des environnements Linux, Cloud, Virtualisation (RHEL, CentOS, Azure, OpenStack, VMWare)
Connaissances des infrastructures BigData (Apache spark/hadoop, Hortonworks, Cloudera)
Connaissance Hardware et OS configuration
Aptitudes requises
Autonome avec un bon esprit d’équipe, travail en mode Agile
Adaptabilité dans un contexte technique complexe et évolutif
Exigences
Une expérience minimum de 3 ans sur des plateformes Big Data.
L’anglais technique est nécessaire.
Formation supérieure (Bac + 5) ou équivalent
Toute combinaison d’études et d’expérience jugée équivalente sera considérée.
EXFO is an equal opportunity employer.
Thanks for your interest in EXFO.
If you have questions, please write us at careers@EXFO.com
We look forward to hearing from you soon."
32,https://www.indeed.fr/emplois?q=Data%20Engineer&l=Nantes&radius=100&limit=100&sort=date&vjk=82e19fd9b8097e4e,"Software Engineer - F/M
My Script - Nantes (44)","['Nantes (44)', 'CDI']",Software Engineer - F/M,My Script,- Nantes (44),CDI,null,"il y a 4 mois
- Continuer pour postuler
Signaler cette offre d'emploi",Data Engineer,Nantes,"As part of the R&D department ""MyScript Labs"", you will be closely working with the Natural Language Processing team and help leverage their technology by revamping prototypes to create production-ready algorithms and data flows. You will be required to offer an engineering perspective on a wide range of subjects such:
Design and create scalable data processing workflows which must support large amount of multilingual datasets.
Enhance tools for analyzing and visualizing the different metrics to qualify our engine.
Optimize the creation, maintenance and upgrade of the linguistic resources for the languages covered by our recognizer.
Profile
You have at least 3 years of experience in developing scalable processes.
You have strong software programming skills, ideally in C/C++ and Python.
You feel at ease in Linux/Unix.
You are aware of aspects related to large data and continuous integration.
You have a good command of spoken and written English.
Autonomous, rigorous, dynamic and a real team-player.
The following skills will also be appreciated: proficiency in NLP toolkits, machine learning knowledge, web development.
Send your application : job@myscript.com"
33,https://www.indeed.fr/emplois?q=Data%20Engineer&l=Nantes&radius=100&limit=100&sort=date&vjk=eeaffc6b09a93a52,"Software Development Lead - Backend
Talend18 avis - Nantes (44)",['Nantes (44)'],Software Development Lead - Backend,Talend,- Nantes (44),null,null,"il y a 5 mois
- Continuer pour postuler
Signaler cette offre d'emploi",Data Engineer,Nantes,"WHO WE ARE:

Talend is a leader in cloud data integration and data integrity.
We are a global company with offices in Redwood City, Paris, London, Bonn, Beijing, Tokyo, Singapore, Sydney, and Bangalore. Our customers are pioneers/innovative leaders in their market when it comes to data and cloud projects. We are proud to count Domino’s, the world’s largest pizza company, Euronext, the #1 stock exchange in Europe, and HP Inc., a leading IT company, as Talend customers.
We enable companies to transform their business by delivering trusted data at the speed of business. Talend offers a suite of apps for data integration and integrity that brings data, people and technology together by generating end-to-end data pipelines.
Customers can collect data; transform it to power analytics; govern it from end-to-end; and share it across internal and external stakeholders. They can work across systems and across environments: in the cloud and on-premises.

To support our growth, we are recruiting a Software Development Lead - Backend for our Cloud Platform Services team in Bonn.

Talend Platform is a project where we develop micro services eg. Identity & Access Management, Logging, Security, Metrics collection services etc. which can be consumed by all Talend applications and products. This project does not only provide the services but also the user interface related to the services. Additionally we develop runtime environment/server which can execute Talend Data pipelines eg. Data integration, BigData, Data preparation jobs.
Architecture & Development
Develop prototypes quickly to drive platform innovation
Recommend technical strategy and direction in area(s) of expertise
Build services that support large, complex applications.
Conduct complex analysis and provide recommendations on the utilization of emerging and existing technologies
Build new high level designs as required
Mentoring & Leadership
Take initiative and share innovative design patterns and frameworks, balancing implications of these choices on application usability, performance and maintainability
Lead a group of software engineers responsible for delivering scalable and performant platform
Lead by example, care for your team and always be there for them
Coach, guide, inspire and motivate team members
DevOps & Testing
Analyze and improve efficiency, stability and scalability of services
Build 360-Degree monitoring dashboards of your Microservices
Strong Java/Scala skills
Feel comfortable with our current tech stack: NoSQL, RDMS, Spring, Docker, Kubernetes, microservices, various cloud technologies
You like most of our methods: Agile, continuous integration, automation, Iterative delivery
About you:
Graduated in Computer Science or Computer Engineering, or equivalent experience;
Experience in delivering results in rapid release cycles;
Professional Java programming experience with RESTful, Message-/Event-Driven technologies, distributed applications;
For you, it does matter whether an API call takes 1200ms or 200ms
Experience with OAuth and other IAM related technologies would be a plus.
Experience with Kubernetes would be a plus.
An understanding of distributed and cloud computing, incl. deployment related experience (ideally including Docker, AWS);
Experience working in Agile/Iterative/Scrum development experience;
Experience with Test-driven development/Unit Testing and automation;
Ability to communicate effectively and clearly in English, both verbally and in writing;
Self-motivated with strong organizational/prioritization skills and ability to multi-task with close attention to detail.
What we offer you
Join a passionate team and work with the latest technologies (Hadoop, K8s, Terraform, AWS, GCP to name a few)
A challenging but rewarding environment with international scope
Top modern offices with ideal locations
Regular team events and company celebrations, as well as free drinks
#LI-HW1

AND NOW, A LITTLE ABOUT US:

Talend has received some pretty impressive accolades along the way:
""2018 Best Public Cloud Computing Companies To Work For"" by Glassdoor
Named a Leader for Data Integration Tools in the Gartner Magic Quadrant
Named a Leader in Big Data Fabric for the Forrester Wave
Ranked in the DBTA “100 Companies that Matter Most in Data”
Listed in the CRN Big Data 100 Companies

We are passionate about helping companies become more data driven; and, if we can be honest, we are all geeks at heart who pride ourselves on the vibrant company culture that we have built.

As a global employer, at Talend, we believe our success depends on diversity, inclusion and mutual respect among our team members. We seek to recruit, develop and retain the most talented people from a diverse candidate pool. We are committed to making all employment decisions on the basis of business need, merit, capability and equality of opportunity. All qualified applicants will receive consideration for employment without regard to race, color, religion, sex, sexual orientation, gender identity, or national origin."
34,https://www.indeed.fr/emplois?q=Data%20Engineer&l=Nantes&radius=100&limit=100&sort=date&vjk=5f02d25f6e5096fc,"QA Engineer Big Data
EXFO - Rennes (35)",['Rennes (35)'],QA Engineer Big Data,EXFO,- Rennes (35),null,null,"il y a 5 mois
- Continuer pour postuler
Signaler cette offre d'emploi",Data Engineer,Nantes,"Job title: QA Engineer Big Data
Division/function: Research & Development (DF0007)
Business unit / department: Transport Protocol BigData HW Platform&OS (BU0063)
Country: France
State: Bretagne
City(ies): Rennes
EXFO propose des solutions intelligentes de test, de monitoring et d’analyse de réseaux aux plus grands fournisseurs de service de télécommunications, fabricants d’équipements de réseau et de services Web, et cette mission nous passionne! Avec près de 1900 employés dans plus de 25 pays, EXFO est le no.1 mondial des tests de fibre optique et possède le plus imposant déploiement d’assurance de services actifs. Notre vaste gamme de solutions matérielles et logicielles permet à nos clients de suivre les transformations technologiques en lien avec la fibre optique, la 5G, la virtualisation, l’internet des objets et l’analytique des mégadonnées. Toujours à la recherche des meilleurs talents, joignez-vous à nous et participez à l’avancement d’une industrie en pleine expansion.
Résumé du poste:
Au sein d'une équipe agile, vous participerez aux tests du Framework de traitement de données sur nos plateformes BigData.
Contexte :
Nous sommes basés à Rennes et travaillons en collaboration avec une équipe de Montréal.
L'équipe est pluridisciplinaire et est composée de développeurs Java, d'ingénieurs QA et d'administrateurs système.
Les 2 équipes de Rennes et Montréal constituent un Centre d’excellence technique Big Data. Notre mission est de fournir un Framework aux équipes Produits en charge de livrer nos solutions d’analyse, de surveillance et d’optimisation de réseau à nos clients qui sont de grands opérateurs Telecom.
Le Framework est un composant Backend regroupant des fonctions comme:
la production des données dans Kafka
le traitement des données via Spark
l’insertion dans diverses bases de données (Hive, HBase,…)
la mise à disposition d'API de requêtage pour les composants FrontEnd
la compatibilité avec différentes plateformes
Votre rôle
Vous participerez à l'analyse des fonctionnalités au côté des développeurs et participerez à la rédaction d'une stratégie de tests et à son exécution en vous impliquant sur la qualité du livrable et sur les performances du système.
Les principales activités du poste seront les suivantes :
Analyse des features rédigées par le Technical Product Owner et définition des users stories en équipe
Définition de la stratégie de tests et rédaction des tests
Rédaction/Exécution de Tests manuels et/ou automatiques
Participation à la Validation de la qualité des packages et de la documentation
Suivi des anomalies et vérifications de corrections
Participation au maintien opérationnel des bancs de tests
Participation aux mesures de performances et analyse système.
Les outils utilisés sont : Jira, Spirateam, GitLab, SVN, JUnit, Robot Framework, Jenkins, VMWare.
Plateformes : HortonWorks, Cloudera et Azure (HDInsight)
Ce que nous recherchons:
Nous recherchons une personne impliquée, et ayant une bonne expérience de validation dans des environnements systèmes complexes. Une expérience sur des infrastructures Big Data serait appréciée.
Vous devrez également savoir vous intégrer dans une équipe agile pluridisciplinaire, dont les valeurs sont : l’esprit d’équipe, la compétence, l’engagement, la curiosité et la rigueur.
Compétences techniques:
Maitrise des principes et des pratiques de Tests (catégories de tests, intégration continue, …)
Expérience des environnements techniques complexes
Connaissances systèmes et réseaux (Linux)
Connaissances dans les indicateurs de suivi de performance (core, ram, iops)
Maitrise de langages de scripts de type Shell, Python
Des compétences en Administration de cluster BigData seraient un plus
Aptitudes requises:
Autonome et curieux avec un bon esprit d’équipe
Adaptabilité dans un contexte technique complexe et évolutif
Exigences:
Une expérience minimum de 5 ans de tests et validation de systèmes complexes
La connaissance des environnements Big Data est un plus.
L’anglais est nécessaire pour travailler à distance avec une partie de l’équipe de Montréal.
Formation supérieure (Bac +2 à 5)
Toute combinaison études/expériences pertinentes sera considérée.
EXFO adhère aux principes d’équité en matière d’emploi.
Merci de votre intérêt.
Pour toute question, n’hésitez pas à nous écrire à carrieres@EXFO.com .
Nous sommes impatients d’avoir de vos nouvelles!"
