,id,meta1,meta2,titre_poste,entreprise,localisation,contrat,salaire,date_publication,keyword_metier,keyword_localisation,description
25,https://www.indeed.fr/emplois?q=Data%20Engineer&l=Nantes&radius=100&limit=100&sort=date&vjk=c4f2543e8655ffbb,"CDI Responsable Achat- Logistique industrielle H/F
GE Renewable Energy56 avis - Montoir-de-Bretagne (44)",['Montoir-de-Bretagne (44)'],CDI Responsable Achat- Logistique industrielle H/F,GE Renewable Energy,- Montoir-de-Bretagne (44),null,null,"General Electric - il y a 30+ jours
- Continuer pour postuler
Signaler cette offre d'emploi",Data Engineer,Nantes,"Role Summary:
Responsible for managing and executing the process related to International shipments coming into Offshore factories & projects site and Warehousing sourcing strategy. Gérer et exécuter le processus relatif aux expéditions internationales arrivant sur le site des usines et projets offshore et la stratégie d’achat des services d’entreposage
Essential Responsibilities:
Ensure adherence to all international export laws and regulations as it relates to the importation and exportation of goods and technology.
Work out Productivity Opportunities while driving cycle time down for shipments coming into EU or other future offshore factories/projects. Work with the GE selected Carriers and Warehouses to drive cost down and best cost-effective usage of GE International Transportation Agreements through defined process implementation.
Drive the process rigor & support for the execution of daily import / export operations in the regions, including trouble-shooting and root cause analysis for any issues impacting the efficient movement of goods across international borders.
Create/Optimize process for the best execution on International Transportation into Europe.
Manage vendor relationship with Warehouses responsible for storage, staging and distribution of materials required for assembly/manufacturing.
Lead operating mechanisms with Carrier and Transportation Team that drive full compliance with Fulfillment requirements.
Support Customs operational processes (classification, import/export; special programs etc.) compliantly and in an efficient fashion.
Overcome road blocks to ensure delivery is made in line with internal and external customer requirements, ensure quality and timeliness.
Lead Variable Cost Productivity initiatives / targets; specifically, for International Inbound to Europe.
Analyze metrics on Int’l Transportation spend and drive actions for reduction and control.
Working cross-functionally with Logistics COE, sourcing, operations, supply chain, finance, freight forwarders and brokerage teams to identify improvement and productivity opportunities and implement successful changes.
Resolve issues that can cause shipments that come into the US to be on hold (i.e. FDA holds).
Analyze data from multiple sources to verify FDA information.
Work with teams to resolve trade compliance and regulatory issues that come up with shipments into the region.
Support the transportation claim process; ensure claims are getting resolved timely.
Select and manage the customs process implementation with Customs Brokers and Ensure the accuracy and integrity of data.
Audit shipping documents for compliance with regulations, GE Enterprise Standards and Policies and contractual documents. Perform document retention to support compliance with government agencies and international trade regulations.
Assess shipment and clearance issues and propose correction and improvement measures when applicable. Resolve transactional issues relating to the clearance of shipped goods by working daily with brokers and other related logistics providers.
Work closely with global product classification team as it relates to the request & receipt Harmonized System codes, Harmonized Tariff Schedule codes, Schedule B codes, ECCN or other codes and schedules applicable.
Provide general guidance, assistance and advice to the businesses in support of their customs operational processes.
Act as primary point of contact for internal stakeholders, customers and vendor queries.
Communicate and escalate any process or compliance concerns in a timely manner. Escalate issues as required by Customs Enterprise Standards and implement processes.
Support programs and projects that take advantage of Free Trade Agreements (including management of certificates of origin) and other duty-savings opportunities.
Participate on applicable GE Customs Council Communities.
Perform analysis, as needed, for global and regional trade analytics and reporting (INTRASTAT and others that may be applicable.

Qualifications/Requirements:
Gérer et exécuter le processus relatif aux expéditions internationales arrivant sur le site des usines et projets offshore et la stratégie d’achat des services d’entreposage
Promouvoir et soutenir la rigueur des processus dans le cadre des activités d’importation/exportation quotidiennes au sein des régions, dont notamment le dépannage et l’analyse des causes premières de tous les problèmes rencontrés entravant la circulation efficace des marchandises à l’étranger
Créer/optimiser les processus pour une meilleure exécution du transport international en Europe
Gérer les relations avec les fournisseurs et les entrepôts chargés du stockage, de l’affectation physique et de la distribution du matériel nécessaire à l’assemblage/la fabrication
Superviser les mécanismes opérationnels avec le transporteur et l’équipe chargée du transport afin de veiller à ce que les exigences en matière d’exécution soient complètement respectées
Soutenir de manière conforme et efficace les processus opérationnels douaniers (classification, importation/exportation, programmes spéciaux, etc.)
Gérer les formalités douanières en ce qui concerne l’entrée directe de matériel offshore : Intrastat, DEB, documents CE, processus de transitaires internationaux

Bachelor’s degree in Logistics, Supply Chain or Engineering or equivalent experience.
Significant experience working in logistics, trade compliance, engineering, or supply chain management.
Understands trade and compliance regulations in relation to moving freight into the region.
Proven business/financial acumen, including demonstrated ability to motivate, influence, solve complex problems, and drive change at all levels of the organization..
Proven ability to meet deadline in a fast pace changing environment.
Must be computer literate (Word, Excel, and Power Point) and experienced in ERP systems.
Excellent communications skills.

BAC+3 en logistique, en chaîne d’approvisionnement ou en ingénierie, ou expérience équivalente
Expérience significative en logistique, conformité de commerce, ingénierie ou gestion de la chaîne d'approvisionnement
Compréhension des réglementations commerciales et de conformité concernant l’acheminement de marchandises dans la région
Réel sens des affaires et de la finance ; capable de motiver et d'influencer les autres, de résoudre des problèmes complexes et de mener à bien le changement à tous les niveaux de l'organisation
Capacité reconnue à respecter les délais dans un environnement en constante et rapide évolution
Maîtrise des outils informatiques (Word, Excel et Power Point) et expérience des systèmes ERP
Excellentes compétences de communication

Desired Characteristics:
MBA or MS in Logistics, Engineering or Supply Chain.
Demonstrated logistics leadership of multiple facilities in a similar industry.
Proven ability to work on cross-functional, multi-cultural teams.
Excellent project management, communication and analytical skills.
Ability to energize, develop and influence at all levels within an organization.

MBA ou BAC+4 en logistique, ingénierie ou dans le domaine de la chaîne d'approvisionnement
Capacité avérée à superviser la logistique de nombreux sites au sein d’un secteur similaire
Capacité avérée à travailler au sein d'équipes interfonctionnelles et multiculturelles
Excellentes capacités de gestion de projets, de communication et d’analyse
Capacité à dynamiser ses collaborateurs, à développer leurs compétences et à les influencer à tous les niveaux d'une organisation

About Us:
GE Renewable Energy harnesses the earth’s most abundant resources – the strength of the wind, the heat of the sun and the force of water – to power the world’s biggest economies and the most remote communities.
With an innovative spirit and an entrepreneurial mindset, we engineer energy products and digital services that create industry-leading value for our customers around the world.
We see the promise of renewable energy everywhere we look. Our team has the courage, scale, passion, diversity and resourcefulness needed to deliver that promise wherever and however the world needs it
.
Together with our customers, we’re proving that no one ever has to choose between affordable, reliable, or sustainable energy.
We are unleashing limitless energy.
Follow us at www.ge.com/renewableenergy or on twitter @GErenewables.
GE is an Equal Opportunity Employer. Employment decisions are made without regard to race, color, religion, national or ethnic origin, sex, sexual orientation, gender identity or expression, age, disability, and according with all local laws protecting different status.
Follow us on Twitter, join our LinkedIn Group or become a fan of our Facebook page. Receive job and event notifications by becoming a member of the GE Talent Community. Stay up to date on what’s happening at GE around the globe by checking out the GE Careers Blog.
GE est le groupe industriel numérique mondial, qui transforme l’industrie grâce à des machines contrôlées par logiciel et des solutions connectées, adaptées et prédictives. GE s’organise autour d’un échange mondial de connaissance, le « GE Store » (offre de produits GE), au sein duquel chaque activité partage et a accès aux mêmes technologies, marchés, structures et intelligences. Chaque invention nourrit les innovations et les applications dans tous nos secteurs industriels. Fort de ses collaborateurs, ses services, sa technologie et sa taille, GE produit de meilleurs résultats pour ses clients en parlant le langage de l’industrie. www.ge.com
Les candidatures des personnes dont l’embauche est subordonnée à une autorisation pour travailler en France sont les bienvenues et seront prises en compte au même titre que les autres candidatures. Dans ce cadre et conformément à la règlementation pour certaines catégories d’emploi, les candidats étrangers des pays tiers ne peuvent pas être retenus si un ressortissant de l'Union européenne ou d'un autre Etat partie à l'EEE et de la Confédération suisse postule et dispose d’un profil correspondant au poste à pourvoir. Pour plus d’information concernant la règlementation relative à l’immigration professionnelle et les conditions pour obtenir la délivrance par les autorités françaises de l’autorisation de travail, nous vous invitons à consulter le site : http://www.immigration-professionnelle.gouv.fr/

Additional Locations:
France;Montoir-de-Bretagne, Nantes;"
26,https://www.indeed.fr/emplois?q=Data%20Engineer&l=Nantes&radius=100&limit=100&sort=date&vjk=322c5a3bf6d7b9b7,"Data Engineer Scala H/F
Solocal Group51 avis - Rennes (35)","['Rennes (35)', 'Temps plein, CDI']",Data Engineer Scala H/F,Solocal Group,- Rennes (35),"Temps plein, CDI",null,"il y a 30+ jours
- Continuer pour postuler
Signaler cette offre d'emploi",Data Engineer,Nantes,"Au sein d'un équipe BI de la direction technique du groupe, la mission s'inscrit dans le cadre de projets de collecte d'audience sur les différents media Solocal (sites web et applications mobiles) du formatage et du stockage de ces données dans le data lake du groupe.

Le projet dispose :
d'une partie back office d'ingestion de flux de données, contrôles, intégration, consolidation des flux, agréations de données, indexations
d'une partie front de supervision et d'alerting

Objectifs de la mission et tâches
La mission consiste en :
développement des US de la backlog
migration des flux sur cloud Google (GCP)
support technique sur la qualité des développements
amélioration de la supervision des flux
développement du contrôle qualité des données
développement d'alertes sur la qualité des flux de données
Profil
De formation bac+5 en école d'ingénieur ou équivalent, vous justifiez d'une expérience d'au moins 2 ans au sein d'une équipe de développement avec une expérience réussie, idéalement sur des projets de Data.
Formé aux méthodes agiles (rituels, outils – Trello, Jira…), vous possédez un bon relationnel, une bonne écoute et vous saurez démontrer une réelle curiosité et ’une appétence pour les technologies. Sachant travailler en équipe, vous savez également faire preuve d’une véritable autonomie dans les missions qui vous sont confiées.
Compétences attendues
Développement : Scala/Spark – ElasticSearch – GraphQL
- CI/CD : Git – Jenkins - Azkaban - Docker
Agile : Scrum/Kanban
Cloud : GCP (pub/sub, BigQuery, DataFlow, DataProc, BigTable)"
27,https://www.indeed.fr/emplois?q=Data%20Engineer&l=Nantes&radius=100&limit=100&sort=date&vjk=dc9f1772b9939518,"In-depth analysis of transport mechanisms in microelectronic components under laser irradiation
Institut d'Electronique et de Télécommunications de Rennes - Rennes (35)",['Rennes (35)'],In-depth analysis of transport mechanisms in microelectronic components under laser irradiation,Institut d'Electronique et de Télécommunications de Rennes,- Rennes (35),null,null,"L'Intelli'agence - il y a 30+ jours
- Continuer pour postuler
Signaler cette offre d'emploi",Data Engineer,Nantes,"The institut d’électronique et de télécommunications de Rennes is a public umbrella organization bringing together researchers in the electronics and telecommunications sectors from :
CNRS (INSIS),
Université de Rennes1,
INSA de Rennes
Supélec campus de Rennes.
Université de Nantes
The institute has some 250 lecturer-researchers, engineers, Ph.D students and admin. staff.
It is located in the Rennes Atalante Science & Technology Park of which it is a partner and associate involved in the organisation of the working breakfasts known as “Les Matinales”.
The IETR has a large number of technical platforms used to carry out life-sized experiments and it undertakes a large amount of scientific research both nationally and internationally. It also undertakes a significant number of contractual work for and with industrial companies.
Through its involvement in research topics that are central to the information and communication society.
Site web :
https://www.ietr.fr/
Poste et missions

Context
Cybersecurity is a research topic that has been strongly developed in recent years with the rapid evolution of connected distributed systems, where data protection has become essential. The hardware part of digital security is one of the prop of secure systems (such as the smart card), and is at the heart of their vulnerability. Cybersecurity is a strong political will at national and regional levels and has been identified as a strategic axis for the Brittany Region, both in terms of Research, Training and Innovation.
In the context of the CPER (Contrat Plan Etat Région 2015-2020) CYBER SSI (Sécurité de Systèmes d’Information), the Institut d’Electronique et Télécommunications de Rennes (IETR - UMR CNRS 6164) is implementing a platform for ""Simulation, detection and vulnerability in secure hardware systems by laser injection faults "" (CYBER-ELEC OPT platform).

Mobilité géographique :
Nationale
Profil
Applicant profile
The applicant should have PhD degree in Engineering Electronics or Applied Physics with experience in some following topics: physics and technologies of semiconductors devices, optoelectronics, semiconductor and laser interactions, laser fault injection on secure electronic systems, microelectronic technologies, and architectures of integrated electronic circuits, (memories, microprocessors ...).
Experience in foreign research lab would be appreciated.

Objectifs
The objective of this new platform is to develop new research activities at IETR, and more widely in the western region of France, based on the measurement/metrology aspects of secure components and systems, at the interface between semiconductors, technology and microelectronics circuits. In particular, the IETR will focus on hardware security issues from the point of view of the semiconductor to the electronic component (approach original), and then towards the circuit and/or integrated systems."
28,https://www.indeed.fr/emplois?q=Data%20Engineer&l=Nantes&radius=100&limit=100&sort=date&vjk=2b818b861c3204c7,"Post-doctorat « Multivariate Sensors Integration for Wind turbines »
IFSTTAR13 avis - Nantes (44)",['Nantes (44)'],Post-doctorat « Multivariate Sensors Integration for Wind turbines »,IFSTTAR,- Nantes (44),null,null,"il y a 30+ jours
- Continuer pour postuler
Signaler cette offre d'emploi",Data Engineer,Nantes,"Title
Multivariate Sensors Integration for Wind turbines
Information
Duration : 12 months
Framework : MUSIWIND Projet funded by WISE program (Pays de la Loire Region)
Starting date : 2nd half of 2019
Location : IFSTTAR Nantes
Contacts
Applications are welcomed until the end of August 2019. The interested candidates should contact rapidly either Dr. X. Chapeleau or V. Le Cam or Dr. Laurent Mevel with a full CV and a reference letter.
Xavier Chapeleau xavier.chapeleau(at)ifsttar.fr
Vincent Le Cam vincent.lecam(at)ifsttar.fr
Laurent Mevel laurent.mevel(at)inria.fr
Context
To achieve a competitive price per kilowatt hour, the maximization of the energy production and the reduction of maintenance costs are two key issues for the operators of wind turbines. Structural Health Monitoring (SHM) is known as a promising solution to detect early damage and therefore to able to reduce maintenance costs [1]. By having damage indicators obtained by continuous monitoring throughout the lifetime of a wind turbine, operators could indeed anticipate and space maintenance operations. Today one of the challenges, especially for offshore wind turbine where the economic stakes are high, is to develop a reliable and cost-efficient SHM monitoring system that can make an efficient structural check of the wind turbine, in particularly of the foundation and the transition zone between the mast and the foundation, which are critical areas that are very difficult to inspect.
Objectives
In the context described above, the project MusiWind aims at the development of a new system for monitoring the structural integrity of wind turbines and its qualification in real conditions (on-shore site test). The hardware and software developments will integrate a new low-noise accelerometer (developed by SERCEL) with a generic wireless platform PEGASE3 [2] (developed by IFSTTAR) on which innovative data analysis [3, 4, 5, 6].developed by the Ifsttar / Inria I4S joint research team should be embedded. These algorithms are based on statistical inference approach to extract structural information under ambient excitation. The originality of the project will be to implement and to develop identification methods as well as multi-varied damage indicators that merge data from sensors of different types and qualities, as well as the fusion of complementary physical characteristics.

In the framework of MUSIWIND project, the team i4S of IFSTTAR (http://www.sii.ifsttar.fr) and Inria (http://team.inria.fr/i4s/) is seeking for a talented postdoctoral research fellow. The hosting laboratory possesses strong expertise on the development of structural health monitoring system (from the sensors to the data processing). The candidate will both implement the new system proposed and investigate the relevance and the efficiency of a multi-varied approach.
The Postdoc student will be in charge of
Electronic (hardware and software) integration and test of the new system monitoring in close collaboration of the electronic engineers of Ifsttar-Sii and Sercel teams.
Implementation of SII (Stochastic Subspace Identification) algorithm for modal analysis.
Post-processing of data already collected by a previous monitoring system and comparison with those obtained by the new system for modal analysis under ambient excitation.
Development of a monitoring algorithm based on the fusion of multi-varied data.
Study of the relevance and the efficiency in real conditions of the multi-varied approach.
Candidates profile
Doctor in embedded system electronics, informatics or similar.
Strong background in embedded-system and data processing.
Skills in instrumentation, applied mathematics, numerical computation (C, Python) are preferred.
Applicants must be self-driven, higly motivated and able to work autonomously towards the objectives of the project.
Excellent interpersonal and communication skills.
Bibliography
[1] MathewL.Wymorea, JeremyE.VanDam, HalilCeylan, DajiQiao, A survey of health monitoring systems for wind turbines. Renewable and Sustainable Energy Reviews, 2015, 52, pp. 976–990.
[2] Vincent Le Cam, Michael Döhler, Mathieu Le Pen, Ivan Guéguen, Laurent Mevel. Embedded subspace-based modal analysis and uncertainty quantification on wireless sensor platform PEGASE. EWSHM – 8th European Workshop on Structural Health Monitoring, Jul 2016, Bilbao, Spain.
[3] Michael Döhler, Falk Hille, Laurent Mevel. Vibration-based monitoring of civil structures with subspace-based damage detection. Erika Ottaviano, Assunta Pelliccio, Vincenzo Gattulli. Mechatronics for Cultural Heritage and Civil Engineering, 92, Springer, pp.307-326 2018, Intelligent Systems, Control and Automation: Science and Engineering.
[4] Guillaume Gautier, Laurent Mevel, Jean-Mathieu Mencik, Roger Serra, Michael Döhler. Variance analysis for model updating with a finite element based subspace fitting approach. Mechanical Systems and Signal Processing, Elsevier, 2017, 91, pp.142 – 156.
[5] Philippe Mellinger, Michael Döhler, Laurent Mevel. Variance estimation of modal parameters from output-only and input/output subspace-based system identification. Journal of Sound and Vibration, Elsevier, 2016, 379, pp.1-27.
[6] Michael Döhler, Palle Andersen, Laurent Mevel. Variance computation of modal parameter estimates from UPC subspace identification. IOMAC – 7th International Operational Modal Analysis Conference, May 2017, Ingolstadt, Germany. (Best innovative paper)"
