,id,meta1,meta2,titre_poste,entreprise,localisation,contrat,salaire,date_publication,keyword_metier,keyword_localisation,description
128,https://www.indeed.fr/jobs?q=D%C3%A9veloppeur%20C%23&l=Nantes&radius=100&sort=date&limit=50&start=100&vjk=ffcbb38efd4102be,"Ingénieur études et développement .NET Azure F/H
Key Consulting - Nantes (44)","['Nantes (44)', '42 000 € par an']",Ingénieur études et développement .NET Azure F/H,Key Consulting,- Nantes (44),42 000 € par an,42 000 € par an,"LesJeudis.com - il y a 4 mois
- Continuer pour postuler
Signaler cette offre d'emploi",Développeur C#,Nantes,"Wanted!Nous recherchons un(e) Ingénieur développeur C# .NET pour rejoindre notre agence de Nantes et prendre en main des projets de développement web pour un client dans le secteur industriel.L'équipe travaille sur une stack C# , ASP.NET, SQL Server, Razor engine markup, Multi region replication, cloud Azure. Côté front-end, nous prévoyons la migration vers VueJS dans les mois qui viennent.Une partie de l'équipe de développement étant basée dans nos agences à l'étranger (Hanoï, Barcelone), la maîtrise de l'anglais est indispensable.méthodologie : agile, intégration et déploiement en continulieu : Nantes (nos locaux sont situés Mail Pablo Picasso)

Ce poste est fait pour vous si...• vous êtes capable de travailler sur plusieurs projets en parallèle et de rapidement appréhender un fonctionnel et une architecture technique complexe• vous êtes curieux(se) et aimez le challenge technique• vous êtes capable de travailler en équipe, c'est à dire demander de l'aide quand vous en avez besoin et aider vos collègues quand c'est à leur tour d'en avoir besoin !"
129,https://www.indeed.fr/jobs?q=D%C3%A9veloppeur%20C%23&l=Nantes&radius=100&sort=date&limit=50&start=100&vjk=4bfc15c405d3fa77,"ANALYSTE DEVELOPPEUR WEB (H/F)
Euro Information7 avis - Nantes (44)","['Nantes (44)', 'CDI']",ANALYSTE DEVELOPPEUR WEB (H/F),Euro Information,- Nantes (44),CDI,null,"il y a 4 mois
- Continuer pour postuler
Signaler cette offre d'emploi",Développeur C#,Nantes,"Présentation de la société
Euro Information, filiale Informatique du groupe Crédit Mutuel, conçoit, réalise, maintient et exploite un système d’information commun utilisé par le Groupe.

Les activités de développement et de production informatique au niveau national et international sont assurées par environ 2900 salariés répartis sur plusieurs sites géographiques au niveau national : Strasbourg, Nancy, Dijon, Orléans, Lyon, Lille, Cergy, Val de Fontenay, Paris et Nantes.
Mission principale
L’équipe Outils de Pilotage, qui fait partie du domaine Pilotage, a pour mission la conception, le développement et la maintenance des outils informatiques venant en complément des outils de suivi de base du contrôle de gestion.

Elle compte dans ses applications une plateforme Cartographique en partenariat avec un éditeur réputé sur la place. Cela nécessite un travail d’intégration de progiciel mais également d’interface WEB entre notre système d’information et les restitutions faisant apparaitre des cartes.

Le poste comporte également une partie assistance utilisateur et une intégration de données très diversifiées dans des bases de données spécifiques, le Système d’Information Géographique.
Pour intégrer et développer ce pôle Cartographie, nous recherchons un analyste développeur.
Activités et tâches spécifiques
Au sein du pôle Cartographie vous serez chargé de :
mettre en œuvre des progiciels au travers de projets d’intégration
respecter les objectifs fixés, les budgets et délais
recueillir et analyser les besoins du client
assurer le support client
participer aux relations avec l’éditeur de logiciels et les autres équipes
mettre en œuvre la démarche qualité en vigueur dans l’entreprise
Connaissances et compétences
De formation bac+4/+5, vous êtes expérimenté ou débutant avec une première expérience réussie lors de stage.

Connaissances appréciées : C#, .NET, HTML, Grand Système IBM. Vous êtes ouvert pour apprendre et être formé à de nouveaux langages de développement.

Une ou plusieurs des connaissances suivantes seraient un atout supplémentaire :
Shell script bash (scripting LINUX)
Python
Utilisation du format de fichier json
WebFOCUS
Savoir-être - savoir-faire
Vous souhaitez vous investir pleinement dans un périmètre porteur afin d’atteindre rapidement un fort degré d’autonomie et de maîtrise fonctionnelle.

Vous possédez le goût des contacts, une réelle aptitude à communiquer, et appréciez de travailler en équipe.

Vous faites preuve d’initiatives et d’esprit de synthèse.
Autres informations
Le poste basé à Nantes est à pourvoir immédiatement."
130,https://www.indeed.fr/jobs?q=D%C3%A9veloppeur%20C%23&l=Nantes&radius=100&sort=date&limit=50&start=100&vjk=016130c0ca896105,"ANALYSTE DEVELOPPEUR WEB (H/F)
Crédit mutuel449 avis - Nantes (44)","['Nantes (44)', 'CDI']",ANALYSTE DEVELOPPEUR WEB (H/F),Crédit mutuel,- Nantes (44),CDI,null,"il y a 4 mois
- Continuer pour postuler
Signaler cette offre d'emploi",Développeur C#,Nantes,"L’équipe Outils de Pilotage, qui fait partie du domaine Pilotage, a pour mission la conception, le développement et la maintenance des outils informatiques venant en complément des outils de suivi de base du contrôle de gestion.

Elle compte dans ses applications une plateforme Cartographique en partenariat avec un éditeur réputé sur la place. Cela nécessite un travail d’intégration de progiciel mais également d’interface WEB entre notre système d’information et les restitutions faisant apparaitre des cartes.

Le poste comporte également une partie assistance utilisateur et une intégration de données très diversifiées dans des bases de données spécifiques, le Système d’Information Géographique.
Pour intégrer et développer ce pôle Cartographie, nous recherchons un analyste développeur.
Activités et tâches spécifiques
Au sein du pôle Cartographie vous serez chargé de :
mettre en œuvre des progiciels au travers de projets d’intégration
respecter les objectifs fixés, les budgets et délais
recueillir et analyser les besoins du client
assurer le support client
participer aux relations avec l’éditeur de logiciels et les autres équipes
mettre en œuvre la démarche qualité en vigueur dans l’entreprise
Connaissances et compétences
De formation bac+4/+5, vous êtes expérimenté ou débutant avec une première expérience réussie lors de stage.

Connaissances appréciées : C#, .NET, HTML, Grand Système IBM. Vous êtes ouvert pour apprendre et être formé à de nouveaux langages de développement.

Une ou plusieurs des connaissances suivantes seraient un atout supplémentaire :
Shell script bash (scripting LINUX)
Python
Utilisation du format de fichier json
WebFOCUS
Savoir-être - savoir-faire
Vous souhaitez vous investir pleinement dans un périmètre porteur afin d’atteindre rapidement un fort degré d’autonomie et de maîtrise fonctionnelle.

Vous possédez le goût des contacts, une réelle aptitude à communiquer, et appréciez de travailler en équipe.

Vous faites preuve d’initiatives et d’esprit de synthèse.
Autres informations
Le poste basé à Nantes est à pourvoir immédiatement.
Retour"
131,https://www.indeed.fr/jobs?q=D%C3%A9veloppeur%20C%23&l=Nantes&radius=100&sort=date&limit=50&start=100&vjk=3d6dbe0729e23026,"Architecte Web (H/F)
Altran358 avis - Nantes (44)",['Nantes (44)'],Architecte Web (H/F),Altran,- Nantes (44),null,null,"il y a 5 mois
- Continuer pour postuler
Signaler cette offre d'emploi",Développeur C#,Nantes,"Contexte :

Dans le cadre du développement de notre pôle d’expertise Digital sur la région Ouest, nous recherchons des Architectes Web.
Vos responsabilités
Missions :

Sur des projets d’envergure et à haute teneur technique, vous serez responsable de la bonne réalisation des activités suivantes :

Participation aux réponses à appels d’offre
Mise en place des socles techniques
Accompagnement et formation des développeurs
Support technique N3
Participation à la veille active sur les technologies Web
Votre profil
Profil :

Vous avez minimum 10 ans d’expérience. D’un naturel curieux et rigoureux, vous avez un attrait naturel pour les technologies web.

Vous avez une expérience significative dans le domaine du développement/architecture et disposez des compétences suivantes :

Développement, Intégration Continue, Automatisation
Esprit d’analyse, capacités de synthèse
Bon relationnel, sens de la communication et de l’animation d’équipe
Rigueur et sens de l’organsastion
Forte autonomie, adaptabilité et réactivité
Sens de la satisfaction client

Compétences :

HTML, CSS, Jquery, Angular, NodeJs, ReactJs, VueJs, Bootstrap
PHP, Symfony, Drupal
Java EE, Spring, Struts, Hibernate
C#, .NET
GIT, Jenkins, Maven, Sonar, Docker
Environnement Big Data, NoSQL

N’hésitez plus, et rejoignez une équipe dynamique et innovante placée sous le signe de l’expertise et du partage !

Ce poste est ouvert aux personnes en situation de Handicap."
132,https://www.indeed.fr/jobs?q=D%C3%A9veloppeur%20C%23&l=Nantes&radius=100&sort=date&limit=50&start=100&vjk=b9310ae916fd992b,"Développeur Web Front/Back – H/F
Altran358 avis - Nantes (44)",['Nantes (44)'],Développeur Web Front/Back – H/F,Altran,- Nantes (44),null,null,"il y a 5 mois
- Continuer pour postuler
Signaler cette offre d'emploi",Développeur C#,Nantes,"Contexte :
Dans le cadre du développement de notre pôle d’expertise Digital sur la région Ouest, nous recherchons des Développeurs Web Front/Back
Vos responsabilités
Missions :
Participation à la rédaction des spécifications
Tests Unitaires
Développement de nouvelles fonctionnalités
Maintenance et support technique
Gestion de la relation client
Votre profil
Profil :
Minimum 1 an d’expérience en Développement Web
Organisation, rigueur, pragmatisme, ténacité et autonomie
Qualités relationnelles, sens de l’écoute,
Excellentes compétences rédactionnelles

N’hésitez plus, et rejoignez une équipe dynamique et innovante placée sous le signe de l’expertise et du partage !

Compétences :
HTML, CSS, Jquery, Angular, NodeJs, ReactJs, VueJs, Bootstrap
PHP, Symfony, Drupal
Java EE, Spring, Struts, Hibernate
C#, .NET
GIT, Jenkins, Maven, Sonar, Docker
Environnement Big Data, NoSQL

Ce poste est ouvert aux personnes en situation de Handicap."
133,https://www.indeed.fr/jobs?q=D%C3%A9veloppeur%20C%23&l=Nantes&radius=100&sort=date&limit=50&start=100&vjk=442c5ef86c794f4b,"Développeur ERP / SQL spécialisé EDI (H/F)
OCTAVE3 avis - Angers (49)",['Angers (49)'],Développeur ERP / SQL spécialisé EDI (H/F),OCTAVE,- Angers (49),null,null,"il y a 5 mois
- Continuer pour postuler
Signaler cette offre d'emploi",Développeur C#,Nantes,"Descriptif du poste
Afin d’accompagner notre croissance et contribuer à la performance opérationnelle de nos 250 clients, nous recherchons plusieurs développeurs ERP/SQL.
En étroite collaboration avec les équipes projets (pilotes et chefs de projets), vous participez aux différentes étapes de mise en place des différents connecteurs EDI avec les systèmes tiers :
Analyse
Rédaction de spécifications fonctionnelles et techniques
Réalisation des développements
Participation aux phases de recette
Accompagnement à la mise en production
En parallèle, vous participez au maintient des connecteurs déjà en place, à l’amélioration de la qualité et l’évolution de nos standards (amélioration de la fiabilité et des temps de traitements, entre autres).
Profil recherché
Les technologies Microsoft n’ont plus de secret pour vous !
Vous avez un bon niveau d’expertise dans la programmation SQL SERVER.
Vous maîtrisez également le langage C# et Visual Studio.
Parmi vos qualités personnelles, vous devrez faire preuve d’esprit d’équipe, de rigueur, de réelles capacités relationnelles et rédactionnelles.
Infos clés
Rémunération : selon compétences et expériences,
Poste à temps plein en CDI,
Poste proposé en télétravail. Le centre technique est basé à Angers où une présence sera nécessaire lors de la prise de connaissance initiale et pour participation ponctuelle à des réunions,
Poste ouvert aux personnes en situation de handicap."
134,https://www.indeed.fr/jobs?q=D%C3%A9veloppeur%20C%23&l=Nantes&radius=100&sort=date&limit=50&start=100&vjk=20d2ba7fc02ca3c4,"Développeur C# .Net H/F
Groupe PROSERVIA - Rennes (35)","['Rennes (35)', 'CDI']",Développeur C# .Net H/F,Groupe PROSERVIA,- Rennes (35),CDI,null,"il y a 5 mois
- Continuer pour postuler
Signaler cette offre d'emploi",Développeur C#,Nantes,"Description du poste
Vous recherchez un job de développeur .NET / C# ? L’informatique, c’est plus qu’un métier pour vous, c’est une véritable passion ? Vous avez envie d’apprendre des nouveaux langages ? Pas un pas de plus, vous êtes au bon endroit : bienvenue chez PROSERVIA !
VOTRE MISSION :
Du développement Web (ASP.net, C#, JQuery, Angular 2, HTML…),
Du développement Client-Serveur (WPF, Winforms),
Du développement PL/SQL,
Des architectures N-Tiers (WCF, Webservices, API) et base de données relationnelle Oracle (Framework Entities),

Des connaissances en Crystal Report seraient un plus.
Description du profil
L’essentiel pour nous, c’est que vous ayez envie de réaliser des projets.
Vous avez au minimum un BAC +3 en informatique
Vous êtes plutôt autonome, touche à tout et curieux
Les langages évoluent et vous aussi ! Vous êtes toujours à l’affût des news du secteur !
Présentation entreprise
Proservia, marque de ManpowerGroup depuis 2011, est un acteur reconnu sur le marché des Entreprises de Services du Numérique (ESN). Multi-spécialiste en solutions IT et Télécom, Proservia a pour ambition de devenir le leader européen du End-User Services. En tant qu’employeur Responsable, Proservia s’engage à contribuer au développement de l’employabilité de ses collaborateurs. Créée en 2018, Proservia Académie accompagne les collaborateurs au travers de parcours de formations adaptés et sur mesure.
Chiffres clefs :
Présence dans 16 pays d’Europe
7 000 collaborateurs en Europe
18 agences en France
Plus de 3 000 collaborateurs en France
166 millions d’euros de CA en 2018"
135,https://www.indeed.fr/jobs?q=D%C3%A9veloppeur%20C%23&l=Nantes&radius=100&sort=date&limit=50&start=100&vjk=63a08c2e656a89cc,"Développeur informatique WinDev H/F
Axemploi Recrutement2 avis - Nantes (44)","['Nantes (44)', '30 000 € - 40 000 € par an']",Développeur informatique WinDev H/F,Axemploi Recrutement,- Nantes (44),30 000 € - 40 000 € par an,30 000 € - 40 000 € par an,"il y a 5 mois
- Continuer pour postuler
Signaler cette offre d'emploi",Développeur C#,Nantes,"DEVELOPPEUR INFORMATIQUE WINDEV H/F

Dans un cadre de travail agréable et moderne, une culture d'entreprise internationale, en synergie avec la direction technique des logiciels, au sein d'une équipe d'une quinzaine de personnes, vos missions sont de :

. Écouter, observer, dialoguer avec les Chefs de projets et l'équipe de développeurs
. De façon progressive assurer des développements spécifiques et de personnalisation à la demande des clients tels des états clients, éléments pour les commandes, BL, factures etc… sous le langage WinDev pour 90% du temps de travail et ponctuellement en C# / Dotnet.
. S'autocontrôler et procéder aux tests fonctionnels
. En cas de nécessité, vous irez ponctuellement chez des clients en France et à l'international
. Participer aux réunions et formations nécessaires pour ce poste
. Reporter à votre hiérarchie et aux chefs de projets concernés pour l'avancée des développements.
L’entreprise

Nantes, 44, Pays-de-Loire - Ce dynamique éditeur de solutions logicielles avancées de type MES Manufacturing Execution System fait partie des leaders mondiaux dans son créneau d'expertise. Il confie à Axemploi Conseil en recrutement depuis 25 ans, ce poste de Développeur Informatique WinDev H/F qui s'inscrit dans la dynamique d'évolution de ses solutions logicielles associée à d'importants nouveaux marchés internationaux.
Le profil expert recherché

(H/F) Diplômé (e) de Bac + 2 à + 3, DUT, BTS, Licence, en informatique, vous maitrisez le développement sous WinDev d'applications logicielles de type ERP, EMS ou autres et présentez un parcours significatif de développeur, développeuse idéalement, chez un éditeur de logiciels destinés aux industries ou aux professionnels.
Vous pratiquez l'anglais professionnel pour échanger avec les clients internationaux. En cas de nécessité vous aurez l'opportunité de vous déplacer ponctuellement en France, Europe et à l'international pour de courtes durées.
Vous êtes titulaire d'un permis de conduire B valide.

Vous bénéficierez d'un poste en CDI, dans une ambiance et un cadre de travail agréable avec place de parking, d'une rémunération attractive à la hauteur de vos compétences et de réelles perspectives d'évolution selon vos compétences.

Vous souhaitez évoluer, rejoindre une entreprise performante, vous installez sur la région nantaise ?
Missionné en exclusivité, Axemploi, vous garantit la plus totale discrétion et réponse.
Merci de transmettre votre candidature, CV, lettre de motivation en format .doc"
136,https://www.indeed.fr/jobs?q=D%C3%A9veloppeur%20C%23&l=Nantes&radius=100&sort=date&limit=50&start=100&vjk=600e3c989df51998,"Développeur C C++ environnement industriel H/F
Axemploi Recrutement2 avis - Nantes (44)","['Nantes (44)', '35 000 € - 45 000 € par an']",Développeur C C++ environnement industriel H/F,Axemploi Recrutement,- Nantes (44),35 000 € - 45 000 € par an,35 000 € - 45 000 € par an,"il y a 5 mois
- Continuer pour postuler
Signaler cette offre d'emploi",Développeur C#,Nantes,"DÉVELOPPEUR C/C++ (H/F) - ENVIRONNEMENT INDUSTRIEL

En relations avec le responsable des développements en informatique industrielle, dans un contexte convivial et une culture internationale, vos principales missions seront de :

. Développer en langage C/C++ des interfaces avec des lignes de production et machines CN
. Améliorer la maintenance de librairies C/C++ industrielles
. Développer des algorithmes d'optimisation, des drivers de téléchargements destinés aux machines
. Réaliser les tests d'intégration
. Gérer les paramètres et la configuration de projets industriels
. Assurer le support client et apporter les modifications correctives
. Rédiger la documentation en anglais
. Participer progressivement au développement de fonctionnalités industrielles en C#/.dotnet
. Se rendre ponctuellement chez des clients en France et à l'international.
L’entreprise

44 Nantes, Pays-de-Loire - Cette entreprise de culture internationale est reconnue pour la qualité de ses partenariats avec de grands acteurs industriels. Elle conçoit et développe des solutions liées à l'informatique industrielle qui dialoguent avec des machines et lignes de production englobant des commandes numériques et leurs périphériques. Elle crée ce poste lié à sa dynamique de croissance et sa notoriété internationale
Le profil expert recherché

H/F : vous êtes de formation de type Bac + 2 + 3 : DUT, BTS, Licence en Informatique industrielle ou automatismes.
Vous avez 5 à 10 ans de développement d'applications ou d'interfaces pour des lignes de production, machines à commandes numériques, avec supervision, acquise soit au sein d'une SSII, ou d'un constructeur de lignes de process automatisés ou chez un éditeur de solutions logicielles d'informatique industrielle.

Ce poste très intéressant et évolutif nécessite de s'exprimer et de rédiger en anglais technique pour échanger avec les clients internationaux. En cas de nécessité vous aurez l'opportunité de vous déplacer ponctuellement en France, Europe et à l'international pour de courtes durées. Vous êtes titulaire d'un permis de conduire B valide.

Vous maîtrisez le développement en langages C/C++ la pratique du C#/.dotnet sera un plus apprécié.

Vous souhaitez évoluer, donner une nouvelle dimension à votre carrière ? Nous vous offrons un CDI, une rémunération motivante et évolutive.
De réelles possibilités d'évolution sont possibles selon vos compétences.

Merci de transmettre votre candidature, CV, lettre de motivation en format .doc à Axemploi, missionné en exclusivité, qui vous garantit la plus totale discrétion et réponse."
137,https://www.indeed.fr/jobs?q=D%C3%A9veloppeur%20C%23&l=Nantes&radius=100&sort=date&limit=50&start=100&vjk=415d00b6492b4a01,"Architecte Front-end H/F
VeoNum - Rennes (35)",['Rennes (35)'],Architecte Front-end H/F,VeoNum,- Rennes (35),null,null,"il y a 5 mois
- Continuer pour postuler
Signaler cette offre d'emploi",Développeur C#,Nantes,"Développeur Outil de déploiement Cloud H/F
Architecte Front-End H/F.
Dans le cadre de notre développement, nous sommes à la recherche d’un ingénieur développement front-end. Tu disposes d’une très bonne connaissance en Angular 4+, et tu t’es intéressé aux autres solutions du marché : ReactJS, Vue.js.
Vos activités principales au quotidien
Tes activités principales seront :
Faire valoir ton expertise et donc ta capacité à convaincre sur le choix de la solution,
Réaliser les développements inhérents à la mise en place du framework,
Travailler en équipe et interagir avec les développeurs Back-end,
Participer à la recette des applications concernées,
Pré-requis
Pré-requis :
Une bonne maitrise d’un langage objet (Java, C#, …),
Une très bonne connaissance d’Angular version 4,
Un zeste de curiosité en ce qui concerne la veille techno,
Au-delà de l’expertise technique, nous privilégions les qualités relationnelles, l’autonomie et le sens du service.Il va de soi qu’une candidature disposant de plus de 2 ans d’expérience en Angular 4 nous semblerait suspecte … En revanche vous avez le droit de disposer de plusieurs années d’expérience sur les différentes versions de ce framework.
Le poste est basé à Rennes."
138,https://www.indeed.fr/jobs?q=D%C3%A9veloppeur%20C%23&l=Nantes&radius=100&sort=date&limit=50&start=100&vjk=66ad2449d809e164,"Chef de Projet Développeur Logiciel H/F - Intégration de solution informatique
Page Personnel FR202 avis - Loire-Atlantique",['Loire-Atlantique'],Chef de Projet Développeur Logiciel H/F - Intégration de solution informatique,Page Personnel FR,- Loire-Atlantique,null,null,"il y a 5 mois
- Continuer pour postuler
Signaler cette offre d'emploi",Développeur C#,Nantes,"Rattaché au Directeur technique, en qualité de Chef de Projet Développeur Logiciel, votre activité sera principalement focalisée sur de la gestion de projet et du développement logiciel.

Plus précisément, vos principales missions seront les suivantes :
Gestion des projets clients intégrant une activité de développement logiciel (planification et supervision du projet, relation client, réunions téléphoniques, déplacements sur site),
Rédaction de l'analyse fonctionnelle (définition et description des interfaces graphiques clients, description du fonctionnel métier, description du mode et de l'interface de communication),
Gestion des produits/solutions informatiques (gestion des roadmaps, validation technique des évolutions matériels, gestion de projets, présentation/démonstration client, propositions de nouvelles solutions packagées/maquettage...).

En qualité de Chef de Projet Développeur Logiciel, vous serez amené à travailler en relation étroite avec les équipes techniques et les équipes commerciales pour la gestion de projets de développement logiciel client.

PME dynamique spécialisée dans l'intégration de solution informatique

Gestion des projets clients intégrant une activité de développement logiciel

Issu d'une formation réseau de type Bac +3 minimum, vous possédez au moins une première expérience en gestion de projets.

Vous possédez une expérience comme Développeur (C#, JAVA, HTML5, Microsoft .net/Visual Studio/ASP NET Core, Android Studio).

Vous connaissez l'environnement de développement mobile (Android et Windows) et en bases de données (SQL).

Doté d'un bon relationnel, vous parlez anglais."
