,id,meta1,meta2,titre_poste,entreprise,localisation,contrat,salaire,date_publication,keyword_metier,keyword_localisation,description
76,https://www.indeed.fr/jobs?q=D%C3%A9veloppeur%20C%23&l=Nantes&radius=100&sort=date&limit=50&start=50&vjk=c0e19d7bd9809ca3,"Développeur Déploiement .NET (H/F)
Eurofins France Agro-Alimentaire - Nantes (44)",['Nantes (44)'],Développeur Déploiement .NET (H/F),Eurofins France Agro-Alimentaire,- Nantes (44),null,null,"il y a 30+ jours
- Continuer pour postuler
Signaler cette offre d'emploi",Développeur C#,Nantes,"Job Description

Le Service / Département IT Solutions Europe Sud-Ouest a pour mission de concevoir, développer, déployer et maintenir les solutions applicatives soutenant l’ensemble de la chaîne de production de nos laboratoires. Nous intervenons sur les laboratoires de France, Italie, Espagne, Belgique et Pays-Bas.
L’équipe de développement, composée de 15 personnes, est au cœur de ce service. Elle est organisée en petites équipes SCRUM.
Le Service / Département IT Solutions Europe Sud-Ouest recherche un Développeur afin d’intégrer l’équipe en charge du développement et déploiement de notre solution cœur eLIMS « Electronic Laboratory Information Management System ».

Au sein d’une équipe projet internationale et pluridisciplinaire, composée de 4 analystes fonctionnels (Nantes), 2 développeur déploiement (Nantes) et 4 développeurs logiciel (Inde), vous intégrez l’équipe en tant que développeur déploiement.
Les projets de déploiement ont pour objectif d’implanter notre solution cœur eLIMS au sein des laboratoires intégrant notre périmètre (Europe Sud-Ouest). Notre système eLIMS est une solution entièrement développée en interne et qui permet de gérer l’ensemble du cycle de vie d’un échantillon : de la réception de l’échantillon à analyser à l’envoi du rapport d’analyse à nos clients, en passant par la production dans le laboratoire.
Mission principale :
Préparer et déployer la solution sur les environnements de Qualification, Préproduction puis Production lors du Go-Live du projet. En lien avec l’analyste fonctionnel et le laboratoire, vous contribuez activement aux phases de test.
Adapter la solution au contexte local de chaque projet de déploiement, en apportant les développements nécessaires.
Concevoir et développer les outils pour automatiser au maximum les déploiements.
Assurer la bonne communication entre tous les acteurs techniques et fonctionnels de l’équipe. Vous êtes le relai entre l’analyste fonctionnel et les équipes techniques (développement et infrastructure).
Assurer le support de niveau 3 de vos réalisations.
Pour cela vous devrez :
Acquérir une bonne compréhension du métier, des processus « business » ainsi que les interactions avec eLIMS.
Vous approprier l’architecture et l’écosystème technique de la solution.
Travailler en étroite collaboration avec les autres parties prenantes d’un projet de déploiement : analyse fonctionnel, référent laboratoire, développeurs logiciels (Inde), équipe infrastructure.

Qualifications

En tant que développeur déploiement, vous participez aux projets de déploiement depuis sa planification jusqu’à la mise en place et stabilisation de la solution, aussi vous faites preuve de :
Appétence pour le terrain, capacité à prendre en compte le contexte métier local du laboratoire.
Adaptabilité et organisation dans votre travail ; les contextes de déploiement requièrent flexibilité, méthode et rigueur.
Exigence vis-à-vis de la qualité, la maintenabilité, la déployabilité, l’opérabilité et l’efficacité de vos développements. Vous documentez votre travail.
Aisance à travailler avec le métier (les laboratoires) et des équipes à l’international en anglais (Europe, Inde).
Votre bagage technique se compose de :
5 ans d’expérience minimum en développement Microsoft .NET, C#, VB6. La compréhension du VB6 et des scripts est nécessaire, mais les nouveaux développements se font en C#.
Expérience significative dans le déploiement en production et maintenance des solutions informatiques.
Bonne connaissance des bases de données et du langage SQL Server.
Connaissances de solutions de reporting appréciées (SSRS, Crystal Report).
Anglais parlé et écrit.

Additional Information

null"
77,https://www.indeed.fr/jobs?q=D%C3%A9veloppeur%20C%23&l=Nantes&radius=100&sort=date&limit=50&start=50&vjk=59f0942018059e57,"Développeur .NET H/F
EXTERNATIC4 avis - Nantes (44)","['Nantes (44)', 'CDI']",Développeur .NET H/F,EXTERNATIC,- Nantes (44),CDI,null,"il y a 29 jours
- Continuer pour postuler
Signaler cette offre d'emploi",Développeur C#,Nantes,"DESCRIPTION DE L'OFFRE
Externatic, le hub d'opportunités IT et web dans l'ouest.

Avec une approche de facilitateur de carrière, nous vous trouvons des postes chez des clients finaux (éditeur, DSI, startup, agences digitales, etc. => pas de SSII) depuis 2010.

Notre mission : vous trouver le job de vos rêves.
-
Editeur de logiciel qui existe depuis 15 ans, développe des solutions de gestion financière (gestion de trésorerie, communication bancaire, gestion des financements) à plus de 450 clients. Ainsi 1 100 utilisateurs issus d’entreprises de toutes tailles et de tous secteurs d’activités travaillent quotidiennement sur leurs outils.
Dans le cadre de son développement, ils renforcent leur équipe de développeurs et recherche :
1 développeur .NET H/F
Au sein de l'équipe, vous participez aux missions suivantes :
Participer au design et à la conception technique des solutions, en implémentant de nouvelles fonctionnalités
Participer à la mise en production (maintenance corrective et évolutive)
Développement de nouvelles fonctionnalités
La réalisation des tests unitaires, fonctionnelles et d'intégration
PROFIL REQUIS
De formation supérieure en informatique de niveau bac +2 minimum, vous justifiez d'une expérience significative d’un an minimum dans le développement WEB en .NET ou PHP.


Une connaissance ou un intérêt pour les domaines de la gestion financières et/ou la comptabilité serait un plus.
Vous disposez idéalement de bonnes bases en :
Visual Studio
C#
JavaScript / Jquery
HTML5/CSS3


En complément, des connaissances dans les technologies suivantes seront appréciées :
ASP.NET MVC ou Symfony
MySQL /Oracle/SQL Server
D’un naturel curieux et ouvert d’esprit, vous souhaitez participer à une aventure entrepreneuriale au sein d’une équipe à taille humaine.
Votre capacité d’adaptation, votre autonomie ainsi que votre esprit d’équipe seront vos atouts.

Mathieu DEBROISE, votre interlocuteur chez Externatic.
Mon but est de vous accompagner dans votre recherche d'opportunité professionnelle pour vous trouver le poste correspondant à chacun de vos critères dans un panel de plus de 170 clients finaux sur la région Ouest.
N'hésitez pas à me contacter sur la page "" qui sommes-nous "" sur le site Externatic pour échanger sur ce poste et plus généralement sur votre carrière."
78,https://www.indeed.fr/jobs?q=D%C3%A9veloppeur%20C%23&l=Nantes&radius=100&sort=date&limit=50&start=50&vjk=c37a334174bf93d8,"DEVELOPPEUR .NET (H/F)
Oriégo - Angers (49)","['Angers (49)', 'CDI']",DEVELOPPEUR .NET (H/F),Oriégo,- Angers (49),CDI,null,"il y a 30+ jours
- Continuer pour postuler
Signaler cette offre d'emploi",Développeur C#,Nantes,"Missions : Sous la responsabilité du Responsable Projets, le développeur sera en charge :
La réalisation des spécifications selon le cahier des charges clients
Le développement de nouvelles fonctionnalités
Puis, progressivement il sera amené intervient en autonomie sur les différentes étapes du projet en lien direct avec les clients. Pour cela, en plus du développement, il aura les missions suivantes :
L’audit client afin d’analyser le besoin
Le recettage avec le client final
Le déploiement de la solution chez le client
La gestion de la maintenance en lien avec les techniciens support
Profil : Vous disposez d’une formation supérieure en informatique (Bac +3) et d’une première expérience de 2 à 3 ans vous ayant permis de développer une bonne connaissance des technologies modernes, en particulier ASP.Net core, langage dotnet (C# ou Visual Basic .Net), Visual Studio, SQL Server, vous est indispensable pour réussir votre mission.
La connaissance des logiciels Sage ligne 100 (gestion et comptabilité) et EBP serait un plus.
Une première expérience dans la mise en œuvre des solutions métiers, en particulier dans les domaines de gestion commerciale et comptabilité serait également un atout supplémentaire.
Vos qualités organisationnelles, rédactionnelles et relationnelles vous permettront de vous adapter facilement aux différentes missions qui vous seront confiées.
Salaire : A négocier selon profil"
79,https://www.indeed.fr/jobs?q=D%C3%A9veloppeur%20C%23&l=Nantes&radius=100&sort=date&limit=50&start=50&vjk=d84aee2b51423286,"Ingénieur Etudes et Développement .NET H/F
Sodifrance-Netapsys - Angers (49)",['Angers (49)'],Ingénieur Etudes et Développement .NET H/F,Sodifrance-Netapsys,- Angers (49),null,null,"il y a 30+ jours
- Continuer pour postuler
Signaler cette offre d'emploi",Développeur C#,Nantes,"Job Description

Passionnés par les technologies (Java, .NET, Web, API, Data…), les 30 consultants de l’agence se veulent sérieux sans se prendre au sérieux. C’est aussi pourquoi il règne un parfum de bonne humeur et de convivialité qui ne les empêche pas pour autant d’être impliqués dans leurs projets et de donner le meilleur d’eux-mêmes pour leurs clients.
Notre #TeamAngevine est prête à accueillir un(e) Ingénieur(e) Etudes et Développement .NET pour intégrer un projet qui consiste à fournir à notre client une interface métier intégrée au poste de travail bancaire multifonctions permettant la souscription de contrats d’assurances vie et de prévoyance, la gestion du portefeuille de leurs clients, des différentes opérations effectuées ainsi que des dossiers Décès et de leurs bénéficiaires.
Au programme : du C# .Net 4.5, ASP, IIS, Webservices SOAP, HTML, Javascript et d’autres compétences complémentaires qui peuvent être utiles : Java, Oracle, SQL Server.
La team travaille en méthode Agile SCRUM et est actuellement composée de 3 développeur(euse)s ainsi que Jérôme, le Scrum Master.

Qualifications

Vous possédez une expérience significative en développement C# .NET au sein d'une équipe projet.

Additional Information

FullStack et passionnés
La nature des projets pris en charge à l’agence amène constamment les consultants à étendre le périmètre de leurs compétences. Passionnés par les technologies, rien ne les arrête. Ils ont un sens exacerbé du challenge, jusqu’alors rien ne leur a résisté.
Collectif et sportif
Il y a évidemment des afterwork et des soirées organisées mais pour garder la forme et cultiver l’esprit d’équipe, les consultants warriors de l’agence, n’hésitent pas à se lancer des défis sportifs. Les derniers en date, une participation au Marathon Relais ou encore au Dark Games."
80,https://www.indeed.fr/jobs?q=D%C3%A9veloppeur%20C%23&l=Nantes&radius=100&sort=date&limit=50&start=50&vjk=3e2c128bf9193dcd,"Développeur Full Stack H/F - Start-up en croissance
Page Personnel FR202 avis - Rennes (35)",['Rennes (35)'],Développeur Full Stack H/F - Start-up en croissance,Page Personnel FR,- Rennes (35),null,null,"il y a 28 jours
- Continuer pour postuler
Signaler cette offre d'emploi",Développeur C#,Nantes,"Intégré au sein d'une équipe d'une dizaine de Développeurs Full Stack, vous développez avec eux plusieurs briques essentielles au service de notre client et perfectionnez l'architecture du système.

Vous intervenez aussi bien sur son site web et son application mobile que sur son back-office et ses API.

Vous rejoignez une équipe composée de Développeurs Polyvalents, d'un Product Owner et du CTO pour assurer les missions suivantes :
Travailler au quotidien au développement des différentes briques du système,
Participer aux réflexions d'architecture,
Interagir avec les équipes métiers,
Impliquer dans le développement de produits innovants qui rendent de vrais services,
Faire partie d'une équipe où tout le monde sait tout faire, mais où chacun a ses spécialités et en fait bénéficier les autres.

Outils utilisés : En majorité les technologies Microsoft et web (ASP.NET MVC, Visual Studio, Azure, HTML, CSS, JavaScript, TypeScript) ; mais aussi React, SQL, NoSQL, Elasticsearch, Git, GitFlow, Selenium, SpecFlow, micro-services, JIRA ;une usine d'intégration continue Jenkins pour tester et déployer fréquemment ; des outils développés en interne pour vous faciliter la vie.

Start-up en croissance, environnement stimulant

Développement Full Stack

Avant tout curieux et passionné par les nouvelles technologies, vous êtes motivé par les projets innovants et vous souhaitez participer activement à leur réalisation.

Vous aimez vous investir dans de nouveaux challenges et partager une aventure avec une équipe dynamique et sympathique. Nous sommes sensibles à votre volonté d'apprendre et de progresser.Vous êtes à l'aise avec l'objet (un premier contact avec .NET/C# ou Java est un plus), HTML, CSS, JavaScript et les bases de données relationnelles."
81,https://www.indeed.fr/jobs?q=D%C3%A9veloppeur%20C%23&l=Nantes&radius=100&sort=date&limit=50&start=50&vjk=905fe4254bce7ed1,"Expert Back end .net core H/F
EXTERNATIC4 avis - Nantes (44)","['Nantes (44)', 'CDI']",Expert Back end .net core H/F,EXTERNATIC,- Nantes (44),CDI,null,"il y a 30+ jours
- Continuer pour postuler
Signaler cette offre d'emploi",Développeur C#,Nantes,"DESCRIPTION DE L'OFFRE
Externatic, provocateur de changement !
Cabinet de recrutement technologique nous vous accompagnons pour vous trouver des postes chez des clients finaux (startup, éditeur, DSI, agences digitales, etc. => pas de SSII / ESN). Chaque offre d’emploi correspond à un poste réel.
Attention, belle opportunité à saisir !!!
Pourquoi ce job ?
Une entreprise de 150 personnes présente à l’international édite des solutions SaaS. Les technologies sont utilisées par des centaines de clients, notamment des grands comptes.
Le management y est très horizontal, l’entreprise est "" libérée "". En environnement de travail agile, l'implication des salariés dans les décisions est importante, etc.
Venez rejoindre le pôle nantais et son équipe technique de 50 personnes. Au sein de locaux agréable, en plein centre de Nantes, vous pourrez prendre part à des projets passionnants.

Vos missions
En tant que développeur expert H/F :
Vous intégrez le pôle d'expertise technique transverse aux différentes équipes.
Vous développez les librairies utilisées par les équipes back end de l'entreprise
Vous intervenez sur les phases d'architecture, en assistance technique sur des problématiques précises (performance, scalabilité, API, hébergement données en contexte international, micro services, cloud, devops, etc.).
Environnement technique :
.NET Core C#
Angular 8 / TypeScript
API REST
SQL Server
Jenkins
Zapier
HTML
CSS

PROFIL REQUIS
Vous avez pu développer une expertise sur les problématiques .Net (+5 ans d'expérience)
Vous maitrisez .Net core et son environnement (SQL sever, etc.)
Vous aimez transmettre !
Vous avez de bonnes bases en architecture logicielle.
Vous testez votre code, êtes adepte du clean code.
Vous aimez coder, partager, collaborer, challenger vos idées, grandir (en termes de soft skills et hard skills, hein ; l'entreprise ne fournit pas d'hormones de croissance)
Les plus
Centre de Nantes
Nouveau projet / technologies récentes
Entreprise libérée

Mathieu DEBROISE, votre interlocuteur chez Externatic
Chaque année, j'accompagne des candidats, comme vous, dans la définition de leur projet professionnel et la recherche d'un nouveau job.
N'hésitez pas à me contacter pour échanger sur ce poste et plus généralement sur votre carrière (contacts direct disponibles dans la rubrique ""qui sommes nous"" sur le site d'Externatic)."
82,https://www.indeed.fr/jobs?q=D%C3%A9veloppeur%20C%23&l=Nantes&radius=100&sort=date&limit=50&start=50&vjk=00f48f80d60cd005,"Développeur Angular & C# H/F
Arpege - Saint-Sébastien-sur-Loire (44)","['Saint-Sébastien-sur-Loire (44)', 'CDI']",Développeur Angular & C# H/F,Arpege,- Saint-Sébastien-sur-Loire (44),CDI,null,"il y a 30+ jours
- Continuer pour postuler
Signaler cette offre d'emploi",Développeur C#,Nantes,"CDI
Saint-Sébastien-sur-Loire
Dès que possible
Référence : ANG-DEV-NA
Missions et compétences
Après une période de montée en compétences auprès de nos équipes sur la partie fonctionnelle et technique, vous participez activement au développement full stack en mode agile de nos logiciels ainsi qu'à leur maintenance corrective et évolutive.

Vous réaliserez des développements en Angular et C#. Vous apportez votre savoir-faire technique et développerez des compétences nouvelles sur nos environnements techniques : Angular, C#, HTML, Typescript, SQL et base de données PostgreSQL.

En étroite collaboration avec vos collègues (Chef de projet, Développeurs, Graphistes, Testeurs, Product Owner…), vous réalisez la conception, l’analyse et les développements nécessaires à la mise en œuvre des fonctionnalités à la fois sur la partie Back et Front.
Profil
Vous avez une formation en informatique, et vous vous êtes spécialisé(e) dans le développement. Vous justifiez d'au moins une expérience réussie sur une fonction similaire.

Vous avez des compétences avérées en développement orienté objet, et en particulier C#, et sur du développement Web, en particulier Angular.

Pour ce poste, vous devez aimer travailler en équipe et dans la bonne humeur. Un bon relationnel sera un gage de réussite. Vous avez de la curiosité et l’envie de progresser dans un environnement dynamique. Votre capacité d'adaptation, votre énergie et votre motivation seront autant d'atouts qui vous permettront de vous épanouir sur ce poste et chez Arpège.
Informations
Le poste est basé sur les bords de Loire à Saint-Sébastien-sur-Loire dans un environnement de travail agréable. Les bureaux d'Arpège sont accessibles en transports en commun et desservis par des pistes cyclables.

Le poste est à pourvoir dès maintenant, et en fonction des disponibilités du candidat.

Rémunération : fixe + avantages CSE (chèques cadeaux, chèques vacances, enveloppe culture et sports, etc.) + intéressement et participation + prime vacances ...

Vous souhaitez contribuer au projet de développement d'une société reconnue pour sa Créativité et son Innovation, et où l'Humain est au cœur de la culture d'entreprise ? Rejoignez-nous !"
83,https://www.indeed.fr/jobs?q=D%C3%A9veloppeur%20C%23&l=Nantes&radius=100&sort=date&limit=50&start=50&vjk=b480533f7b000730,"Développeur WIndows Serveur. - .Net / C#. - SQL Server. / Freelance
WorldWide People - Nantes (44)","['Nantes (44)', 'Temps plein, Freelance / Indépendant', '325 € par jour']",Développeur WIndows Serveur. - .Net / C#. - SQL Server. / Freelance,WorldWide People,- Nantes (44),"Temps plein, Freelance / Indépendant",325 € par jour,"Freelance-info - il y a 30+ jours
- Continuer pour postuler
Signaler cette offre d'emploi",Développeur C#,Nantes,"Développeur WIndows Serveur. - .Net / C#. - SQL Server. Tâches : .

conception. - réalisation dans un contexte full Agile ou mode AT. . Compétences techniques.
WIndows Serveur. - .Net / C#. - SQL Server. .
. Logistique : . o Lieu mission : Nantes. o Déplacement : Non.

o Temps partiel possible : Non. o Possible à distance : Partiellement."
84,https://www.indeed.fr/jobs?q=D%C3%A9veloppeur%20C%23&l=Nantes&radius=100&sort=date&limit=50&start=50&vjk=e9510bc1b0f88c19,"Développeur d'applications F/H
Vinci Energies103 avis - Rennes (35)","['Rennes (35)', 'CDD']",Développeur d'applications F/H,Vinci Energies,- Rennes (35),CDD,null,"VINCI - il y a 30+ jours
- Continuer pour postuler
Signaler cette offre d'emploi",Développeur C#,Nantes,"Actemium est la marque de VINCI Energies dédiée au process industriel et à la transition digitale des usines. Notre entité Actemium Rennes (85 collaborateurs, CA de 15M€) s'adresse aux sites de production agro-alimentaire, automobile, cosmétique, chimie, télécoms, …et propose des services de conception en contrôle-commande, électricité et informatique industrielle, robotique et mécanique pour améliorer la performance et fiabilité des installations. Nous aimons le challenge technique et apportons des solutions sur mesure aux problèmes auxquels font face les sites industriels : la recherche d’optimisation de la performance des machines et process, un système de pilotage précis et fiable et des informations de production en temps réel.
Pour ce faire, nous avons mis au point un outil cloud de type MES, qui permet de consolider en temps réel les données produites par les automates industriels et les capteurs placés au niveau des machines. Dans le cadre de son déploiement chez nos clients nous recherchons un(e)
Développeur web / informatique industrielle – Junior F/H
Formation Bac+3 ou Bac+5 spécialisée en informatique
Rattaché(e) à notre bureau d’étude informatique industrielle (4 personnes), tu participeras aux développements spécifiques nécessaires à l’adaptation de l’outil MES à l’environnement client.
A partir d’un cahier de charges / analyse fonctionnelle tu développeras les différentes interfaces techniques pour la remontée de données afin de pouvoir visualiser tous les évènements importants de la production : productivité, TRS, analyse des arrêts machine, des alarmes, de la consommation énergétique, ou encore la traçabilité produit …
Grâce à toi, les équipes de production et de maintenance sauront instantanément, quand une machine est en défaut, et pourront identifier la source du problème plus rapidement.

Profil :
Diplômé d’un Bac+3 ou Bac+5 en informatique industrielle ou applications web, tu es passionné(e) de développement sous C#. Tu maitrises les bases de données SQL (SQL Server), communications OPC/ UA, et la programmation sous MS Visual Studio C# ASP.Net MVC. Tu ne les as pas seulement vu à l’école mais déjà mis en œuvre dans le cadre d’un stage ou d’un premier emploi. La connaissance de DevExpress sera un vrai plus. Nous voulons créer une interface moderne, intuitive et apprécions donc les personnes qui accordent de l’importance au graphisme.
CDD de 6 mois qui pourra déboucher sur une création de poste en CDI

Entité de rattachement :
Connexion, performance, efficience énergétique, datas : dans un monde en évolution permanente, VINCI Energies accélère le déploiement des nouvelles technologies pour concrétiser deux mutations majeures : la transformation digitale et la transition énergétique. Ancrées dans les territoires et organisées en mode agile, les entreprises de VINCI Energies rendent les infrastructures d'énergie, de transport et de communication, les usines ainsi que les bâtiments chaque jour plus fiables, plus sûrs, plus efficients. 2018 : 12,6 milliards d'euros (chiffre d'affaires) // 77 500 collaborateurs // 1800 entreprises // 53 pays"
85,https://www.indeed.fr/jobs?q=D%C3%A9veloppeur%20C%23&l=Nantes&radius=100&sort=date&limit=50&start=50&vjk=3b374ad901900eb0,"Développeur.se .Net
onepoint3 avis - Nantes (44)",['Nantes (44)'],Développeur.se .Net,onepoint,- Nantes (44),null,null,"il y a 30+ jours
- Continuer pour postuler
Signaler cette offre d'emploi",Développeur C#,Nantes,"Job Description

Nous recherchons des lead tech et des développeurs full-stack avec des connaissances en :
.NET C# (.net core, .net standard)
Javascript (Angular / ReactJS)
Cloud (Azure, AWS, GCP, ...)
Architectures orientées micro-services
Le tout dans un cadre fortement industrialisé indispensable aux démarches DevSecOps mises en place par nos équipes.

Qualifications

Chez onepoint, nous recherchons des talents engagés, prêts à partager leur expertise dans des collectifs ouverts, et qui n'ont pas peur de prendre des initiatives. Mais aussi capables de se remettre en question.
Au coeur des relations chez onepoint se trouvent l'authenticité et la volonté de toujours tendre vers l'excellence pour nos clients : c'est ce que nous attendons de nos futurs collègues.

Additional Information

null"
